2018,"HiExpan: Task-Guided Taxonomy Construction by Hierarchical Tree Expansion.",KDD,"Jiaming Shen,Zeqiu Wu,Dongming Lei,Chao Zhang 0014,Xiang Ren 0001,Michelle T. Vanni,Brian M. Sadler,Jiawei Han 0001"
2019,"Revisiting kd-tree for Nearest Neighbor Search.",KDD,"Parikshit Ram,Kaushik Sinha"
2016,"Infinite Ensemble for Image Clustering.",KDD,"Hongfu Liu,Ming Shao,Sheng Li 0001,Yun Fu 0001"
1998,"Finding Frequent Substructures in Chemical Compounds.",KDD,"Luc Dehaspe,Hannu Toivonen,Ross D. King"
2018,"TruePIE: Discovering Reliable Patterns in Pattern-Based Information Extraction.",KDD,"Qi Li 0012,Meng Jiang 0001,Xikun Zhang 0001,Meng Qu,Timothy P. Hanratty,Jing Gao 0004,Jiawei Han 0001"
2008,"Anonymizing transaction databases for publication.",KDD,"Yabo Xu,Ke Wang 0001,Ada Wai-Chee Fu,Philip S. Yu"
2013,"Repetition-aware content placement in navigational networks.",KDD,"Dóra Erdös,Vatche Ishakian,Azer Bestavros,Evimaria Terzi"
2002,"Enhanced word clustering for hierarchical text classification.",KDD,"Inderjit S. Dhillon,Subramanyam Mallela,Rahul Kumar"
2011,"Real-time bidding algorithms for performance-based display ad allocation.",KDD,"Ye Chen,Pavel Berkhin,Bo Anderson,Nikhil R. Devanur"
2018,"Data Science for Financial Applications.",KDD,"David J. Hand"
2008,"Bridging centrality: graph mining from element level to group level.",KDD,"Woochang Hwang,Taehyong Kim,Murali Ramanathan,Aidong Zhang"
2009,"Mind the gaps: weighting the unknown in large-scale one-class collaborative filtering.",KDD,"Rong Pan,Martin Scholz"
2013,"A data mining driven risk profiling method for road asset management.",KDD,"Daniel Emerson,Justin Weligamage,Richi Nayak"
2014,"Box drawings for learning with imbalanced data.",KDD,"Siong Thye Goh,Cynthia Rudin"
1999,"Data Mining: Crossing the Chasm (Invited talk, Abstract only).",KDD,"Rakesh Agrawal 0001"
2016,"CompanyDepot: Employer Name Normalization in the Online Recruitment Industry.",KDD,"Qiaoling Liu,Faizan Javed,Matt McNair"
2006,"Utility-based anonymization using local recoding.",KDD,"Jian Xu,Wei Wang 0009,Jian Pei,Xiaoyuan Wang,Baile Shi,Ada Wai-Chee Fu"
2013,"Density-based logistic regression.",KDD,"Wenlin Chen,Yixin Chen,Yi Mao,Baolong Guo"
2020,"GrokNet: Unified Computer Vision Model Trunk and Embeddings For Commerce.",KDD,"Sean Bell,Yiqun Liu 0006,Sami Alsheikh,Yina Tang,Edward Pizzi,M. Henning,Karun Singh,Omkar Parkhi,Fedor Borisyuk"
2017,"A Taxi Order Dispatch Model based On Combinatorial Optimization.",KDD,"Lingyu Zhang,Tao Hu,Yue Min,Guobin Wu,Junying Zhang,Pengcheng Feng,Pinghua Gong,Jieping Ye"
2002,"Mining heterogeneous gene expression data with time lagged recurrent neural networks.",KDD,"Yulan Liang,Arpad Kelemen"
2019,"Clustering without Over-Representation.",KDD,"Sara Ahmadian,Alessandro Epasto,Ravi Kumar 0001,Mohammad Mahdian"
1997,"Optimal Multiple Intervals Discretization of Continuous Attributes for Supervised Learning.",KDD,"Djamel A. Zighed,Ricco Rakotomalala,Fabien Feschet"
2020,"CompactETA: A Fast Inference System for Travel Time Prediction.",KDD,"Kun Fu,Fanlin Meng,Jieping Ye,Zheng Wang"
2004,"Recovering latent time-series from their observed sums: network tomography with particle filters.",KDD,"Edoardo M. Airoldi,Christos Faloutsos"
1997,"KDD Process Planning.",KDD,"Ning Zhong 0001,Chunnian Liu,Yoshitsugu Kakemoto,Setsuo Ohsuga"
2012,"Efficient and domain-invariant competitor mining.",KDD,"Theodoros Lappas,George Valkanas,Dimitrios Gunopulos"
2004,"Column-generation boosting methods for mixture of kernels.",KDD,"Jinbo Bi,Tong Zhang 0001,Kristin P. Bennett"
1999,"Farming the Web for Systematic Business Intelligence (Invited talk, Abstract only).",KDD,"Richard D. Hackathorn"
2017,"Functional Annotation of Human Protein Coding Isoforms via Non-convex Multi-Instance Learning.",KDD,"Tingjin Luo,Weizhong Zhang,Shang Qiu,Yang Yang,Dongyun Yi,Guangtao Wang,Jieping Ye,Jie Wang 0005"
2019,"Cluster-GCN: An Efficient Algorithm for Training Deep and Large Graph Convolutional Networks.",KDD,"Wei-Lin Chiang,Xuanqing Liu,Si Si,Yang Li 0058,Samy Bengio,Cho-Jui Hsieh"
2004,"Exploiting a support-based upper bound of Pearson's correlation coefficient for efficiently identifying strongly correlated pairs.",KDD,"Hui Xiong 0001,Shashi Shekhar,Pang-Ning Tan,Vipin Kumar"
1999,"Fast and Effective Text Mining Using Linear-Time Document Clustering.",KDD,"Bjornar Larsen,Chinatsu Aone"
2013,"STRIP: stream learning of influence probabilities.",KDD,"Konstantin Kutzkov,Albert Bifet,Francesco Bonchi,Aristides Gionis"
2020,"Faster, Simpler, More Accurate: Practical Automated Machine Learning with Tabular, Text, and Image Data.",KDD,"Jonas Mueller,Xingjian Shi,Alexander J. Smola"
2008,"The structure of information pathways in a social communication network.",KDD,"Gueorgi Kossinets,Jon M. Kleinberg,Duncan J. Watts"
1995,"MDL-Based Decision Tree Pruning.",KDD,"Manish Mehta 0002,Jorma Rissanen,Rakesh Agrawal 0001"
2018,"Mobile Access Record Resolution on Large-Scale Identifier-Linkage Graphs.",KDD,"Xin Shen,Hongxia Yang,Weizhao Xian,Martin Ester,Jiajun Bu,Zhongyao Wang,Can Wang 0001"
2017,"DeepSD: Generating High Resolution Climate Change Projections through Single Image Super-Resolution.",KDD,"Thomas Vandal,Evan Kodra,Sangram Ganguly,Andrew R. Michaelis,Ramakrishna R. Nemani,Auroop R. Ganguly"
2020,"CoRel: Seed-Guided Topical Taxonomy Construction by Concept Learning and Relation Transferring.",KDD,"Jiaxin Huang,Yiqing Xie,Yu Meng 0001,Yunyi Zhang,Jiawei Han 0001"
2010,"Towards mobility-based clustering.",KDD,"Siyuan Liu,Yunhuai Liu,Lionel M. Ni,Jianping Fan 0002,Minglu Li 0001"
2012,"Sampling minimal frequent boolean (DNF) patterns.",KDD,"Geng Li,Mohammed J. Zaki"
2018,"Explanation Mining: Post Hoc Interpretability of Latent Factor Models for Recommendation Systems.",KDD,"Georgina Peake,Jun Wang"
2016,"Collective Sensemaking via Social Sensors: Extracting, Profiling, Analyzing, and Predicting Real-world Events.",KDD,"Yuheng Hu,Yu-Ru Lin,Jiebo Luo"
2010,"Mining positive and negative patterns for relevance feature discovery.",KDD,"Yuefeng Li,Abdulmohsen Algarni,Ning Zhong 0001"
2012,"Interaction and collective intelligence in internet computing.",KDD,"Deyi Li"
2011,"Driving with knowledge from the physical world.",KDD,"Jing Yuan 0007,Yu Zheng 0004,Xing Xie 0001,Guangzhong Sun"
2010,"Scalable influence maximization for prevalent viral marketing in large-scale social networks.",KDD,"Wei Chen 0013,Chi Wang 0001,Yajun Wang 0001"
2017,"Compass: Spatio Temporal Sentiment Analysis of US Election What Twitter Says!",KDD,"Debjyoti Paul,Feifei Li 0001,Murali Krishna Teja,Xin Yu,Richie Frost"
2017,"Learning to Generate Rock Descriptions from Multivariate Well Logs with Hierarchical Attention.",KDD,"Bin Tong,Martin Klinkigt,Makoto Iwayama,Toshihiko Yanase,Yoshiyuki Kobayashi,Anshuman Sahu,Ravigopal Vennelakanti"
2007,"A framework for simultaneous co-clustering and learning from complex data.",KDD,"Meghana Deodhar,Joydeep Ghosh"
2014,"Unfolding physiological state: mortality modelling in intensive care units.",KDD,"Marzyeh Ghassemi,Tristan Naumann,Finale Doshi-Velez,Nicole Brimmer,Rohit Joshi,Anna Rumshisky,Peter Szolovits"
2018,"Autotune: A Derivative-free Optimization Framework for Hyperparameter Tuning.",KDD,"Patrick Koch,Oleg Golovidov,Steven Gardner,Brett Wujek,Joshua Griffin,Yan Xu"
1998,"Rule Discovery from Time Series.",KDD,"Gautam Das 0001,King-Ip Lin,Heikki Mannila,Gopal Renganathan,Padhraic Smyth"
2013,"Network discovery via constrained tensor analysis of fMRI data.",KDD,"Ian N. Davidson,Sean Gilpin,Owen T. Carmichael,Peter B. Walker"
2017,"BDT: Gradient Boosted Decision Tables for High Accuracy and Scoring Efficiency.",KDD,"Yin Lou,Mikhail Obukhov"
2018,"A Unified Approach to Quantifying Algorithmic Unfairness: Measuring Individual &Group Unfairness via Inequality Indices.",KDD,"Till Speicher,Hoda Heidari,Nina Grgic-Hlaca,Krishna P. Gummadi,Adish Singla,Adrian Weller,Muhammad Bilal Zafar"
2003,"Efficient data reduction with EASE.",KDD,"Hervé Brönnimann,Bin Chen,Manoranjan Dash,Peter J. Haas,Peter Scheuermann"
2014,"Quantifying herding effects in crowd wisdom.",KDD,"Ting Wang,Dashun Wang,Fei Wang"
2013,"Fast structure learning in generalized stochastic processes with latent factors.",KDD,"Mohammad Taha Bahadori,Yan Liu 0002,Eric P. Xing"
2020,"HOPS: Probabilistic Subtree Mining for Small and Large Graphs.",KDD,"Pascal Welke,Florian Seiffarth,Michael Kamp,Stefan Wrobel"
2015,"Real Time Recommendations from Connoisseurs.",KDD,"Noriaki Kawamae"
2016,"Safe Pattern Pruning: An Efficient Approach for Predictive Pattern Mining.",KDD,"Kazuya Nakagawa,Shinya Suzumura,Masayuki Karasuyama,Koji Tsuda,Ichiro Takeuchi"
2005,"Discovering evolutionary theme patterns from text: an exploration of temporal text mining.",KDD,"Qiaozhu Mei,ChengXiang Zhai"
2018,"How LinkedIn Economic Graph Bonds Information and Product: Applications in LinkedIn Salary.",KDD,"Xi Chen 0049,Yiqun Liu 0010,Liang Zhang 0021,Krishnaram Kenthapadi"
2015,"On the Discovery of Evolving Truth.",KDD,"Yaliang Li,Qi Li 0012,Jing Gao 0004,Lu Su,Bo Zhao 0001,Wei Fan 0001,Jiawei Han 0001"
2020,"Predicting Temporal Sets with Deep Neural Networks.",KDD,"Le Yu,Leilei Sun,Bowen Du,Chuanren Liu,Hui Xiong 0001,Weifeng Lv"
2007,"Applying collaborative filtering techniques to movie search for better ranking and browsing.",KDD,"Seung-Taek Park,David M. Pennock"
2020,"AutoML Pipeline Selection: Efficiently Navigating the Combinatorial Space.",KDD,"Chengrun Yang,Jicong Fan,Ziyang Wu,Madeleine Udell"
2013,"Collaborative matrix factorization with multiple similarities for predicting drug-target interactions.",KDD,"Xiaodong Zheng,Hao Ding,Hiroshi Mamitsuka,Shanfeng Zhu"
2015,"Data Driven Science: SIGKDD Panel.",KDD,"Katharina Morik,Hugh F. Durrant-Whyte,Gary C. Hill,Dietmar Müller,Tanya Y. Berger-Wolf"
2019,"Precipitation Nowcasting with Satellite Imagery.",KDD,"Vadim Lebedev,Vladimir Ivashkin,Irina Rudenko,Alexander Ganshin,Alexander Molchanov,Sergey Ovcharenko,Ruslan Grokhovetskiy,Ivan Bushmarinov,Dmitry Solomentsev"
2019,"Figuring out the User in a Few Steps: Bayesian Multifidelity Active Search with Cokriging.",KDD,"Nikita Klyuchnikov,Davide Mottin,Georgia Koutrika,Emmanuel Müller,Panagiotis Karras"
2020,"Innovating with Language AI.",KDD,"Ashwin Ram"
2020,"Meta-learning on Heterogeneous Information Networks for Cold-start Recommendation.",KDD,"Yuanfu Lu,Yuan Fang 0001,Chuan Shi"
2013,"Multi-label relational neighbor classification using social context features.",KDD,"Xi Wang,Gita Sukthankar"
2012,"Active sampling for entity matching.",KDD,"Kedar Bellare,Suresh Iyengar,Aditya G. Parameswaran,Vibhor Rastogi"
2016,"Repeat Buyer Prediction for E-Commerce.",KDD,"Guimei Liu,Tam T. Nguyen,Gang Zhao,Wei Zha,Jianbo Yang,Jianneng Cao,Min Wu 0008,Peilin Zhao,Wei Chen"
2016,"ABRA: Approximating Betweenness Centrality in Static and Dynamic Graphs with Rademacher Averages.",KDD,"Matteo Riondato,Eli Upfal"
2009,"Improving classification accuracy using automatically extracted training data.",KDD,"Ariel Fuxman,Anitha Kannan,Andrew B. Goldberg,Rakesh Agrawal 0001,Panayiotis Tsaparas,John C. Shafer"
2005,"Determining an author's native language by mining a text for errors.",KDD,"Moshe Koppel,Jonathan Schler,Kfir Zigdon"
2005,"Data mining in the chemical industry.",KDD,"Alex N. Kalos,Tim Rey"
2000,"Distributed and parallel knowledge discovery (workshop session - title only).",KDD,"Hillol Kargupta,Philip Chan,Vipin Kumar,Zoran Obradovic"
2020,"XGNN: Towards Model-Level Explanations of Graph Neural Networks.",KDD,"Hao Yuan,Jiliang Tang,Xia Hu,Shuiwang Ji"
1998,"Mining Databases with Different Schemas: Integrating Incompatible Classifiers.",KDD,"Andreas L. Prodromidis,Salvatore J. Stolfo"
2016,"Text Mining in Clinical Domain: Dealing with Noise.",KDD,"Hoang Nguyen,Jon Patrick"
2007,"Expertise modeling for matching papers with reviewers.",KDD,"David M. Mimno,Andrew McCallum"
2014,"Efficient multi-task feature learning with calibration.",KDD,"Pinghua Gong,Jiayu Zhou,Wei Fan,Jieping Ye"
2005,"Detection of emerging space-time clusters.",KDD,"Daniel B. Neill,Andrew W. Moore 0001,Maheshkumar Sabhnani,Kenny Daniel"
2004,"Efficient closed pattern mining in the presence of tough block constraints.",KDD,"Krishna Gade,Jianyong Wang 0001,George Karypis"
1996,"DBMiner: A System for Mining Knowledge in Large Relational Databases.",KDD,"Jiawei Han 0001,Yongjian Fu,Wei Wang 0009,Jenny Chiang,Wan Gong,Krzysztof Koperski,Deyi Li,Yijun Lu,Amynmohamed Rajan,Nebojsa Stefanovic,Betty Xia,Osmar R. Zaïane"
2016,"Compute Job Memory Recommender System Using Machine Learning.",KDD,"Taraneh Taghavi,Maria Lupetini,Yaron Kretchmer"
2019,"CoSTCo: A Neural Tensor Completion Model for Sparse Tensors.",KDD,"Hanpeng Liu,Yaguang Li,Michael Tsang,Yan Liu 0002"
2017,"Not All Passes Are Created Equal: Objectively Measuring the Risk and Reward of Passes in Soccer from Tracking Data.",KDD,"Paul Power,Héctor Ruiz,Xinyu Wei,Patrick Lucey"
2019,"ProGAN: Network Embedding via Proximity Generative Adversarial Network.",KDD,"Hongchang Gao,Jian Pei,Heng Huang"
2002,"A system for real-time competitive market intelligence.",KDD,"Sholom M. Weiss,Naval K. Verma"
2020,"Block Model Guided Unsupervised Feature Selection.",KDD,"Zilong Bai,Hoa Nguyen,Ian Davidson"
2010,"k-Support anonymity based on pseudo taxonomy for outsourcing of frequent itemset mining.",KDD,"Chih-Hua Tai,Philip S. Yu,Ming-Syan Chen"
2006,"Robust information-theoretic clustering.",KDD,"Christian Böhm,Christos Faloutsos,Jia-Yu Pan,Claudia Plant"
2020,"Context-Aware Attentive Knowledge Tracing.",KDD,"Aritra Ghosh 0001,Neil T. Heffernan,Andrew S. Lan"
2017,"Discovering Reliable Approximate Functional Dependencies.",KDD,"Panagiotis Mandros,Mario Boley,Jilles Vreeken"
2013,"Extracting social events for learning better information diffusion models.",KDD,"Shuyang Lin,Fengjiao Wang,Qingbo Hu,Philip S. Yu"
2019,"AtSNE: Efficient and Robust Visualization on GPU through Hierarchical Optimization.",KDD,"Cong Fu,Yonghui Zhang,Deng Cai 0001,Xiang Ren"
2017,"A Minimal Variance Estimator for the Cardinality of Big Data Set Intersection.",KDD,"Reuven Cohen,Liran Katzir 0001,Aviv Yehezkel"
2010,"DUST: a generalized notion of similarity between uncertain time series.",KDD,"Smruti R. Sarangi,Karin Murthy"
2018,"Model-based Clustering of Short Text Streams.",KDD,"Jianhua Yin,Daren Chao,Zhongkun Liu,Wei Zhang 0056,Xiaohui Yu 0001,Jianyong Wang 0001"
1996,"Growing Simpler Decision Trees to Facilitate Knowledge Discovery.",KDD,"Kevin J. Cherkauer,Jude W. Shavlik"
2016,"People, Computers, and The Hot Mess of Real Data.",KDD,"Joseph M. Hellerstein"
2017,"LiJAR: A System for Job Application Redistribution towards Efficient Career Marketplace.",KDD,"Fedor Borisyuk,Liang Zhang 0021,Krishnaram Kenthapadi"
2020,"Retrospective Loss: Looking Back to Improve Training of Deep Neural Networks.",KDD,"Surgan Jandial,Ayush Chopra,Mausoom Sarkar,Piyush Gupta,Balaji Krishnamurthy,Vineeth Balasubramanian"
1996,"Using a Hybrid Neural/Expert System for Data Base Mining in Market Survey Data.",KDD,"Victor Ciesielski,Gregory Palstra"
2016,"Smart Reply: Automated Response Suggestion for Email.",KDD,"Anjuli Kannan,Karol Kurach,Sujith Ravi,Tobias Kaufmann,Andrew Tomkins,Balint Miklos,Greg Corrado,László Lukács,Marina Ganea,Peter Young,Vivek Ramavajjala"
2020,"Effective Transfer Learning for Identifying Similar Questions: Matching User Questions to COVID-19 FAQs.",KDD,"Clara H. McCreery,Namit Katariya,Anitha Kannan,Manish Chablani,Xavier Amatriain"
2013,"Constrained stochastic gradient descent for large-scale least squares problem.",KDD,"Yang Mu,Wei Ding 0003,Tianyi Zhou,Dacheng Tao"
2009,"Large-scale sparse logistic regression.",KDD,"Jun Liu 0003,Jianhui Chen,Jieping Ye"
2018,"Scalable Query N-Gram Embedding for Improving Matching and Relevance in Sponsored Search.",KDD,"Xiao Bai 0002,Erik Ordentlich,Yuanyuan Zhang,Andy Feng,Adwait Ratnaparkhi,Reena Somvanshi,Aldi Tjahjadi"
2016,"A Real Linear and Parallel Multiple Longest Common Subsequences (MLCS) Algorithm.",KDD,"Yanni Li,Hui Li,Tihua Duan,Sheng Wang,Zhi Wang,Yang Cheng"
2019,"Product Ecosystem Optimization at LinkedIn.",KDD,"Rómer Rosales"
2018,"Multi-Pointer Co-Attention Networks for Recommendation.",KDD,"Yi Tay,Anh Tuan Luu,Siu Cheung Hui"
2015,"Efficient PageRank Tracking in Evolving Networks.",KDD,"Naoto Ohsaka,Takanori Maehara,Ken-ichi Kawarabayashi"
2009,"Characteristic relational patterns.",KDD,"Arne Koopman,Arno Siebes"
2006,"Automatic mining of fruit fly embryo images.",KDD,"Jia-Yu Pan,André G. R. Balan,Eric P. Xing,Agma J. M. Traina,Christos Faloutsos"
2007,"Privacy-preservation for gradient descent methods.",KDD,"Li Wan,Wee Keong Ng,Shuguo Han,Vincent C. S. Lee"
2016,"Fast Unsupervised Online Drift Detection Using Incremental Kolmogorov-Smirnov Test.",KDD,"Denis Moreira dos Reis,Peter A. Flach,Stan Matwin,Gustavo E. A. P. A. Batista"
2015,"Deep Learning Architecture with Dynamically Programmed Layers for Brain Connectome Prediction.",KDD,"Vivek Veeriah,Rohit Durvasula,Guo-Jun Qi"
2019,"Mining and Model Understanding on Medical Data.",KDD,"Myra Spiliopoulou,Panagiotis Papapetrou"
2007,"Tracking multiple topics for finding interesting articles.",KDD,"Raymond K. Pon,Alfonso F. Cardenas,David Buttler,Terence Critchlow"
1999,"Generalized Additive Neural Networks.",KDD,"William J. E. Potts"
2014,"Deep learning.",KDD,"Ruslan Salakhutdinov"
2013,"Understanding evolution of research themes: a probabilistic generative model for citations.",KDD,"Xiaolong Wang 0009,Chengxiang Zhai,Dan Roth"
2013,"An efficient ADMM algorithm for multidimensional anisotropic total variation regularization problems.",KDD,"Sen Yang,Jie Wang 0005,Wei Fan,Xiatian Zhang,Peter Wonka,Jieping Ye"
2018,"Accelerated Equivalence Structure Extraction via Pairwise Incremental Search.",KDD,"Seiya Satoh,Yoshinobu Takahashi,Hiroshi Yamakawa"
2006,"K-means clustering versus validation measures: a data distribution perspective.",KDD,"Hui Xiong 0001,Junjie Wu 0002,Jian Chen 0016"
2018,"Deep Interest Network for Click-Through Rate Prediction.",KDD,"Guorui Zhou,Xiaoqiang Zhu,Chengru Song,Ying Fan,Han Zhu,Xiao Ma,Yanghui Yan,Junqi Jin,Han Li,Kun Gai"
2019,"Disambiguation Enabled Linear Discriminant Analysis for Partial Label Dimensionality Reduction.",KDD,"Jing-Han Wu,Min-Ling Zhang"
2020,"Adversarial Infidelity Learning for Model Interpretation.",KDD,"Jian Liang,Bing Bai,Yuren Cao,Kun Bai,Fei Wang"
2020,"An Embarrassingly Simple Approach for Trojan Attack in Deep Neural Networks.",KDD,"Ruixiang Tang,Mengnan Du,Ninghao Liu,Fan Yang 0023,Xia Hu"
1998,"Discovering Predictive Association Rules.",KDD,"Nimrod Megiddo,Ramakrishnan Srikant"
2011,"Axiomatic ranking of network role similarity.",KDD,"Ruoming Jin,Victor E. Lee,Hui Hong"
1998,"CLOUDS: A Decision Tree Classifier for Large Datasets.",KDD,"Khaled Alsabti,Sanjay Ranka,Vineet Singh"
2015,"Learning with Similarity Functions on Graphs using Matchings of Geometric Embeddings.",KDD,"Fredrik D. Johansson,Devdatt P. Dubhashi"
2008,"Scaling up text classification for large file systems.",KDD,"George Forman,Shyamsundar Rajaram"
1999,"A Classification-Based Methodology for Planning Audit Strategies in Fraud Detection.",KDD,"Francesco Bonchi,Fosca Giannotti,Gianni Mainetto,Dino Pedreschi"
2014,"Bringing structure to text: mining phrases, entities, topics, and hierarchies.",KDD,"Jiawei Han 0001,Chi Wang 0001,Ahmed El-Kishky"
2007,"BoostCluster: boosting clustering by pairwise constraints.",KDD,"Yi Liu 0054,Rong Jin,Anil K. Jain 0001"
2020,"SSumM: Sparse Summarization of Massive Graphs.",KDD,"Kyuhan Lee,Hyeonsoo Jo,Jihoon Ko,Sungsu Lim,Kijung Shin"
2000,"Among those dark electronic mills: privacy and data mining (invited talk, abstract only).",KDD,"Jason Catlett"
2019,"Fast and Accurate Anomaly Detection in Dynamic Graphs with a Two-Pronged Approach.",KDD,"Minji Yoon,Bryan Hooi,Kijung Shin,Christos Faloutsos"
2020,"Grale: Designing Networks for Graph Learning.",KDD,"Jonathan Halcrow,Alexandru Mosoi,Sam Ruth,Bryan Perozzi"
2020,"Faster Secure Data Mining via Distributed Homomorphic Encryption.",KDD,"Junyi Li,Heng Huang"
2017,"TrioVecEvent: Embedding-Based Online Local Event Detection in Geo-Tagged Tweet Streams.",KDD,"Chao Zhang 0014,Liyuan Liu,Dongming Lei,Quan Yuan 0001,Honglei Zhuang,Tim Hanratty,Jiawei Han 0001"
2020,"Context-to-Session Matching: Utilizing Whole Session for Response Selection in Information-Seeking Dialogue Systems.",KDD,"Zhenxin Fu,Shaobo Cui 0001,Mingyue Shang,Feng Ji,Dongyan Zhao 0001,Haiqing Chen,Rui Yan 0001"
2019,"Deep Reinforcement Learning with Applications in Transportation.",KDD,"Zhiwei (Tony) Qin,Jian Tang 0008,Jieping Ye"
2006,"Identifying bridging rules between conceptual clusters.",KDD,"Shichao Zhang,Feng Chen,Xindong Wu 0001,Chengqi Zhang"
2020,"Partial Multi-Label Learning via Probabilistic Graph Matching Mechanism.",KDD,"Gengyu Lyu,Songhe Feng,Yidong Li"
1998,"Independence Diagrams: A Technique for Visual Data Mining.",KDD,"Stefan Berchtold,H. V. Jagadish,Kenneth A. Ross"
1997,"Schema Discovery for Semistructured Data.",KDD,"Ke Wang,Huiqing Liu"
2017,"Online Ranking with Constraints: A Primal-Dual Algorithm and Applications to Web Traffic-Shaping.",KDD,"Parikshit Shah,Akshay Soni,Troy Chevalier"
2020,"Automatic Validation of Textual Attribute Values in E-commerce Catalog by Learning with Limited Labeled Data.",KDD,"Yaqing Wang,Yifan Ethan Xu,Xian Li,Xin Luna Dong,Jing Gao"
2020,"Aligning Superhuman AI with Human Behavior: Chess as a Model System.",KDD,"Reid McIlroy-Young,Siddhartha Sen 0001,Jon M. Kleinberg,Ashton Anderson"
2012,"Online learning to diversify from implicit feedback.",KDD,"Karthik Raman 0001,Pannaga Shivaswamy,Thorsten Joachims"
2013,"Efficient single-source shortest path and distance queries on large graphs.",KDD,"Andy Diwen Zhu,Xiaokui Xiao,Sibo Wang 0001,Wenqing Lin"
2002,"A model for discovering customer value for E-content.",KDD,"Srinivasan Jagannathan,Jayanth Nayak,Kevin C. Almeroth,Markus Hofmann"
2019,"A Memory-Efficient Sketch Method for Estimating High Similarities in Streaming Sets.",KDD,"Pinghui Wang,Yiyan Qi,Yuanming Zhang,Qiaozhu Zhai,Chenxu Wang,John C. S. Lui,Xiaohong Guan"
2016,"FINAL: Fast Attributed Network Alignment.",KDD,"Si Zhang,Hanghang Tong"
2016,"Just One More: Modeling Binge Watching Behavior.",KDD,"William Trouleau,Azin Ashkan,Weicong Ding,Brian Eriksson"
2018,"Network Connectivity Optimization: Fundamental Limits and Effective Algorithms.",KDD,"Chen Chen 0022,Ruiyue Peng,Lei Ying,Hanghang Tong"
2011,"Web information extraction using markov logic networks.",KDD,"Sandeepkumar Satpal,Sahely Bhadra,Sundararajan Sellamanickam,Rajeev Rastogi,Prithviraj Sen"
2018,"Multimodal Sentiment Analysis To Explore the Structure of Emotions.",KDD,"Anthony Hu,Seth R. Flaxman"
2020,"A Self-Evolving Mutually-Operative Recurrent Network-based Model for Online Tool Condition Monitoring in Delay Scenario.",KDD,"Monidipa Das,Mahardhika Pratama,Tegoeh Tjahjowidodo"
2010,"UP-Growth: an efficient algorithm for high utility itemset mining.",KDD,"Vincent S. Tseng,Cheng-Wei Wu,Bai-En Shie,Philip S. Yu"
2003,"Mining distance-based outliers in near linear time with randomization and a simple pruning rule.",KDD,"Stephen D. Bay,Mark Schwabacher"
2011,"Refining causality: who copied from whom?",KDD,"Tristan Mark Snowsill,Nick Fyson,Tijl De Bie,Nello Cristianini"
2020,"Grammatically Recognizing Images with Tree Convolution.",KDD,"Guangrun Wang,Guangcong Wang,Keze Wang,Xiaodan Liang,Liang Lin"
2017,"Optimization Beyond Prediction: Prescriptive Price Optimization.",KDD,"Shinji Ito,Ryohei Fujimaki"
2017,"More than the Sum of its Parts: Building Domino Data Lab.",KDD,"Eduardo Ariño de la Rubia"
2009,"New ensemble methods for evolving data streams.",KDD,"Albert Bifet,Geoffrey Holmes 0001,Bernhard Pfahringer,Richard Kirkby,Ricard Gavaldà"
1999,"Visual Classification: An Interactive Approach to Decision Tree Construction.",KDD,"Mihael Ankerst,Christian Elsen,Martin Ester,Hans-Peter Kriegel"
1998,"Discovering Technical Traders in the T-bond Futures Market.",KDD,"Andreas S. Weigend,Fei Chen,Stephen Figlewski,Steven R. Waterhouse"
2018,"Assessing Candidate Preference through Web Browsing History.",KDD,"Giovanni Comarela,Ramakrishnan Durairajan,Paul Barford,Dino D. Christenson,Mark Crovella"
2020,"Semi-supervised Collaborative Filtering by Text-enhanced Domain Adaptation.",KDD,"Wenhui Yu,Xiao Lin,Junfeng Ge,Wenwu Ou,Zheng Qin"
2018,"Online Adaptive Asymmetric Active Learning for Budgeted Imbalanced Data.",KDD,"Yifan Zhang 0004,Peilin Zhao,Jiezhang Cao,Wenye Ma,Junzhou Huang,Qingyao Wu,Mingkui Tan"
2018,"Lessons Learned from Developing and Deploying a Large-Scale Employer Name Normalization System for Online Recruitment.",KDD,"Qiaoling Liu,Josh Chao,Thomas Mahoney,Alan Chern,Chris Min,Faizan Javed,Valentin Jijkoun"
1998,"Memory Placement Techniques for Parallel Association Mining.",KDD,"Srinivasan Parthasarathy 0001,Mohammed Javeed Zaki,Wei Li 0015"
2007,"Feature selection methods for text classification.",KDD,"Anirban Dasgupta 0001,Petros Drineas,Boulos Harb,Vanja Josifovski,Michael W. Mahoney"
2004,"A generalized maximum entropy approach to bregman co-clustering and matrix approximation.",KDD,"Arindam Banerjee 0001,Inderjit S. Dhillon,Joydeep Ghosh,Srujana Merugu,Dharmendra S. Modha"
2018,"Learning Tasks for Multitask Learning: Heterogenous Patient Populations in the ICU.",KDD,"Harini Suresh,Jen J. Gong,John V. Guttag"
2020,"Improving Conversational Recommender Systems via Knowledge Graph based Semantic Fusion.",KDD,"Kun Zhou,Wayne Xin Zhao,Shuqing Bian,Yuanhang Zhou,Ji-Rong Wen,Jingsong Yu"
2009,"A case study of behavior-driven conjoint analysis on Yahoo!: front page today module.",KDD,"Wei Chu,Seung-Taek Park,Todd Beaupre,Nitin Motgi,Amit Phadke,Seinjuti Chakraborty,Joe Zachariah"
2015,"Mining Frequent Itemsets through Progressive Sampling with Rademacher Averages.",KDD,"Matteo Riondato,Eli Upfal"
