2011,"You Are Known by How You Vlog: Personality Impressions and Nonverbal Behavior in YouTube.",ICWSM,"Joan-Isaac Biel,Oya Aran,Daniel Gatica-Perez"
2016,"Signed Link Analysis in Social Media Networks.",ICWSM,"Ghazaleh Beigi,Jiliang Tang,Huan Liu 0001"
2019,""Woman-Metal-White vs Man-Dress-Shorts": Combining Social, Temporal and Image Signals to Understand Popularity of Pinterest Fashion Boards.",ICWSM,"Suman Kalyan Maity,Anshit E. Chaudhary,Animesh Mukherjee 0001"
2011,"Factors Affecting Response Quantity, Quality, and Speed for Questions Asked Via Social Network Status Messages.",ICWSM,"Jaime Teevan,Meredith Ringel Morris,Katrina Panovich"
2008,"Examining Privacy in Blogging from the Reader's Perspective.",ICWSM,"Eric P. S. Baumer,Mark Sueyoshi,Bill Tomlinson"
2018,"Latent Structure in Collaboration: The Case of Reddit r/place.",ICWSM,"Jérémie Rappaz,Michele Catasta,Robert West 0001,Karl Aberer"
2018,"Describing and Classifying Post-Mortem Content on Social Media.",ICWSM,"Jialun "Aaron" Jiang,Jed R. Brubaker"
2020,"Understanding Visual Memes: An Empirical Analysis of Text Superimposed on Memes Shared on Twitter.",ICWSM,"Yuhao Du,Muhammad Aamir Masood,Kenneth Joseph"
2015,"Towards Lifestyle Understanding: Predicting Home and Vacation Locations from User's Online Photo Collections.",ICWSM,"Danning Zheng,Tianran Hu,Quanzeng You,Henry A. Kautz,Jiebo Luo"
2016,"Networks of Gratitude: Structures of Thanks and User Expectations in Workplace Appreciation Systems.",ICWSM,"Emma S. Spiro,Jorge Nathan Matias,Andrés Monroy-Hernández"
2012,"Where Is This Tweet From? Inferring Home Locations of Twitter Users.",ICWSM,"Jalal Mahmud,Jeffrey Nichols,Clemens Drews"
2011,"Hierarchical Bayesian Models for Latent Attribute Detection in Social Media.",ICWSM,"Delip Rao,Michael J. Paul,Clayton Fink,David Yarowsky,Timothy Oates,Glen Coppersmith"
2015,"Understanding Public Emotional Reactions on Twitter.",ICWSM,"Stephen Wan 0001,Cécile Paris"
2009,"Community Structure and Information Flow in Usenet: Improving Analysis with a Thread Ownership Model.",ICWSM,"Mary McGlohon,Matthew Hurst"
2013,"Unexpected Relevance: An Empirical Study of Serendipity in Retweets.",ICWSM,"Tao Sun,Ming Zhang 0004,Qiaozhu Mei"
2009,"Emotionality in Text as Predictor of Behavior.",ICWSM,"Elliot Onn,Carey K. Morewedge"
2010,"Discovering Serendipitous Information from Wikipedia by Using Its Network Structure.",ICWSM,"Yohei Noda,Yoji Kiyota,Hiroshi Nakagawa"
2015,"Contextualized Sarcasm Detection on Twitter.",ICWSM,"David Bamman,Noah A. Smith"
2018,"Reddit Rules! Characterizing an Ecosystem of Governance.",ICWSM,"Casey Fiesler,Jialun "Aaron" Jiang,Joshua McCann,Kyle Frye,Jed R. Brubaker"
2011,"Towards Discovery of Influence and Personality Traits through Social Link Prediction.",ICWSM,"Thin Nguyen,Dinh Q. Phung,Brett Adams,Svetha Venkatesh"
2009,"Connecting Users with Similar Interests across Multiple Web Services.",ICWSM,"Haewoon Kwak,Hwa-Yong Shin,Jong-Il Yoon,Sue B. Moon"
2015,"Organizations Are Users Too: Characterizing and Detecting the Presence of Organizations on Twitter.",ICWSM,"James McCorriston,David Jurgens,Derek Ruths"
2018,"Urban Maps of Social Activity.",ICWSM,"Stewart Whiting,Omar Alonso,Vasileios Kandylas,Serge-Eric Tremblay"
2010,"The Wisdom of Bookies? Sentiment Analysis Versus. the NFL Point Spread.",ICWSM,"Yancheng Hong,Steven Skiena"
2013,"Perception Differences between the Depressed and Non-Depressed Users in Twitter.",ICWSM,"Minsu Park,David W. McDonald,Meeyoung Cha"
2017,"Changes in Social Media Affect, Disclosure, and Sociality for a Sample of Transgender Americans in 2016's Political Climate.",ICWSM,"Oliver L. Haimson,Gillian R. Hayes"
2016,"On Unravelling Opinions of Issue Specific-Silent Users in Social Media.",ICWSM,"Wei Gong,Ee-Peng Lim,Feida Zhu 0001,Pei Hua Cher"
2017,"Fertility and Its Meaning: Evidence from Search Behavior.",ICWSM,"Jussi Ojala,Emilio Zagheni,Francesco C. Billari,Ingmar Weber"
2008,"Thematic and Social Indicators for Flickr Groups.",ICWSM,"Christophe Prieur 0002,Nicolas Pissard,Jean-Samuel Beuscart,Dominique Cardon,Pascal Pons"
2014,"Topical Engagement on Twitter: Using Consistency of Activity as a Means of User Segmentation.",ICWSM,"Aurora Schmidt,Clay Fink,Nathan Bos"
2012,"Evolution of Experts in Question Answering Communities.",ICWSM,"Aditya Pal,Shuo Chang,Joseph A. Konstan"
2009,"Spectrum: Retrieving Different Points of View from the Blogosphere.",ICWSM,"Jiahui Liu,Larry Birnbaum,Bryan Pardo"
2019,"Empirical Analysis of the Relation between Community Structure and Cascading Retweet Diffusion.",ICWSM,"Sho Tsugawa"
2020,"Identity-Based Roles in Rhizomatic Social Justice Movements on Twitter.",ICWSM,"Judeth Oden Choi,James D. Herbsleb,Jessica Hammer,Jodi Forlizzi"
2020,"Local Trends in Global Music Streaming.",ICWSM,"Samuel F. Way,Jean Garcia-Gathright,Henriette Cramer"
2015,"Smelly Maps: The Digital Life of Urban Smellscapes.",ICWSM,"Daniele Quercia,Rossano Schifanella,Luca Maria Aiello,Kate McLean"
2017,"Headlines Matter: Using Headlines to Predict the Popularity of News Articles on Twitter and Facebook.",ICWSM,"Alicja Piotrkowicz,Vania Dimitrova,Jahna Otterbacher,Katja Markert"
2014,"Audience-Aware Credibility: From Understanding Audience to Establishing Credible Blogs.",ICWSM,"Soo Young Rieh,Grace YoungJoo Jeon,Ji Yeon Yang,Cliff Lampe"
2016,"Our House, in the Middle of Our Tweets.",ICWSM,"Dan Tasse,Alex Sciuto,Jason I. Hong"
2019,"Different Spirals of Sameness: A Study of Content Sharing in Mainstream and Alternative Media.",ICWSM,"Benjamin D. Horne,Jeppe Nørregaard,Sibel Adali"
2009,"Blogs as Predictors of Movie Success.",ICWSM,"Eldar Sadikov,Aditya G. Parameswaran,Petros Venetis"
2015,"An Image Is Worth More than a Thousand Favorites: Surfacing the Hidden Beauty of Flickr Pictures.",ICWSM,"Rossano Schifanella,Miriam Redi,Luca Maria Aiello"
2012,"Modeling Spread of Disease from Social Interactions.",ICWSM,"Adam Sadilek,Henry A. Kautz,Vincent Silenzio"
2017,"Querying Documents Annotated by Interconnected Entities.",ICWSM,"Shouq Sadah,Moloud Shahbazi,Vagelis Hristidis"
2010,"StepGreen.org: Increasing Energy Saving Behaviors via Social Networks.",ICWSM,"Jennifer Mankoff,Susan R. Fussell,Tawanna Dillahunt,Rachel Glaves,Catherine Grevet,Michael Johnson,Deanna Matthews,H. Scott Matthews,Robert McGuire,Robert Thompson 0005,Aubrey Shick,Leslie D. Setlock"
2017,"Automatically Identifying Good Conversations Online (Yes, They Do Exist!).",ICWSM,"Courtney Napoles,Aasish Pappu,Joel R. Tetreault"
2017,"Untangling Emoji Popularity Through Semantic Embeddings.",ICWSM,"Wei Ai,Xuan Lu,Xuanzhe Liu,Ning Wang,Gang Huang 0001,Qiaozhu Mei"
2014,"Understanding Loneliness in Social Awareness Streams: Expressions and Responses.",ICWSM,"Funda Kivran-Swaine,Jeremy Ting,Jed R. Brubaker,Rannie Teodoro,Mor Naaman"
2020,"Top Comment or Flop Comment? Predicting and Explaining User Engagement in Online News Discussions.",ICWSM,"Julian Risch,Ralf Krestel"
2010,"Characterizing Microblogs with Topic Models.",ICWSM,"Daniel Ramage,Susan T. Dumais,Daniel J. Liebling"
2018,"The Gender Gap in Wikipedia Talk Pages.",ICWSM,"Benjamin Cabrera,Björn Ross,Marielle Dado,Maritta Heisel"
2014,"Emoticons and Phrases: Status Symbols in Social Media.",ICWSM,"Simo Editha Tchokni,Diarmuid Ó Séaghdha,Daniele Quercia"
2016,"Measuring the Efficiency of Charitable Giving with Content Analysis and Crowdsourcing.",ICWSM,"Ceren Budak,Justin M. Rao"
2016,"Pub Crawling at Scale: Tapping Untappd to Explore Social Drinking.",ICWSM,"Martin J. Chorley,Luca Rossi 0004,Gareth Tyson,Matthew J. Williams"
2013,"Can Twitter Replace Newswire for Breaking News?",ICWSM,"Sasa Petrovic,Miles Osborne,Richard McCreadie,Craig Macdonald,Iadh Ounis,Luke Shrimpton"
2008,"Understanding the Efficiency of Social Tagging Systems using Information Theory.",ICWSM,"Ed H. Chi,Todd Mytkowicz"
2020,"Purchase Intentions on Social Media as Predictors of Consumer Spending.",ICWSM,"Viktor Pekar 0001"
2012,"#bias: Measuring the Tweeting Behavior of Propagandists.",ICWSM,"Cristian Lumezanu,Nick Feamster,Hans Klein"
2018,"Characterizing and Detecting Hateful Users on Twitter.",ICWSM,"Manoel Horta Ribeiro,Pedro H. Calais,Yuri A. Santos,Virgílio A. F. Almeida,Wagner Meira Jr."
2019,"More Than Money: Correlation among Worker Demographics, Motivations, and Participation in Online Labor Market.",ICWSM,"Wei-Chu Chen,Siddharth Suri,Mary L. Gray"
2014,"Personalized Recommendation of Twitter Lists using Content and Network Information.",ICWSM,"Vineeth Rakesh,Dilpreet Singh,Bhanukiran Vinzamuri,Chandan K. Reddy"
2016,"Fetishizing Food in Digital Age: #foodporn Around the World.",ICWSM,"Yelena Mejova,Sofiane Abbar,Hamed Haddadi"
2011,"Automatic Group-Interactive Radio Using Social-Networks of Musicians.",ICWSM,"Benjamin Fields,Christophe Rhodes,Mark d'Inverno"
2011,"Viral Actions: Predicting Video View Counts Using Synchronous Sharing Behaviors.",ICWSM,"David A. Shamma,Jude Yew,Lyndon Kennedy,Elizabeth F. Churchill"
2017,"The Substantial Interdependence of Wikipedia and Google: A Case Study on the Relationship Between Peer Production Communities and Information Technologies.",ICWSM,"Connor McMahon,Isaac L. Johnson,Brent J. Hecht"
2007,"Using Ontologies to Strengthen Folksonomies and Enrich Information Retrieval in Weblogs: Theoretical background and corporate use-case.",ICWSM,"Alexandre Passant"
2018,"Beyond Views: Measuring and Predicting Engagement in Online Videos.",ICWSM,"Siqi Wu,Marian-Andrei Rizoiu,Lexing Xie"
2011,"An Optimized Web Feed Aggregation Approach for Generic Feed Types.",ICWSM,"David Urbansky,Sandro Reichert,Klemens Muthmann,Daniel Schuster,Alexander Schill"
2015,"Answering Complex Queries in an Online Community Network.",ICWSM,"Azade Nazi,Saravanan Thirumuruganathan,Vagelis Hristidis,Nan Zhang 0004,Gautam Das 0001"
2011,"How Does Social Capital Affect Retweets?",ICWSM,"Raquel Recuero,Ricardo Araujo,Gabriela Zago"
2020,"Can Badges Foster a More Welcoming Culture on Q&A Boards?",ICWSM,"Tiago Santos,Keith Burghardt,Kristina Lerman,Denis Helic"
2018,"Characterizing Clickbaits on Instagram.",ICWSM,"Yu-i Ha,Jeongmin Kim,Donghyeon Won,Meeyoung Cha,Jungseock Joo"
2014,"Predicting Successful Memes Using Network and Community Structure.",ICWSM,"Lilian Weng,Filippo Menczer,Yong-Yeol Ahn"
2013,"Modeling Youth Civic Engagement in a New World of Networked Publics.",ICWSM,"Shelly Diane Farnham,David Keyes 0001,Vicky Yuki,Chris Tugwell"
2007,"Add-A-Tag: Learning Adaptive User Profiles from Bookmark Collections.",ICWSM,"Elke Michlmayr,Steve Cayzer,Paul Shabajee"
2017,"A Gendered Analysis of Leadership in Enterprise Social Networks.",ICWSM,"Giorgia Di Tommaso,Giovanni Stilo,Paola Velardi"
2016,"Analyzing the Targets of Hate in Online Social Media.",ICWSM,"Leandro Araújo Silva,Mainack Mondal,Denzil Correa,Fabrício Benevenuto,Ingmar Weber"
2007,"QA with Attitude: Exploiting Opinion Type Analysis for Improving Question Answering in On-line Discussions and the News.",ICWSM,"Swapna Somasundaran,Theresa Wilson,Janyce Wiebe,Veselin Stoyanov"
2010,"The Directed Closure Process in Hybrid Social-Information Networks, with an Analysis of Link Formation on Twitter.",ICWSM,"Daniel Mauricio Romero,Jon M. Kleinberg"
2013,"A Multi-Indicator Approach for Geolocalization of Tweets.",ICWSM,"Axel Schulz 0001,Aristotelis Hadjakos,Heiko Paulheim,Johannes Nachtwey,Max Mühlhäuser"
2015,"Conversing in Reflective Glory: A Systematic Study Using National Football League Games.",ICWSM,"Drew Margolin,Wang Liao,Yu-Ru Lin"
2019,"Social B(eye)as: Human and Machine Descriptions of People Images.",ICWSM,"Pinar Barlas,Kyriakos Kyriakou,Styliani Kleanthous,Jahna Otterbacher"
2018,"Improving Tourism Prediction Models Using Climate and Social Media Data: A Fine-Grained Approach.",ICWSM,"Amir Khatibi,Fabiano Belém,Ana P. Silva,Dennis E. Shasha,Marcos André Gonçalves"
2012,"Temporal Motifs Reveal the Dynamics of Editor Interactions in Wikipedia.",ICWSM,"David Jurgens,Tsai-Ching Lu"
2011,"Describing the Web in less than 140 Characters.",ICWSM,"Stéphane Raux,Nils Grünwald,Christophe Prieur 0002"
2012,"Tag Recommendation by Link Prediction Based on Supervised Machine Learning.",ICWSM,"Manisha Pujari,Rushed Kanawati"
2012,"A Sentiment-Aware Approach to Community Formation in Social Media.",ICWSM,"Thin Nguyen,Dinh Q. Phung,Brett Adams,Svetha Venkatesh"
2019,"News Sharing User Behaviour on Twitter: A Comprehensive Data Collection of News Articles and Social Interactions.",ICWSM,"Giovanni Brena,Marco Brambilla 0001,Stefano Ceri,Marco Di Giovanni,Francesco Pierri 0002,Giorgia Ramponi"
2016,"Tracking the Trackers: A Large-Scale Analysis of Embedded Web Trackers.",ICWSM,"Sebastian Schelter,Jérôme Kunegis"
2020,"The Pushshift Telegram Dataset.",ICWSM,"Jason Baumgartner,Savvas Zannettou,Megan Squire,Jeremy Blackburn"
2019,"The Use of Deep Learning Distributed Representations in the Identification of Abusive Text.",ICWSM,"Hao Chen,Susan McKeever,Sarah Jane Delany"
2007,"Automatic Estimation of Bloggers' Gender.",ICWSM,"Daisuke Kobayashi,Naohiro Matsumura,Mitsuru Ishizuka"
2011,"An Assessment of Intrinsic and Extrinsic Motivation on Task Performance in Crowdsourcing Markets.",ICWSM,"Jakob Rogstadius,Vassilis Kostakos,Aniket Kittur,Boris Smus,Jim Laredo,Maja Vukovic"
2007,"Expressing Social Relationships on the Blog through Links and Comments.",ICWSM,"Noor Ali-Hasan,Lada A. Adamic"
2016,"Motivational Determinants of Participation Trajectories in Wikipedia.",ICWSM,"Martina Balestra,Ofer Arazy,Coye Cheshire,Oded Nov"
2012,"Virality and Susceptibility in Information Diffusions.",ICWSM,"Tuan-Anh Hoang,Ee-Peng Lim"
2019,"Understanding Cross-Cultural Visual Food Tastes with Online Recipe Platforms.",ICWSM,"Qing Zhang,Christoph Trattner,Bernd Ludwig,David Elsweiler"
2011,"LeadLag LDA: Estimating Topic Specific Leads and Lags of Information Outlets.",ICWSM,"Ramesh Nallapati,Xiaolin Shi,Daniel A. McFarland,Jure Leskovec,Daniel Jurafsky"
2015,"The Lifecyle of a Youtube Video: Phases, Content and Popularity.",ICWSM,"Honglin Yu,Lexing Xie,Scott Sanner"
2016,"User Migration in Online Social Networks: A Case Study on Reddit During a Period of Community Unrest.",ICWSM,"Edward Newell,David Jurgens,Haji Mohammad Saleem,Hardik Vala,Jad Sassine,Caitrin Armstrong,Derek Ruths"
2017,"Inverse Dynamical Inheritance in Stack Exchange Taxonomies.",ICWSM,"César Ojeda,Kostadin Cvejoski,Rafet Sifa,Christian Bauckhage"
2011,"Modeling Public Mood and Emotion: Twitter Sentiment and Socio-Economic Phenomena.",ICWSM,"Johan Bollen,Huina Mao,Alberto Pepe"
2007,"On the Evolution of Wikipedia.",ICWSM,"Rodrigo B. Almeida,Barzan Mozafari,Junghoo Cho"
2016,"Mining Pro-ISIS Radicalisation Signals from Social Media Users.",ICWSM,"Matthew Rowe 0001,Hassan Saif"
2008,"An Automatic Classification of Book Texts to User-Defined Tags.",ICWSM,"Sharon Givon,Theresa Wilson"
2016,"The Status Gradient of Trends in Social Media.",ICWSM,"Rahmtin Rotabi,Jon M. Kleinberg"
2007,"All Blogs Are Not Made Equal: Exploring Genre Differences in Sentiment Tagging of Blogs.",ICWSM,"Alina Andreevskaia,Sabine Bergler,Monica Urseanu"
2013,"Sentiment Prediction Using Collaborative Filtering.",ICWSM,"Jihie Kim,Jae-Bong Yoo,Ho Lim,Huida Qiu,Zornitsa Kozareva,Aram Galstyan"
2007,"Visual Analysis of Weblog Content.",ICWSM,"Michelle L. Gregory,Deborah Payne,David McColgin,Nicolas Cramer,Douglas Love"
2020,"Generally Curious: Thematically Distinct Datasets of General Threads on 4chan/pol/.",ICWSM,"Emilija Jokubauskaite,Stijn Peeters"
2019,"From "Welcome New Gabbers" to the Pittsburgh Synagogue Shooting: The Evolution of Gab.",ICWSM,"Reid McIlroy-Young,Ashton Anderson"
2007,"Extraction of Folksonomies from Noisy Texts.",ICWSM,"Wim De Smet,Marie-Francine Moens"
2009,"Stochastic Models of User-Contributory Web Sites.",ICWSM,"Tad Hogg,Kristina Lerman"
2008,"The MultiRank Bootstrap Algorithm: Self-Supervised Political Blog Classification and Ranking Using Semi-Supervised Link Classification.",ICWSM,"Frank Lin,William W. Cohen"
2009,"Salsa: Leveraging Email to Create a Social Network for the Enterprise.",ICWSM,"Kristin Brooke Stecher,Scott Counts,Lili Cheng,Shane Williams,Andrzej Turski"
2014,"Predicting User Replying Behavior on a Large Online Dating Site.",ICWSM,"Peng Xia,Hua Jiang,Xiaodong Wang,Cindy X. Chen,Benyuan Liu"
2009,"Finding Opinionated Blogs Using Statistical Classifiers and Lexical Features.",ICWSM,"Feifan Liu,Bin Li,Yang Liu 0004"
2017,"Scalable News Slant Measurement Using Twitter.",ICWSM,"Huyen T. Le,Zubair Shafiq,Padmini Srinivasan"
2014,"Finding Users we Trust: Scaling up Verified Twitter Users Using their Communication Patterns.",ICWSM,"Martin Hentschel 0001,Omar Alonso,Scott Counts,Vasileios Kandylas"
2014,"Lightweight Contextual Ranking of City Pictures: Urban Sociology to the Rescue.",ICWSM,"Vinícius Flores Zambaldi,João Paulo Pesce,Daniele Quercia,Virgílio A. F. Almeida"
2013,"Visualizing the "Pulse" of World Cities on Twitter.",ICWSM,"Miguel Rios,Jimmy J. Lin"
2012,"Composing Traveling Paths from Location-Based Services.",ICWSM,"Hsun-Ping Hsieh,Cheng-Te Li"
2007,"Observations on Failure in Blogs.",ICWSM,"Vahed Qazvinian,Abtin Rasoulian,Jafar Adibi"
2016,"On the Impact of Social Cost in Opinion Dynamics.",ICWSM,"Panagiotis Liakos,Katia Papakonstantinopoulou"
2013,"Classifying Political Orientation on Twitter: It's Not Easy!",ICWSM,"Raviv Cohen,Derek Ruths"
2016,"#PrayForDad: Learning the Semantics Behind Why Social Media Users Disclose Health Information.",ICWSM,"Zhijun Yin,You Chen,Daniel Fabbri,Jimeng Sun,Bradley A. Malin"
2014,"Privacy Considerations for Public Storytelling.",ICWSM,"Christopher Wienberg,Andrew S. Gordon"
2015,"Like Partying? Your Face Says It All. Predicting the Ambiance of Places with Profile Pictures.",ICWSM,"Miriam Redi,Daniele Quercia,Lindsay T. Graham,Samuel D. Gosling"
2017,"Early Identification of Personalized Trending Topics in Microblogging.",ICWSM,"Liang Wu 0006,Xia Hu,Huan Liu 0001"
2018,"Large Scale Crowdsourcing and Characterization of Twitter Abusive Behavior.",ICWSM,"Antigoni-Maria Founta,Constantinos Djouvas,Despoina Chatzakou,Ilias Leontiadis,Jeremy Blackburn,Gianluca Stringhini,Athena Vakali,Michael Sirivianos,Nicolas Kourtellis"
2012,"Do Linguistic Style and Readability of Scientific Abstracts Affect their Virality?",ICWSM,"Marco Guerini,Alberto Pepe,Bruno Lepri"
2019,"The Language of Dialogue Is Complex.",ICWSM,"Alexander Robertson,Luca Maria Aiello,Daniele Quercia"
2019,"Hot Streaks on Social Media.",ICWSM,"Kiran Garimella,Robert West 0001"
2016,"Bad Apples Spoil the Fun: Quantifying Cheating in Online Gaming.",ICWSM,"Xiang Zuo,Clayton Gandy,John Skovertz,Adriana Iamnitchi"
2018,"The Dynamics of Peer-Produced Political Information During the 2016 U.S. Presidential Campaign.",ICWSM,"Brian C. Keegan"
2007,"Fusion Approach to Finding opinions in Blogosphere.",ICWSM,"Kiduk Yang,Ning Yu 0005,Alejandro Valerio,Hui Zhang 0006,Weimao Ke"
2014,"Why Do You Write This? Prediction of Influencers from Word Use.",ICWSM,"Jalal Mahmud"
2018,"The Hoaxy Misinformation and Fact-Checking Diffusion Network.",ICWSM,"Pik-Mai Hui,Chengcheng Shao,Alessandro Flammini,Filippo Menczer,Giovanni Luca Ciampaglia"
2017,"Echo Chambers in Investment Discussion Boards.",ICWSM,"Shiliang Tang,Qingyun Liu,Megan McQueen,Scott Counts,Apurv Jain,Haitao Zheng 0001,Ben Y. Zhao"
2013,"Tutorials.",ICWSM,""
2013,"Detecting Chinese Wish Messages in Social Media: An Empirical Study.",ICWSM,"George Chang,Han-Shen Huang,Jane Yung-jen Hsu"
2014,"Accessing Social Support and Overcoming Judgment on Social Media among Parents of Children with Special Needs.",ICWSM,"Tawfiq Ammari,Sarita Yardi Schoenebeck,Meredith Ringel Morris"
2017,"Better When It Was Smaller? Community Content and Behavior After Massive Growth.",ICWSM,"Zhiyuan Lin 0001,Niloufar Salehi,Bowen Yao,Yiqi Chen,Michael S. Bernstein"
2011,"Limits of Electoral Predictions Using Twitter.",ICWSM,"Daniel Gayo-Avello,Panagiotis Takis Metaxas,Eni Mustafaraj"
2013,"Predicting the Audience Size of a Tweet.",ICWSM,"Andrey Kupavskii,Alexey Umnov,Gleb Gusev,Pavel Serdyukov"
2015,"How Viral Are Viral Videos?",ICWSM,"Christian Bauckhage,Fabian Hadiji,Kristian Kersting"
2012,"Tweetin' in the Rain: Exploring Societal-Scale Effects of Weather on Mood.",ICWSM,"Aniko Hannak,Eric Anderson 0001,Lisa Feldman Barrett,Sune Lehmann,Alan Mislove,Mirek Riedewald"
2017,"Cold Hard E-Cash: Friends and Vendors in the Venmo Digital Payments System.",ICWSM,"Xinyi Zhang,Shiliang Tang,Yun Zhao,Gang Wang 0011,Haitao Zheng 0001,Ben Y. Zhao"
2007,"On Estimating The Geographic Distribution of Social Media.",ICWSM,"Matthew Hurst,Matthew Siegler,Natalie S. Glance"
2008,"A Shallow Approach to Subjectivity Classification.",ICWSM,"Stephan Raaijmakers,Wessel Kraaij"
2017,"Event Organization 101: Understanding Latent Factors of Event Popularity.",ICWSM,"Shuo Zhang 0009,Qin Lv"
2016,"Freshman or Fresher? Quantifying the Geographic Variation of Language in Online Social Media.",ICWSM,"Vivek Kulkarni,Bryan Perozzi,Steven Skiena"
2011,"Trust, Reputation and the Small Firm: Building Online Brand Reputation for SMEs.",ICWSM,"Barbara Gligorijevic,Benjamin Leong"
2017,"A World of Difference: Divergent Word Interpretations Among People.",ICWSM,"Tianran Hu,Ruihua Song,Maya Abtahian,Philip Ding,Xing Xie 0001,Jiebo Luo"
2015,"Coordination and Efficiency in Decentralized Collaboration.",ICWSM,"Daniel M. Romero,Dan Huttenlocher,Jon M. Kleinberg"
2020,"Characterizing the Use of Images in State-Sponsored Information Warfare Operations by Russian Trolls on Twitter.",ICWSM,"Savvas Zannettou,Tristan Caulfield,Barry Bradlyn,Emiliano De Cristofaro,Gianluca Stringhini,Jeremy Blackburn"
2014,"Measuring Post Traumatic Stress Disorder in Twitter.",ICWSM,"Glen Coppersmith,Craig Harman,Mark Dredze"
2016,"Tracking Secret-Keeping in Emails.",ICWSM,"Yla R. Tausczik,Cindy K. Chung,James W. Pennebaker"
2015,"Taxonomy-Based Discovery and Annotation of Functional Areas in the City.",ICWSM,"Carmen Karina Vaca Ruiz,Daniele Quercia,Francesco Bonchi,Piero Fraternali"
2007,"Looking at the Blogosphere Topology through Different Lenses.",ICWSM,"Xiaolin Shi,Belle L. Tseng,Lada A. Adamic"
2015,""I Don't Have a Photograph, But You Can Have My Footprints" - Revealing the Demographics of Location Data.",ICWSM,"Christopher J. Riederer,Sebastian Zimmeck,Coralie Phanord,Augustin Chaintreau,Steven M. Bellovin"
2008,"Finding Influencers and Consumer Insights in the Blogosphere.",ICWSM,"Naohiro Matsumura,Hikaru Yamamoto,Daisuke Tomozawa"
2011,"When the Wikipedians Talk: Network and Tree Structure of Wikipedia Discussion Pages.",ICWSM,"David Laniado,Riccardo Tasso,Yana Volkovich,Andreas Kaltenbrunner"
2010,"Star Quality: Aggregating Reviews to Rank Products and Merchants.",ICWSM,"Mary McGlohon,Natalie S. Glance,Zach Reiter"
2016,"On the Behaviour of Deviant Communities in Online Social Networks.",ICWSM,"Mauro Coletto,Luca Maria Aiello,Claudio Lucchese,Fabrizio Silvestri"
2012,"More or Less: Amount of Personal Information Displayed in Social Network Site Profiles and Its Impact on Viewers' Intentions to Socialize with the Profile Owner.",ICWSM,"Lemi Baruh,Yoram Chisik,Christophe Bisson,Basak Senova"
2013,"Touch Screens for Touchy Issues: Analysis of Accessing Sensitive Information from Mobile Devices.",ICWSM,"Dan Pelleg,Denis Savenkov,Eugene Agichtein"
2014,"Anonymity in Social Media: Effects of Content Controversiality and Social Endorsement on Sharing Behavior.",ICWSM,"Kaiping Zhang,René F. Kizilcec"
2009,"You Are Where You Edit: Locating Wikipedia Contributors through Edit Histories.",ICWSM,"Michael D. Lieberman,Jimmy J. Lin"
2017,"Analysing Timelines of National Histories Across Wikipedia Editions: A Comparative Computational Approach.",ICWSM,"Anna Samoilenko,Florian Lemmerich,Katrin Weller,Maria Zens,Markus Strohmaier"
2007,"Feeds That Matter: A Study of Bloglines Subscriptions.",ICWSM,"Akshay Java,Pranam Kolari,Tim Finin,Anupam Joshi,Tim Oates"
2007,"Identification and Visualization of Emerging Trends from Blogosphere.",ICWSM,"Makoto Uchida,Naoki Shibata,Susumu Shirayama"
2016,"#Unconfirmed: Classifying Rumor Stance in Crisis-Related Social Media Messages.",ICWSM,"Li Zeng,Kate Starbird,Emma S. Spiro"
2020,"Confidence Boost in Dyadic Online Teamwork: An Individual-Focused Perspective.",ICWSM,"Liye Fu,Andrew Z. Wang,Cristian Danescu-Niculescu-Mizil"
2013,"Mathematical Models of Fads Explain the Temporal Dynamics of Internet Memes.",ICWSM,"Christian Bauckhage,Kristian Kersting,Fabian Hadiji"
2009,"From Generating to Mining: Automatically Scripting Conversations Using Existing Online Sources.",ICWSM,"Nathan D. Nichols,Lisa M. Gandy,Kristian J. Hammond"
2009,"Information Extraction as Link Prediction: Using Curated Citation Networks to Improve Gene Detection.",ICWSM,"Andrew Arnold,William W. Cohen"
2018,"Movie Pirates of the Caribbean: Exploring Illegal Streaming Cyberlockers.",ICWSM,"Damilola Ibosiola,Benjamin Steer,Álvaro García-Recuero,Gianluca Stringhini,Steve Uhlig,Gareth Tyson"
2012,"Definition and Multi-Dimensional Comparative Analysis of Ad Hoc Communities in Twitter.",ICWSM,"Sofus A. Macskassy"
2015,"Predicting User Engagement on Twitter with Real-World Events.",ICWSM,"Yuheng Hu,Shelly Farnham,Kartik Talamadupula"
2018,"Tracing Community Genealogy: How New Communities Emerge from the Old.",ICWSM,"Chenhao Tan"
2010,"Temporal Correlation between Social Tags and Emerging Long-Term Trend Detection.",ICWSM,"Ming-Hung Hsu,Yu-Hui Chang,Hsin-Hsi Chen"
2013,"A Measure of Polarization on Social Media Networks Based on Community Boundaries.",ICWSM,"Pedro Henrique Calais Guerra,Wagner Meira Jr.,Claire Cardie,Robert Kleinberg"
2010,"Microblogging Inside and Outside the Workplace.",ICWSM,"Kate Ehrlich,N. Sadat Shami"
2017,"Twitter911: A Cautionary Tale.",ICWSM,"Anis Zaman,Nabil Hossain,Henry A. Kautz"
