2007,"Following Conversational Traces: Creating a corpus with the ICWSM dataset.",ICWSM,"Stephanie Hendrick"
2010,"How Does the Data Sampling Strategy Impact the Discovery of Information Diffusion in Social Media?",ICWSM,"Munmun De Choudhury,Yu-Ru Lin,Hari Sundaram,K. Selçuk Candan,Lexing Xie,Aisling Kelliher"
2009,"Distinguishing Knowledge vs Social Capital in Social Media with Roles and Context.",ICWSM,"Vladimir Barash,Marc A. Smith,Lise Getoor,Howard T. Welser"
2011,"Technology-Mediated Citizen Science Participation: A Motivational Model.",ICWSM,"Oded Nov,Ofer Arazy,David Anderson"
2017,"Armed Conflicts in Online News: A Multilingual Study.",ICWSM,"Robert West 0001,Jürgen Pfeffer"
2007,"Summarization System by Identifying Influential Blogs.",ICWSM,"Xiaodan Song,Yun Chi,Koji Hino,Belle L. Tseng"
2014,"EmotionWatch: Visualizing Fine-Grained Emotions in Event-Related Tweets.",ICWSM,"Renato Kempter,Valentina Sintsova,Claudiu Cristian Musat,Pearl Pu"
2007,"Social Networks and Reading Bahavior in Blogosphere.",ICWSM,"Tadanobu Furukawa,Yutaka Matsuo,Ikki Ohmukai,Koki Uchiyama,Mitsuru Ishizuka"
2009,"Characterization of FriendFeed - A Web-based Social Aggregation Service.",ICWSM,"Trinabh Gupta,Sanchit Garg,Anirban Mahanti,Niklas Carlsson,Martin F. Arlitt"
2010,"Photo Tagging Over Time: A Longitudinal Study of the Role of Attention, Network Density, and Motivations.",ICWSM,"Paul Russo,Oded Nov"
2009,"Contextuality and Beyond: Investigating an Online Diary Corpus.",ICWSM,"Laura Teddiman"
2013,"Crowdturfers, Campaigns, and Social Media: Tracking and Revealing Crowdsourced Manipulation of Social Media.",ICWSM,"Kyumin Lee,Prithivi Tamilarasan,James Caverlee"
2016,"Dissemination Biases of Social Media Channels: On the Topical Coverage of Socially Shared News.",ICWSM,"Abhijnan Chakraborty,Saptarshi Ghosh 0001,Niloy Ganguly,Krishna P. Gummadi"
2012,"Geographic Dissection of the Twitter Network.",ICWSM,"Juhi Kulshrestha,Farshad Kooti,Ashkan Nikravesh,P. Krishna Gummadi"
2019,"A Co-Training Model with Label Propagation on a Bipartite Graph to Identify Online Users with Disabilities.",ICWSM,"Xing Yu,Sunandan Chakraborty,Erin Brady"
2013,"Cultural Dimensions in Twitter: Time, Individualism and Power.",ICWSM,"Ruth Olimpia Garcia Gavilanes,Daniele Quercia,Alejandro Jaimes"
2011,"Seven Months with the Devils: A Long-Term Study of Content Polluters on Twitter.",ICWSM,"Kyumin Lee,Brian David Eoff,James Caverlee"
2019,"A Large-Scale Study of ISIS Social Media Strategy: Community Size, Collective Influence, and Behavioral Impact.",ICWSM,"Majid Alfifi,Parisa Kaghazgaran,James Caverlee,Fred Morstatter"
2018,"Ecosystem or Echo-System? Exploring Content Sharing across Alternative Media Domains.",ICWSM,"Kate Starbird,Ahmer Arif,Tom Wilson 0003,Katherine Van Koevering,Katya Yefimova,Daniel Scarnecchia"
2017,"Characteristics of On-Time and Late Reward Delivery Projects.",ICWSM,"Thanh Tran 0005,Kyumin Lee"
2012,"Happy, Nervous or Surprised? Classification of Human Affective States in Social Media.",ICWSM,"Munmun De Choudhury,Michael Gamon,Scott Counts"
2009,"Using Transactional Information to Predict Link Strength in Online Social Networks.",ICWSM,"Indika Kahanda,Jennifer Neville"
2018,"Quantifying the Impact of Cognitive Biases in Question-Answering Systems.",ICWSM,"Keith Burghardt,Tad Hogg,Kristina Lerman"
2015,"Audience Analysis for Competing Memes in Social Media.",ICWSM,"Samuel Carton,Souneil Park,Nicole Zeffer,Eytan Adar,Qiaozhu Mei,Paul Resnick"
2007,"Investigations in Collaborative Multi-Party Discourse.",ICWSM,"Andrew J. Cowell,Michelle L. Gregory"
2014,"School Bullying in Twitter and Weibo: A Comparative Study.",ICWSM,"Jun-Ming Xu 0002,Hsun-Chih Huang,Amy Bellmore,Xiaojin Zhu 0001"
2007,"An Activity-based Perspective of Collaborative Tagging.",ICWSM,"Shreeharsh Kelkar,Ajita John,Dorée D. Seligmann"
2012,"What Kobe Bryant and Britney Spears Have in Common: Mining Wikipedia for Characteristics of Notable Individuals.",ICWSM,"Pauline Crystal Ng"
2008,"The Psychology of Word Use in Depression Forums in English and in Spanish: Texting Two Text Analytic Approaches.",ICWSM,"Nairán Ramírez-Esparza,Cindy K. Chung,Ewa Kacewicz,James W. Pennebaker"
2020,"Bridging Qualitative and Quantitative Methods for User Modeling: Tracing Cancer Patient Behavior in an Online Health Community.",ICWSM,"Zachary Levonian,Drew Richard Erikson,Wenqi Luo,Saumik Narayanan,Sabirat Rubya,Prateek Vachher,Loren Terveen,Svetlana Yarosh"
2015,"Exemplar-Based Topic Detection in Twitter Streams.",ICWSM,"Ahmed Elbagoury,Rania Ibrahim,Ahmed K. Farahat,Mohamed S. Kamel,Fakhri Karray"
2009,"MakeMyPage: Social Media Meets Automatic Content Generation.",ICWSM,"Francisco Iacobelli,Kristian J. Hammond,Larry Birnbaum"
2010,"Voices of Vlogging.",ICWSM,"Joan-Isaac Biel,Daniel Gatica-Perez"
2013,"De-Anonymizing Users Across Heterogeneous Social Computing Platforms.",ICWSM,"Mohammed Korayem,David J. Crandall"
2017,"To Help or Hinder: Real-Time Chat in Citizen Science.",ICWSM,"Ramine Tinati,Elena Simperl,Markus Luczak-Rösch"
2020,"No Robots, Spiders, or Scrapers: Legal and Ethical Regulation of Data Collection Methods in Social Media Terms of Service.",ICWSM,"Casey Fiesler,Nathan Beard,Brian C. Keegan"
2018,"Real-World Witness Detection in Social Media via Hybrid Crowdsensing.",ICWSM,"Stefano Cresci,Andrea Cimino,Marco Avvenuti,Maurizio Tesconi,Felice Dell'Orletta"
2016,"Visualization Tool for Collective Awareness in a Platform of Citizen Proposals.",ICWSM,"Pablo Aragón,Vicenç Gómez,Andreas Kaltenbrunner"
2017,"From Camera to Deathbed: Understanding Dangerous Selfies on Social Media.",ICWSM,"Hemank Lamba,Varun Bharadhwaj,Mayank Vachher,Divyansh Agarwal,Megha Arora,Niharika Sachdeva,Ponnurangam Kumaraguru"
2012,"The Social World of Twitter: Topics, Geography, and Emotions.",ICWSM,"Daniele Quercia,Licia Capra,Jon Crowcroft"
2020,"Leveraging Mobility Flows from Location Technology Platforms to Test Crime Pattern Theory in Large Cities.",ICWSM,"Cristina Kadar,Stefan Feuerriegel,Anastasios Noulas,Cecilia Mascolo"
2016,"Cross Social Media Recommendation.",ICWSM,"Xiaozhong Liu,Tian Xia,Yingying Yu,Chun Guo 0001,Yizhou Sun"
2013,"A Data-Driven Analysis to Question Epidemic Models for Citation Cascades on the Blogosphere.",ICWSM,"Abdelhamid Salah Brahim,Lionel Tabourier,Bénédicte Le Grand"
2019,"Using Search Queries to Understand Health Information Needs in Africa.",ICWSM,"Rediet Abebe,Shawndra Hill,Jennifer Wortman Vaughan,Peter M. Small,H. Andrew Schwartz"
2014,"Magnet News: You Choose the Polarity of What You Read.",ICWSM,"Júlio Cesar dos Reis,Pollyanna Gonçalves,Pedro Olmo Stancioli Vaz de Melo,Raquel O. Prates,Fabrício Benevenuto"
2011,"Trust Amongst Rogues? A Hypergraph Approach for Comparing Clandestine Trust Networks in MMOGs.",ICWSM,"Muhammad Aurangzeb Ahmad,Brian Keegan,Dmitri Williams,Jaideep Srivastava,Noshir S. Contractor"
2012,"Semantic Social Networks Constructed by Topical Aspects of Conversations: An Explorative Study.",ICWSM,"Jiyeon Jang,Jinhyuk Choi,Gwan Jang,Sung-Hyon Myaeng"
2013,"Emoticon Style: Interpreting Differences in Emoticons Across Cultures.",ICWSM,"Jaram Park,Vladimir Barash,Clay Fink,Meeyoung Cha"
2014,"Network Weirdness: Exploring the Origins of Network Paradoxes.",ICWSM,"Farshad Kooti,Nathan Oken Hodas,Kristina Lerman"
2020,"The Relative Value of Facebook Advertising Data for Poverty Mapping.",ICWSM,"Masoomali Fatehkia,Benjamin Coles,Ferda Ofli,Ingmar Weber"
2017,""Voters of the Year": 19 Voters Who Were Unintentional Election Poll Sensors on Twitter.",ICWSM,"William Hobbs,Lisa Friedland,Kenneth Joseph,Oren Tsur,Stefan Wojcik,David Lazer"
2011,"Location3: How Users Share and Respond to Location-Based Data on Social.",ICWSM,"Jonathan Chang,Eric Sun"
2012,"Differences in Language and Style Between Two Social Media Communities.",ICWSM,"Cécile Paris,Paul Thomas,Stephen Wan 0001"
2018,"Leveraging Friendship Networks for Dynamic Link Prediction in Social Interaction Networks.",ICWSM,"Ruthwik R. Junuthula,Kevin S. Xu 0001,Vijay K. Devabhaktuni"
2011,"Divided They Tweet: The Network Structure of Political Microbloggers and Discussion Topics.",ICWSM,"Albert Feller,Matthias Kuhnert,Timm Oliver Sprenger,Isabell M. Welpe"
2015,""I Didn't Sign Up for This!": Informed Consent in Social Network Research.",ICWSM,"Luke Hutton,Tristan Henderson"
2011,"Culture Matters: A Survey Study of Social Q&A Behavior.",ICWSM,"Jiang Yang,Meredith Ringel Morris,Jaime Teevan,Lada A. Adamic,Mark S. Ackerman"
2012,"The Pulse of News in Social Media: Forecasting Popularity.",ICWSM,"Roja Bandari,Sitaram Asur,Bernardo A. Huberman"
2017,"What Gets Media Attention and How Media Attention Evolves Over Time: Large-Scale Empirical Evidence from 196 Countries.",ICWSM,"Jisun An,Haewoon Kwak"
2020,"Detecting Troll Behavior via Inverse Reinforcement Learning: A Case Study of Russian Trolls in the 2016 US Election.",ICWSM,"Luca Luceri,Silvia Giordano,Emilio Ferrara"
2007,"Diffusion of Recommendation through a Trust Network.",ICWSM,"Yutaka Matsuo,Hikaru Yamamoto"
2011,"Identifying Representative Textual Sources in Blog Networks.",ICWSM,"Karen Wade,Derek Greene,Conrad Lee,Daniel Archambault,Pádraig Cunningham"
2018,"Graph Based Semi-Supervised Learning with Convolution Neural Networks to Classify Crisis Related Tweets.",ICWSM,"Firoj Alam,Shafiq R. Joty,Muhammad Imran 0002"
2011,"MODEC - Modeling and Detecting Evolutions of Communities.",ICWSM,"Mansoureh Takaffoli,Farzad Sangi,Justin Fagnan,Osmar R. Zaïane"
2016,"Emotions, Demographics and Sociability in Twitter Interactions.",ICWSM,"Kristina Lerman,Megha Arora,Luciano Gallegos,Ponnurangam Kumaraguru,David García 0001"
2011,"Latent Set Models for Two-Mode Network Data.",ICWSM,"Christopher DuBois,James R. Foulds,Padhraic Smyth"
2013,"Experiments on Motivational Feedback for Crowdsourced Workers.",ICWSM,"Tak Yeon Lee,Casey Dugan,Werner Geyer,Tristan Ratchford,Jamie C. Rasmussen,N. Sadat Shami,Stela Lupushor"
2016,"Space Collapse: Reinforcing, Reconfiguring and Enhancing Chinese Social Practices through WeChat.",ICWSM,"Yang Wang,Yao Li 0006,Bryan C. Semaan,Jian Tang"
2012,"Facebook, Youth and Privacy in Networked Publics.",ICWSM,"Zeynep Tufekci"
2013,"The Anatomy of Large Facebook Cascades.",ICWSM,"P. Alex Dow,Lada A. Adamic,Adrien Friggeri"
2017,"On the Interpretability of Thresholded Social Networks.",ICWSM,"Oren Tsur,David Lazer"
2017,"Who Makes Trends? Understanding Demographic Biases in Crowdsourced Recommendations.",ICWSM,"Abhijnan Chakraborty,Johnnatan Messias,Fabrício Benevenuto,Saptarshi Ghosh 0001,Niloy Ganguly,Krishna P. Gummadi"
2010,"Local Networks, Local Topics: Structural and Semantic Proximity in Blogspace.",ICWSM,"Jean-Philippe Cointet,Camille Roth"
2013,"That's What Friends Are For: Inferring Location in Online Social Media Platforms Based on Social Relationships.",ICWSM,"David Jurgens"
2009,"Regression-Based Summarization of Email Conversations.",ICWSM,"Jan Ulrich,Giuseppe Carenini,Gabriel Murray,Raymond T. Ng"
2011,"Using Network Structure to Identify Groups in Virtual Worlds.",ICWSM,"Fahad Shah,Gita Reese Sukthankar"
2008,"Link-PLSA-LDA: A New Unsupervised Model for Topics and Influence of Blogs.",ICWSM,"Ramesh Nallapati,William W. Cohen"
2011,"Large-Scale Community Detection on YouTube for Topic Discovery and Exploration.",ICWSM,"Ullas Gargi,Wenjun Lu,Vahab S. Mirrokni,Sangho Yoon"
2009,"Is Your Profile Picture Worth 1000 Words? Photo Characteristics Associated with Personality Impression Agreement.",ICWSM,"Fitzgerald Steele Jr.,David C. Evans 0002,Rachel K. Green"
2019,"Sharing Emotions at Scale: The Vent Dataset.",ICWSM,"Nikolaos Lykousas,Constantinos Patsakis,Andreas Kaltenbrunner,Vicenç Gómez"
2016,"Analyzing Social Event Participants for a Single Organizer.",ICWSM,"Jyun-Yu Jiang,Cheng-Te Li"
2016,"Privacy Preference Inference via Collaborative Filtering.",ICWSM,"Taraneh Khazaei,Lu Xiao 0002,Robert E. Mercer,Atif Khan"
2013,"Wedding Dresses and Wanted Criminals: Pinterest.com as an Infrastructure for Repository Building.",ICWSM,"Michael A. Zarro,Catherine Hall,Andrea Forte"
2018,"LearningQ: A Large-Scale Dataset for Educational Question Generation.",ICWSM,"Guanliang Chen,Jie Yang,Claudia Hauff,Geert-Jan Houben"
2009,"Information Cascades in the Blogosphere: A Look Behind the Curtain.",ICWSM,"Manos Papagelis,Nilesh Bansal,Nick Koudas"
2007,"Visual Analysis of Weblog Content.",ICWSM,"David McColgin,Nick Cramer,Michelle L. Gregory,Deborah Payne,Douglas Love"
2009,"Analyzing and Predicting Community Preference of Socially Generated Metadata: A Case Study on Comments in the Digg Community.",ICWSM,"Elham Khabiri,Chiao-Fang Hsu,James Caverlee"
2016,"Who Will Respond to Your Requests for Instant Trouble-Shooting?",ICWSM,"Kai-Hsiang Hsu,Cheng-Te Li,Chien-Lin Tseng"
2017,"Nasty, Brutish, and Short: What Makes Election News Popular on Twitter?",ICWSM,"Sophie Chou,Deb Roy"
2011,"Socio-Spatial Properties of Online Location-Based Social Networks.",ICWSM,"Salvatore Scellato,Anastasios Noulas,Renaud Lambiotte,Cecilia Mascolo"
2012,"Distributional Footprints of Deceptive Product Reviews.",ICWSM,"Song Feng,Longfei Xing,Anupam Gogar,Yejin Choi"
2013,"Preface.",ICWSM,""
2009,"The Use of Weblogs in Spanish Mainstream Media.",ICWSM,"Maria Bella Palomo Torres,Koldo Meso Ayerdi"
2016,"Deciphering the 2016 U.S. Presidential Campaign in the Twitter Sphere: A Comparison of the Trumpists and Clintonists.",ICWSM,"Yu Wang 0041,Yuncheng Li,Jiebo Luo"
2012,"Mixed Membership Models for Exploring User Roles in Online Fora.",ICWSM,"Arthur J. White,Jeffrey Chan,Conor Hayes,Thomas Brendan Murphy"
2017,"Sparse Overlap Cross-Platform Recommendation Via Adaptive Similarity Structure Regularization.",ICWSM,"Hanqing Lu,Chaochao Chen 0001,Qinyue Jiang"
2013,"Structural Dynamics of Knowledge Networks.",ICWSM,"Julia Preusse,Jérôme Kunegis,Matthias Thimm,Steffen Staab,Thomas Gottron"
2008,"A Social Network Based Approach to Personalized Recommendation of Participatory Media Content.",ICWSM,"Aaditeshwar Seth,Jie Zhang 0002"
2013,"A Penny for Your Tweets: Campaign Contributions and Capitol Hill Microblogs.",ICWSM,"Tae Yano,Dani Yogatama,Noah A. Smith"
2016,"Ephemeral Photowork: Understanding the Mobile Social Photography Ecosystem.",ICWSM,"Barry A. T. Brown,Frank Bentley,Saeideh Bakhshi,David A. Shamma"
2016,"Investigating the Observability of Complex Contagion in Empirical Social Networks.",ICWSM,"Clay Fink,Aurora Schmidt,Vladimir Barash,John Kelly,Christopher J. Cameron,Michael Macy"
2019,"Dumping the Closet Skeletons Online: Exploring the Guilty Information Disclosure Behavior on Social Media.",ICWSM,"Yukun Yang,Yeman Huang"
2020,"Ginger Cannot Cure Cancer: Battling Fake Health News with a Comprehensive Data Repository.",ICWSM,"Enyan Dai,Yiwei Sun,Suhang Wang"
2016,"Topic Modeling in Twitter: Aggregating Tweets by Conversations.",ICWSM,"David Alvarez-Melis,Martin Saveski"
2012,"Privacy in Interaction: Exploring Disclosure and Social Capital in Facebook.",ICWSM,"Frederic Stutzman,Jessica Vitak,Nicole B. Ellison,Rebecca Gray,Cliff Lampe"
2014,"How Community Feedback Shapes User Behavior.",ICWSM,"Justin Cheng,Cristian Danescu-Niculescu-Mizil,Jure Leskovec"
2019,"A Generative Model for Discovering Action-Based Roles and Community Role Compositions on Community Question Answering Platforms.",ICWSM,"Chase Geigle,Himel Dev,Hari Sundaram,ChengXiang Zhai"
2018,"The Impact of Recipe Features, Social Cues and Demographics on Estimating the Healthiness of Online Recipes.",ICWSM,"Markus Rokicki,Christoph Trattner,Eelco Herder"
2014,"Great Question! Question Quality in Community Q&A.",ICWSM,"Sujith Ravi,Bo Pang 0001,Vibhor Rastogi,Ravi Kumar 0001"
2013,"Artist Popularity: Do Web and Social Music Services Agree?",ICWSM,"Alejandro Bellogín,Arjen P. de Vries,Jiyin He"
2007,"Social Networks and Social Information Filtering on Digg.",ICWSM,"Kristina Lerman"
2015,"A Bayesian Graphical Model to Discover Latent Events from Twitter.",ICWSM,"Wei Wei 0019,Kenneth Joseph,Wei Lo,Kathleen M. Carley"
2018,"Sampling the News Producers: A Large News and Feature Data Set for the Study of the Complex Media Landscape.",ICWSM,"Benjamin D. Horne,Sara Khedr,Sibel Adali"
2014,"Modeling Bursty Temporal Pattern of Rumors.",ICWSM,"Sejeong Kwon,Meeyoung Cha"
2014,"What We Instagram: A First Analysis of Instagram Photo Content and User Types.",ICWSM,"Yuheng Hu,Lydia Manikonda,Subbarao Kambhampati"
2010,"What Makes a Blog a Blog? Exploring User Conceptualizations of an Old "New" Online Medium.",ICWSM,"Jeffrey William Treem,Kristin Yates Thomas"
2019,"Studying Cultural Differences in Emoji Usage across the East and the West.",ICWSM,"Sharath Chandra Guntuku,Mingyang Li,Louis Tay,Lyle H. Ungar"
2020,"The Political Dashboard: A Tool for Online Political Transparency.",ICWSM,"Juan Carlos Medina Serrano,Orestis Papakyriakopoulos,Morteza Shahrezaye,Simon Hegelich"
2018,"Understanding Web Archiving Services and Their (Mis)Use on Social Media.",ICWSM,"Savvas Zannettou,Jeremy Blackburn,Emiliano De Cristofaro,Michael Sirivianos,Gianluca Stringhini"
2019,"Environmental Changes and the Dynamics of Musical Identity.",ICWSM,"Samuel F. Way,Santiago Gil,Ian Anderson 0003,Aaron Clauset"
2013,"Workshops.",ICWSM,""
2007,"A Case Study of Blog Comments in a National Crisis.",ICWSM,"Noor Ali-Hasan,Lada A. Adamic"
2008,"Spontaneous Inference of Personality Traits and Effects on Memory for Online Profiles.",ICWSM,"Kristin Brooke Stecher,Scott Counts"
2018,"Using Simpson's Paradox to Discover Interesting Patterns in Behavioral Data.",ICWSM,"Nazanin Alipourfard,Peter G. Fennell,Kristina Lerman"
2011,"Memes Online: Extracted, Subtracted, Injected, and Recollected.",ICWSM,"Matthew P. Simmons,Lada A. Adamic,Eytan Adar"
2015,"Covering the Egonet: A Crowdsourcing Approach to Social Circle Discovery on Twitter.",ICWSM,"Karmen Lata Dykstra,Jefrey Lijffijt,Aristides Gionis"
2015,"Twitter Geolocation and Regional Classification via Sparse Coding.",ICWSM,"Miriam Cha,Youngjune Gwon,H. T. Kung 0001"
2015,"Making Use of Derived Personality: The Case of Social Media Ad Targeting.",ICWSM,"Jilin Chen,Eben M. Haber,Ruogu Kang,Gary Hsieh,Jalal Mahmud"
2017,"Changes in Social Media Behavior During Life Periods of Uncertainty.",ICWSM,"Xinru Page,Marco Marabelli"
2007,"Watching the Blogosphere: Knowledge Sharing in the Web 2.0.",ICWSM,"Ralf Klamma,Yiwei Cao,Marc Spaniol"
2010,"Activity Lifespan: An Analysis of User Survival Patterns in Online Knowledge Sharing Communities.",ICWSM,"Jiang Yang,Xiao Wei,Mark S. Ackerman,Lada A. Adamic"
2009,"Gephi: An Open Source Software for Exploring and Manipulating Networks.",ICWSM,"Mathieu Bastian,Sebastien Heymann,Mathieu Jacomy"
2013,"Understanding the Roles and Uses of Web Tutorials.",ICWSM,"Ben Lafreniere,Andrea Bunt,Matthew Lount,Michael A. Terry"
2018,""At Least the Pizzas You Make Are Hot": Norms, Values, and Abrasive Humor on the Subreddit r/RoastMe.",ICWSM,"Anna Kasunic,Geoff Kaufman"
2019,"Shouting into the Void: A Database of the Alternative Social Media Platform Gab.",ICWSM,"Gabriel Fair,Ryan Wesslen"
2008,"The Politics of Sourcing: A Study of Journalistic Practices in the Blogosphere.",ICWSM,"Gina Walejko,Thomas Ksiazek"
2013,"Keynote Addresses.",ICWSM,""
2013,"Where Would You Go this Weekend? Time-Dependent Prediction of User Activity Using Social Network Data.",ICWSM,"Evgeniy Bart,Rui Zhang,Muzammil Hussain"
2012,"What's in Your Tweets? I Know Who You Supported in the UK 2010 General Election.",ICWSM,"Antoine Boutet,Hyoungshick Kim,Eiko Yoneki"
2010,"Monetary Value of Customer Networks in Mobile Social Networking Services.",ICWSM,"Naohiro Matsumura,Hikaru Yamamoto"
2009,"User Evaluation of a System for Classifying and Displaying Political Viewpoints of Weblogs.",ICWSM,"Alice H. Oh,Hyun-Jong Lee,Young-Min Kim"
2011,"Connecting Mutually Influencing Bloggers.",ICWSM,"Aditya Pal,Jaya Kawale"
2013,"The Where and When of Finding New Friends: Analysis of a Location-based Social Discovery Network.",ICWSM,"Terence Chen,Mohamed Ali Kâafar,Roksana Boreli"
2010,"Generating Domain-Specific Clues Using News Corpus for Sentiment Classification.",ICWSM,"Youngho Kim,Yoonjung Choi,Sung-Hyon Myaeng"
2013,"Reviving Dormant Ties in an Online Social Network Experiment.",ICWSM,"Ee-Peng Lim,Denzil Correa,David Lo 0001,Michael Finegold,Feida Zhu 0001"
2020,"A Dataset of Fact-Checked Images Shared on WhatsApp During the Brazilian and Indian Elections.",ICWSM,"Julio C. S. Reis,Philipe F. Melo,Kiran Garimella,Jussara M. Almeida,Dean Eckles,Fabrício Benevenuto"
2007,"Analyzing Trends in the Blogosphere Using Human-Centered Analysis and Visualization Tools.",ICWSM,"Xavier Llorà,Noriko Imafuji Yasui,David E. Goldberg"
2012,"Global Dynamics of Online Group Conversations.",ICWSM,"Rushi Bhatt,Kishor Barman"
2013,"A Crowd-Powered Socially Embedded Search Engine.",ICWSM,"Jin-Woo Jeong,Meredith Ringel Morris,Jaime Teevan,Daniel J. Liebling"
2015,"Comparing Events Coverage in Online News and Social Media: The Case of Climate Change.",ICWSM,"Alexandra Olteanu,Carlos Castillo 0001,Nicholas Diakopoulos,Karl Aberer"
2020,"Causal Factors of Effective Psychosocial Outcomes in Online Mental Health Communities.",ICWSM,"Koustuv Saha,Amit Sharma"
2017,"Which Size Matters? Effects of Crowd Size on Solution Quality in Big Data Q&A Communities.",ICWSM,"Yla R. Tausczik,Ping Wang,Joohee Choi"
2015,"An Ethnomethodologically-Informed Approach to Interface Design for Social Interactions around Video Online.",ICWSM,"Anna Zawilska,Steven Albury"
2017,"State of the Geotags: Motivations and Recent Changes.",ICWSM,"Dan Tasse,Zichen Liu,Alex Sciuto,Jason I. Hong"
2010,"Mobilizing Lurkers with a Targeted Task.",ICWSM,"Rosta Farzan,Joan Morris DiMicco,Beth Brownholtz"
2019,"WhatsApp Monitor: A Fact-Checking System for WhatsApp.",ICWSM,"Philipe F. Melo,Johnnatan Messias,Gustavo Resende,Kiran Garimella,Jussara M. Almeida,Fabrício Benevenuto"
2007,"Sociological Typology of Personal Blogs.",ICWSM,"Dominique Cardon,Hélène Delaunay-Teterel,Cédric Fluckiger,Christophe Prieur 0002"
2012,"Social Network Sites: Indispensable or Optional Social Tools?",ICWSM,"Irina Shklovski"
2017,"Detecting the Hate Code on Social Media.",ICWSM,"Rijul Magu,Kshitij Joshi 0001,Jiebo Luo"
2012,"The Good, the Bad, and the Angry: Analyzing Crowdsourced Impressions of Vloggers.",ICWSM,"Joan-Isaac Biel,Daniel Gatica-Perez"
2018,"Follow the "Mastodon": Structure and Evolution of a Decentralized Online Social Network.",ICWSM,"Matteo Zignani,Sabrina Gaito,Gian Paolo Rossi 0001"
2009,"Navigation Patterns from and to Social Media.",ICWSM,"Michael Gamon,Arnd Christian König"
2010,"ICWSM - A Great Catchy Name: Semi-Supervised Recognition of Sarcastic Sentences in Online Product Reviews.",ICWSM,"Oren Tsur,Dmitry Davidov,Ari Rappoport"
2016,"Exploring Personal Attributes from Unprotected Interactions.",ICWSM,"Pritam Gundecha,Jiliang Tang,Xia Hu,Huan Liu 0001"
2012,"Finding Influential Authors in Brand-Page Communities.",ICWSM,"Hemant Purohit,Jitendra Ajmera,Sachindra Joshi,Ashish Verma,Amit P. Sheth"
2018,"Conspiracies Online: User Discussions in a Conspiracy Community Following Dramatic Events.",ICWSM,"Mattia Samory,Tanushree Mitra"
2020,"Characterising User Content on a Multi-Lingual Social Network.",ICWSM,"Pushkal Agarwal,Kiran Garimella,Sagar Joglekar,Nishanth Sastry,Gareth Tyson"
2009,"Collecting and Sharing Observations with Semantic Support.",ICWSM,"Sari Vainikainen,Antti Nummiaho,Asta Bäck,Timo Laakko"
2017,"Towards Measuring Fine-Grained Diversity Using Social Media Photographs.",ICWSM,"Vivek Kumar Singh,Saket Hegde,Akanksha Atrey"
2011,"The Party Is Over Here: Structure and Content in the 2010 Election.",ICWSM,"Avishay Livne,Matthew P. Simmons,Eytan Adar,Lada A. Adamic"
2018,"Forecasting the Presence and Intensity of Hostility on Instagram Using Linguistic and Social Features.",ICWSM,"Ping Liu,Joshua Guberman,Libby Hemphill,Aron Culotta"
2007,"Personalized Tag Recommendations via Tagging and Content-based Similarity Metrics.",ICWSM,"Andrew Byde,Hui Wan 0001,Steve Cayzer"
2015,"Where Is the Soho of Rome? Measures and Algorithms for Finding Similar Neighborhoods in Cities.",ICWSM,"Géraud Le Falher,Aristides Gionis,Michael Mathioudakis"
2007,"SocioBiblog: Enabling Communication on Bibliography with Semantic Blogging.",ICWSM,"Aman Shakya,Hideaki Takeda 0001,Vilas Wuwongse,Ikki Ohmukai"
2011,"Can the Ambiance of a Place be Determined by the User Profiles of the People Who Visit It?",ICWSM,"Lindsay T. Graham,Samuel D. Gosling"
2018,"On Group Popularity Prediction in Event-Based Social Networks.",ICWSM,"Guangyu Li,Yong Liu 0013,Bruno Ribeiro 0001,Hao Ding"
2012,"Weblog Analysis for Predicting Correlations in Stock Price Evolutions.",ICWSM,"Milad Kharratzadeh,Mark Coates"
2014,""Our Grief is Unspeakable": Automatically Measuring the Community Impact of a Tragedy.",ICWSM,"Kimberly Glasgow,Clayton Fink,Jordan L. Boyd-Graber"
2020,"Analysing the Extent of Misinformation in Cancer Related Tweets.",ICWSM,"Rakesh Bal,Sayan Sinha,Swastika Dutta,Rishabh Joshi,Sayan Ghosh 0002,Ritam Dutt"
2018,"When Online Harassment Is Perceived as Justified.",ICWSM,"Lindsay Blackwell,Tianying Chen,Sarita Schoenebeck,Cliff Lampe"
2012,"Talk of the City: Our Tweets, Our Community Happiness.",ICWSM,"Daniele Quercia,Diarmuid Ó Séaghdha,Jon Crowcroft"
2007,"No Blog is an Island - Analyzing Connections Across Information Networks.",ICWSM,"Smriti Bhagat,Graham Cormode,S. Muthukrishnan,Irina Rozenbaum,Hongyi Xue"
2017,"Dynamics of Content Quality in Collaborative Knowledge Production.",ICWSM,"Emilio Ferrara,Nazanin Alipourfard,Keith Burghardt,Chiranth Gopal,Kristina Lerman"
2009,"An Examination of Language Use in Online Dating Profiles.",ICWSM,"Meenakshi Nagarajan,Marti A. Hearst"
2012,"Stuff IBMers Say: Microblogs as an Expression of Organizational Culture.",ICWSM,"Jennifer Thom,David R. Millen"
