2004,"Effective localized regression for damage detection in large complex mechanical structures.",KDD,"Aleksandar Lazarevic,Ramdev Kanapady,Chandrika Kamath"
1998,"Aggregation of Imprecise and Uncertain Information for Knowledge Discovery in Databases.",KDD,"Sally I. McClean,Bryan W. Scotney,Mary Shapcott"
2013,"The online revolution: education for everyone.",KDD,"Andrew Y. Ng,Daphne Koller"
2020,"Accessible Online Meetings and Presentations.",KDD,"Brianna Blaser"
2011,"Collective graph identification.",KDD,"Galileo Namata,Stanley Kok,Lise Getoor"
2020,"Recent Advances in Multimodal Educational Data Mining in K-12 Education.",KDD,"Zitao Liu,Songfan Yang,Jiliang Tang,Neil Heffernan,Rose Luckin"
1997,"Image Feature Reduction through Spoiling: Its Application to Multiple Matched Filters for Focus of Attention.",KDD,"Timothy M. Stough,Carla E. Brodley"
2014,"Representative clustering of uncertain data.",KDD,"Andreas Züfle,Tobias Emrich,Klaus Arthur Schmid,Nikos Mamoulis,Arthur Zimek,Matthias Renz"
1999,"Identifying Distinctive Subsequences in Multivariate Time Series by Clustering.",KDD,"Tim Oates"
2013,"Spotting opinion spammers using behavioral footprints.",KDD,"Arjun Mukherjee,Abhinav Kumar,Bing Liu 0001,Junhui Wang,Meichun Hsu,Malú Castellanos,Riddhiman Ghosh"
2017,"Deep Design: Product Aesthetics for Heterogeneous Markets.",KDD,"Yanxin Pan,Alexander Burnap,Jeffrey Hartley,Richard Gonzalez,Panos Y. Papalambros"
2017,"Automatic Application Identification from Billions of Files.",KDD,"Kyle Soska,Christopher S. Gates,Kevin A. Roundy,Nicolas Christin"
2012,"Fast algorithms for comprehensive n-point correlation estimates.",KDD,"William B. March,Andrew J. Connolly,Alexander G. Gray"
2013,"Robust principal component analysis via capped norms.",KDD,"Qian Sun,Shuo Xiang,Jieping Ye"
2006,"Learning the unified kernel machines for classification.",KDD,"Steven C. H. Hoi,Michael R. Lyu,Edward Y. Chang"
2002,"Transforming classifier scores into accurate multiclass probability estimates.",KDD,"Bianca Zadrozny,Charles Elkan"
2020,"Learning with Limited Labels via Momentum Damped & Differentially Weighted Optimization.",KDD,"Rishabh Mehrotra,Ashish Gupta"
2017,"GRAM: Graph-based Attention Model for Healthcare Representation Learning.",KDD,"Edward Choi,Mohammad Taha Bahadori,Le Song,Walter F. Stewart,Jimeng Sun"
2015,"Data, Knowledge and Discovery: Machine Learning meets Natural Science.",KDD,"Hugh F. Durrant-Whyte"
2000,"Data selection for support vector machine classifiers.",KDD,"Glenn Fung,Olvi L. Mangasarian"
2012,"Scalable misbehavior detection in online video chat services.",KDD,"Xinyu Xing,Yu-Li Liang,Sui Huang,Hanqiang Cheng,Richard Han,Qin Lv,Xue Liu,Shivakant Mishra,Yi Zhu"
2019,"DeepRoof: A Data-driven Approach For Solar Potential Estimation Using Rooftop Imagery.",KDD,"Stephen Lee,Srinivasan Iyengar,Menghong Feng,Prashant J. Shenoy,Subhransu Maji"
2009,"Large human communication networks: patterns and a utility-driven generator.",KDD,"Nan Du,Christos Faloutsos,Bai Wang 0001,Leman Akoglu"
2004,"Why collective inference improves relational classification.",KDD,"David D. Jensen,Jennifer Neville,Brian Gallagher"
2017,"STAR: A System for Ticket Analysis and Resolution.",KDD,"Wubai Zhou,Wei Xue,Ramesh Baral,Qing Wang 0016,Chunqiu Zeng,Tao Li 0001,Jian Xu 0009,Zheng Liu 0001,Larisa Shwartz,Genady Ya. Grabarnik"
2000,"Feature selection in unsupervised learning via evolutionary search.",KDD,"YongSeog Kim,W. Nick Street,Filippo Menczer"
2013,"An online system with end-user services: mining novelty concepts from tv broadcast subtitles.",KDD,"Mika Rautiainen,Jouni Sarvanko,Arto Heikkinen,Mika Ylianttila,Vassilis Kostakos"
2020,"Preserving Integrity in Online Social Media.",KDD,"Alon Y. Halevy"
2000,"The generalized Bayesian committee machine.",KDD,"Volker Tresp"
2019,"Topic-Enhanced Memory Networks for Personalised Point-of-Interest Recommendation.",KDD,"Xiao Zhou,Cecilia Mascolo,Zhongxiang Zhao"
2020,"Higher-order Clustering in Complex Heterogeneous Networks.",KDD,"Aldo G. Carranza,Ryan A. Rossi,Anup Rao 0002,Eunyee Koh"
2017,"GELL: Automatic Extraction of Epidemiological Line Lists from Open Sources.",KDD,"Saurav Ghosh,Prithwish Chakraborty,Bryan L. Lewis,Maimuna S. Majumder,Emily Cohn,John S. Brownstein,Madhav V. Marathe,Naren Ramakrishnan"
2004,"Privacy-preserving Bayesian network structure computation on distributed heterogeneous data.",KDD,"Rebecca N. Wright,Zhiqiang Yang"
2000,"Data mining to detect abnormal behavior in aerospace data.",KDD,"José M. Peña 0002,Fazel Famili,Sylvain Létourneau"
1996,"Error-Based and Entropy-Based Discretization of Continuous Features.",KDD,"Ron Kohavi,Mehran Sahami"
2018,"A Dual Markov Chain Topic Model for Dynamic Environments.",KDD,"Ayan Acharya,Joydeep Ghosh,Mingyuan Zhou"
2013,"Fast and scalable polynomial kernels via explicit feature maps.",KDD,"Ninh Pham,Rasmus Pagh"
2005,"Fast discovery of unexpected patterns in data, relative to a Bayesian network.",KDD,"Szymon Jaroszewicz,Tobias Scheffer"
2019,"Personalized Attraction Enhanced Sponsored Search with Multi-task Learning.",KDD,"Wei Zhao 0019,Boxuan Zhang,Beidou Wang,Ziyu Guan,Wanxian Guan,Guang Qiu,Wei Ning,Jiming Chen,Hongmin Liu 0001"
2017,"Three Principles of Data Science: Predictability, Stability and Computability.",KDD,"Bin Yu"
2014,"Travel time estimation of a path using sparse trajectories.",KDD,"Yilun Wang,Yu Zheng,Yexiang Xue"
2017,"Unsupervised Discovery of Drug Side-Effects from Heterogeneous Data Sources.",KDD,"Fenglong Ma,Chuishi Meng,Houping Xiao,Qi Li 0012,Jing Gao 0004,Lu Su,Aidong Zhang"
2015,"Focusing on the Long-term: It's Good for Users and Business.",KDD,"Henning Hohnhold,Deirdre O'Brien,Diane Tang"
2020,"How Can Computer Science Education Address Inequities.",KDD,"Manuel A. Pérez-Quiñones"
1998,"Interestingness-Based Interval Merger for Numeric Association Rules.",KDD,"Ke Wang,Soon Hock William Tay,Bing Liu 0001"
2013,"Knowledge discovery from massive healthcare claims data.",KDD,"Varun Chandola,Sreenivas R. Sukumar,Jack C. Schryver"
2019,"A Minimax Game for Instance based Selective Transfer Learning.",KDD,"Bo Wang,Minghui Qiu,Xisen Wang,Yaliang Li,Yu Gong,Xiaoyi Zeng,Jun Huang 0007,Bo Zheng,Deng Cai 0001,Jingren Zhou"
2017,"A Data-driven Process Recommender Framework.",KDD,"Sen Yang 0002,Xin Dong 0010,Leilei Sun,Yichen Zhou,Richard A. Farneth,Hui Xiong 0001,Randall S. Burd,Ivan Marsic"
2010,"Estimating rates of rare events with multiple hierarchies through scalable log-linear models.",KDD,"Deepak Agarwal,Rahul Agrawal,Rajiv Khanna,Nagaraj Kota"
2018,"Generalized Score Functions for Causal Discovery.",KDD,"Biwei Huang,Kun Zhang 0001,Yizhu Lin,Bernhard Schölkopf,Clark Glymour"
2016,"Talent Circle Detection in Job Transition Networks.",KDD,"Huang Xu,Zhiwen Yu 0001,Jingyuan Yang,Hui Xiong 0001,Hengshu Zhu"
2015,"Organizational Chart Inference.",KDD,"Jiawei Zhang 0001,Philip S. Yu,Yuanhua Lv"
2012,"Inductive multi-task learning with multiple view data.",KDD,"Jintao Zhang,Jun Huan"
2020,"Parallel DNN Inference Framework Leveraging a Compact RISC-V ISA-based Multi-core System.",KDD,"Yipeng Zhang,Bo Du 0001,Lefei Zhang,Jia Wu 0001"
2005,"Parallel mining of closed sequential patterns.",KDD,"Shengnan Cong,Jiawei Han 0001,David A. Padua"
2003,"Finding recent frequent itemsets adaptively over online data streams.",KDD,"Joong Hyuk Chang,Won Suk Lee"
1996,"The Quest Data Mining System.",KDD,"Rakesh Agrawal 0001,Manish Mehta 0002,John C. Shafer,Ramakrishnan Srikant,Andreas Arning,Toni Bollinger"
2016,"Developing a Data-Driven Player Ranking in Soccer Using Predictive Model Weights.",KDD,"Joel Brooks,Matthew Kerr,John V. Guttag"
2003,"Information awareness: a prospective technical assessment.",KDD,"David D. Jensen,Matthew J. Rattigan,Hannah Blau"
2020,"Embedding-Driven Multi-Dimensional Topic Mining and Text Analysis.",KDD,"Yu Meng 0001,Jiaxin Huang,Jiawei Han 0001"
2018,"The Pinterest Approach to Machine Learning.",KDD,"Li Fan"
2000,"Small is beautiful: discovering the minimal set of unexpected patterns.",KDD,"Balaji Padmanabhan,Alexander Tuzhilin"
2015,"Voltage Correlations in Smart Meter Data.",KDD,"Rajendu Mitra,Ramachandra Kota,Sambaran Bandyopadhyay,Vijay Arya,Brian Sullivan,Richard Mueller,Heather Storey,Gerard Labut"
2010,"Direct mining of discriminative patterns for classifying uncertain data.",KDD,"Chuancong Gao,Jianyong Wang 0001"
2015,"TimeCrunch: Interpretable Dynamic Graph Summarization.",KDD,"Neil Shah,Danai Koutra,Tianmin Zou,Brian Gallagher,Christos Faloutsos"
2016,"Partial Label Learning via Feature-Aware Disambiguation.",KDD,"Min-Ling Zhang,Bin-Bin Zhou,Xu-Ying Liu"
2015,"Stream Sampling for Frequency Cap Statistics.",KDD,"Edith Cohen"
2010,"The community-search problem and how to plan a successful cocktail party.",KDD,"Mauro Sozio,Aristides Gionis"
2014,"Scaling out big data missing value imputations: pythia vs. godzilla.",KDD,"Christos Anagnostopoulos,Peter Triantafillou"
2018,"Extremely Fast Decision Tree.",KDD,"Chaitanya Manapragada,Geoffrey I. Webb,Mahsa Salehi"
2020,"An Automatic Approach for Generating Rich, Linked Geo-Metadata from Historical Map Images.",KDD,"Zekun Li,Yao-Yi Chiang,Sasan Tavakkol,Basel Shbita,Johannes H. Uhl,Stefan Leyk,Craig A. Knoblock"
2011,"Click shaping to optimize multiple objectives.",KDD,"Deepak Agarwal,Bee-Chung Chen,Pradheep Elango,Xuanhui Wang"
2009,"Mining brain region connectivity for alzheimer's disease study via sparse inverse covariance estimation.",KDD,"Liang Sun 0001,Rinkal Patel,Jun Liu 0003,Kewei Chen 0001,Teresa Wu,Jing Li 0016,Eric Reiman,Jieping Ye"
2013,"On the equivalent of low-rank linear regressions and linear discriminant analysis based regressions.",KDD,"Xiao Cai,Chris H. Q. Ding,Feiping Nie 0001,Heng Huang"
2004,"On the discovery of significant statistical quantitative rules.",KDD,"Hong Zhang,Balaji Padmanabhan,Alexander Tuzhilin"
2010,"Fast query execution for retrieval models based on path-constrained random walks.",KDD,"Ni Lao,William W. Cohen"
2009,"Data mining at NASA: from theory to applications.",KDD,"Ashok N. Srivastava"
2015,"COSNET: Connecting Heterogeneous Social Networks with Local and Global Consistency.",KDD,"Yutao Zhang,Jie Tang 0001,Zhilin Yang,Jian Pei,Philip S. Yu"
2012,"Chromatic correlation clustering.",KDD,"Francesco Bonchi,Aristides Gionis,Francesco Gullo,Antti Ukkonen"
2017,"Planning Bike Lanes based on Sharing-Bikes' Trajectories.",KDD,"Jie Bao 0003,Tianfu He,Sijie Ruan,Yanhua Li,Yu Zheng 0004"
2018,"Deep Multi-Output Forecasting: Learning to Accurately Predict Blood Glucose Trajectories.",KDD,"Ian Fox,Lynn Ang,Mamta Jaiswal,Rodica Pop-Busui,Jenna Wiens"
2016,"Sampling of Attributed Networks from Hierarchical Generative Models.",KDD,"Pablo Robles-Granda,Sebastián Moreno,Jennifer Neville"
2020,"The Data Science Mentoring Fire Next Time: Innovative Strategies for Mentoring in Data Science.",KDD,"Latifa Jackson,Heriberto Acosta Maestre"
1997,"Mining Multivariate Time-Series Sensor Data to Discover Behavior Envelopes.",KDD,"Dennis DeCoste"
2009,"Parallel community detection on large networks with propinquity dynamics.",KDD,"Yuzhou Zhang,Jianyong Wang 0001,Yi Wang 0008,Lizhu Zhou"
2015,"Using Local Spectral Methods to Robustify Graph-Based Learning Algorithms.",KDD,"David F. Gleich,Michael W. Mahoney"
2020,"HGCN: A Heterogeneous Graph Convolutional Network-Based Deep Learning Model Toward Collective Classification.",KDD,"Zhihua Zhu,Xinxin Fan,Xiaokai Chu,Jingping Bi"
1999,"A Statistical Theory for Quantitative Association Rules.",KDD,"Yonatan Aumann,Yehuda Lindell"
2015,"Why It Happened: Identifying and Modeling the Reasons of the Happening of Social Events.",KDD,"Yu Rong,Hong Cheng,Zhiyu Mo"
2014,"Almost linear-time algorithms for adaptive betweenness centrality using hypergraph sketches.",KDD,"Yuichi Yoshida"
2017,"Finding Precursors to Anomalous Drop in Airspeed During a Flight's Takeoff.",KDD,"Vijay Manikandan Janakiraman,Bryan L. Matthews,Nikunj C. Oza"
1999,"Trajectory Clustering with Mixtures of Regression Models.",KDD,"Scott Gaffney,Padhraic Smyth"
2014,"The interplay between dynamics and networks: centrality, communities, and cheeger inequality.",KDD,"Rumi Ghosh,Shang-Hua Teng,Kristina Lerman,Xiaoran Yan"
2014,"Batch discovery of recurring rare classes toward identifying anomalous samples.",KDD,"Murat Dundar,Halid Ziya Yerebakan,Bartek Rajwa"
2009,"Clustering event logs using iterative partitioning.",KDD,"Adetokunbo Makanju,A. Nur Zincir-Heywood,Evangelos E. Milios"
2007,"Co-clustering based classification for out-of-domain documents.",KDD,"Wenyuan Dai,Gui-Rong Xue,Qiang Yang 0001,Yong Yu 0001"
2005,"Nomograms for visualizing support vector machines.",KDD,"Aleks Jakulin,Martin Mozina,Janez Demsar,Ivan Bratko,Blaz Zupan"
2017,"Automated Categorization of Onion Sites for Analyzing the Darkweb Ecosystem.",KDD,"Shalini Ghosh,Ariyam Das,Phillip A. Porras,Vinod Yegneswaran,Ashish Gehani"
2017,"Estimation of Recent Ancestral Origins of Individuals on a Large Scale.",KDD,"Ross E. Curtis,Ahna Reza Girshick"
2015,"Interpreting Advertiser Intent in Sponsored Search.",KDD,"Bhanu Chandra Vattikonda,Santhosh Kodipaka,Hongyan Zhou,Vacha Dave,Saikat Guha,Alex C. Snoeren"
2018,"Societal Impact of Data Science and Artificial Intelligence.",KDD,"Foster J. Provost,James Hodson,Jeannette M. Wing,Qiang Yang,Jennifer Neville"
2019,"Large-Scale Training Framework for Video Annotation.",KDD,"Seong Jae Hwang,Joonseok Lee,Balakrishnan Varadarajan,Ariel Gordon,Zheng Xu,Apostol Natsev"
2006,"Algorithms for storytelling.",KDD,"Deept Kumar,Naren Ramakrishnan,Richard F. Helm,Malcolm Potts"
1995,"An Assessment of PrIL.",KDD,"Özden Gür-Ali,William A. Wallace"
2002,"CLOPE: a fast and effective clustering algorithm for transactional data.",KDD,"Yiling Yang,Xudong Guan,Jinyuan You"
2014,"MMRate: inferring multi-aspect diffusion networks with multi-pattern cascades.",KDD,"Senzhang Wang,Xia Hu,Philip S. Yu,Zhoujun Li"
2016,"A Text Clustering Algorithm Using an Online Clustering Scheme for Initialization.",KDD,"Jianhua Yin,Jianyong Wang 0001"
2006,"Efficient kernel feature extraction for massive data sets.",KDD,"Ivor W. Tsang,András Kocsor,James T. Kwok"
2017,"SPARTan: Scalable PARAFAC2 for Large & Sparse Data.",KDD,"Ioakeim Perros,Evangelos E. Papalexakis,Fei Wang 0001,Richard W. Vuduc,Elizabeth Searles,Michael Thompson,Jimeng Sun"
2010,"New perspectives and methods in link prediction.",KDD,"Ryan Lichtenwalter,Jake T. Lussier,Nitesh V. Chawla"
2012,"GigaTensor: scaling tensor analysis up by 100 times - algorithms and discoveries.",KDD,"U Kang,Evangelos E. Papalexakis,Abhay Harpale,Christos Faloutsos"
2020,"A Causal Look at Statistical Definitions of Discrimination.",KDD,"Elias Chaibub Neto"
1997,"Why Does Bagging Work? A Bayesian Account and its Implications.",KDD,"Pedro M. Domingos"
2014,"Online multiple kernel regression.",KDD,"Doyen Sahoo,Steven C. H. Hoi,Bin Li 0027"
2005,"A multiple tree algorithm for the efficient association of asteroid observations.",KDD,"Jeremy Kubica,Andrew W. Moore 0001,Andrew J. Connolly,Robert Jedicke"
2019,"A Robust Framework for Accelerated Outcome-driven Risk Factor Identification from EHR.",KDD,"Prithwish Chakraborty,Faisal Farooq"
2019,"A Visual Dialog Augmented Interactive Recommender System.",KDD,"Tong Yu 0001,Yilin Shen,Hongxia Jin"
2015,"Gender and Interest Targeting for Sponsored Post Advertising at Tumblr.",KDD,"Mihajlo Grbovic,Vladan Radosavljevic,Nemanja Djuric,Narayan Bhamidipati,Ananth Nagarajan"
2020,"Data-Driven Never-Ending Learning Question Answering Systems.",KDD,"Estevam R. Hruschka Jr."
1998,"Reinforcement Learning for Trading Systems and Portfolios.",KDD,"John E. Moody,Matthew Saffell"
2013,"Quadratic optimization to identify highly heritable quantitative traits from complex phenotypic features.",KDD,"Jiangwen Sun,Jinbo Bi,Henry R. Kranzler"
2019,"A User-Centered Concept Mining System for Query and Document Understanding at Tencent.",KDD,"Bang Liu,Weidong Guo,Di Niu,Chaoyue Wang,Shunnan Xu,Jinghong Lin,Kunfeng Lai,Yu Xu"
2008,"Asymmetric support vector machines: low false-positive learning under the user tolerance.",KDD,"Shan-Hung Wu,Keng-Pei Lin,Chung-Min Chen,Ming-Syan Chen"
2015,"Inferring Networks of Substitutable and Complementary Products.",KDD,"Julian J. McAuley,Rahul Pandey,Jure Leskovec"
2006,"A new multi-view regression approach with an application to customer wallet estimation.",KDD,"Srujana Merugu,Saharon Rosset,Claudia Perlich"
2014,"Information environment security.",KDD,"Rand Waltzman"
2015,"Simultaneous Modeling of Multiple Diseases for Mortality Prediction in Acute Hospital Care.",KDD,"Nozomi Nori,Hisashi Kashima,Kazuto Yamashita,Hiroshi Ikai,Yuichi Imanaka"
2019,"KGAT: Knowledge Graph Attention Network for Recommendation.",KDD,"Xiang Wang 0010,Xiangnan He 0001,Yixin Cao 0002,Meng Liu 0006,Tat-Seng Chua"
2015,"Maximum Likelihood Postprocessing for Differential Privacy under Consistency Constraints.",KDD,"Jaewoo Lee,Yue Wang,Daniel Kifer"
2012,"LIEGE: : link entities in web lists with knowledge base.",KDD,"Wei Shen 0004,Jianyong Wang 0001,Ping Luo 0001,Min Wang 0001"
2002,"Mining frequent item sets by opportunistic projection.",KDD,"Junqiang Liu,Yunhe Pan,Ke Wang,Jiawei Han 0001"
2005,"A fast kernel-based multilevel algorithm for graph clustering.",KDD,"Inderjit S. Dhillon,Yuqiang Guan,Brian Kulis"
2019,"Developing Measures of Cognitive Impairment in the Real World from Consumer-Grade Multimodal Sensor Streams.",KDD,"Richard Chen,Filip Jankovic,Nikki Marinsek,Luca Foschini,Lampros Kourtis,Alessio Signorini,Melissa Pugh,Jie Shen,Roy Yaari,Vera Maljkovic,Marc Sunga,Han Hee Song,Hyun Joon Jung,Belle Tseng,Andrew Trister"
2014,"A case study: privacy preserving release of spatio-temporal density in paris.",KDD,"Gergely Ács,Claude Castelluccia"
2020,"LRSpeech: Extremely Low-Resource Speech Synthesis and Recognition.",KDD,"Jin Xu,Xu Tan 0003,Yi Ren 0006,Tao Qin,Jian Li 0015,Sheng Zhao,Tie-Yan Liu"
2003,"Probabilistic discovery of time series motifs.",KDD,"Bill Yuan-chi Chiu,Eamonn J. Keogh,Stefano Lonardi"
2015,"A Learning-based Framework to Handle Multi-round Multi-party Influence Maximization on Social Networks.",KDD,"Su-Chen Lin,Shou-De Lin,Ming-Syan Chen"
2015,"Anatomical Annotations for Drosophila Gene Expression Patterns via Multi-Dimensional Visual Descriptors Integration: Multi-Dimensional Feature Learning.",KDD,"Hongchang Gao,Lin Yan,Weidong Cai 0001,Heng Huang"
1996,"Automated Discovery of Medical Expert System Rules from Clinical Databases Based on Rough Sets.",KDD,"Shusaku Tsumoto,Hiroshi Tanaka"
1998,"Toward Scalable Learning with Non-Uniform Class and Cost Distributions: A Case Study in Credit Card Fraud Detection.",KDD,"Philip K. Chan,Salvatore J. Stolfo"
2011,"Matching unstructured product offers to structured product specifications.",KDD,"Anitha Kannan,Inmar E. Givoni,Rakesh Agrawal 0001,Ariel Fuxman"
2009,"A viewpoint-based approach for interaction graph analysis.",KDD,"Sitaram Asur,Srinivasan Parthasarathy 0001"
2007,"Efficient mining of iterative patterns for software specification discovery.",KDD,"David Lo 0001,Siau-Cheng Khoo,Chao Liu 0001"
2020,"Identifying Sepsis Subphenotypes via Time-Aware Multi-Modal Auto-Encoder.",KDD,"Changchang Yin,Ruoqi Liu,Dongdong Zhang,Ping Zhang 0016"
2020,"Attribute-based Propensity for Unbiased Learning in Recommender Systems: Algorithm and Case Studies.",KDD,"Zhen Qin 0002,Suming J. Chen,Donald Metzler,Yongwoo Noh,Jingzheng Qin,Xuanhui Wang"
2019,"Hidden POI Ranking with Spatial Crowdsourcing.",KDD,"Yue Cui,Liwei Deng,Yan Zhao 0008,Bin Yao 0002,Vincent W. Zheng,Kai Zheng 0001"
2017,"Aspect Based Recommendations: Recommending Items with the Most Valuable Aspects Based on User Reviews.",KDD,"Konstantin Bauman,Bing Liu 0001,Alexander Tuzhilin"
2014,"Class-distribution regularized consensus maximization for alleviating overfitting in model combination.",KDD,"Sihong Xie,Jing Gao 0004,Wei Fan 0001,Deepak S. Turaga,Philip S. Yu"
2019,"Probabilistic Latent Variable Modeling for Assessing Behavioral Influences on Well-Being.",KDD,"Ehimwenma Nosakhare,Rosalind W. Picard"
2019,"Robust Anomaly Detection for Multivariate Time Series through Stochastic Recurrent Neural Network.",KDD,"Ya Su,Youjian Zhao,Chenhao Niu,Rong Liu,Wei Sun,Dan Pei"
2016,"Structured Doubly Stochastic Matrix for Graph Based Clustering: Structured Doubly Stochastic Matrix.",KDD,"Xiaoqian Wang,Feiping Nie 0001,Heng Huang"
1996,"Undiscovered Public Knowledge: A Ten-Year Update.",KDD,"Don R. Swanson,Neil R. Smalheiser"
2003,"Inverted matrix: efficient discovery of frequent items in large datasets in the context of interactive mining.",KDD,"Mohammad El-Hajj,Osmar R. Zaïane"
2019,"TV Advertisement Scheduling by Learning Expert Intentions.",KDD,"Yasuhisa Suzuki,Wemer M. Wee,Itaru Nishioka"
2018,"SpotLight: Detecting Anomalies in Streaming Graphs.",KDD,"Dhivya Eswaran,Christos Faloutsos,Sudipto Guha,Nina Mishra"
2000,"A general probabilistic framework for clustering individuals and objects.",KDD,"Igor V. Cadez,Scott Gaffney,Padhraic Smyth"
2020,"Climate Downscaling Using YNet: A Deep Convolutional Network with Skip Connections and Fusion.",KDD,"Yumin Liu,Auroop R. Ganguly,Jennifer G. Dy"
2006,"Discovering significant OPSM subspace clusters in massive gene expression data.",KDD,"Byron J. Gao,Obi L. Griffith,Martin Ester,Steven J. M. Jones"
2018,"I Know You'll Be Back: Interpretable New User Clustering and Churn Prediction on a Mobile Social Application.",KDD,"Carl Yang,Xiaolin Shi,Luo Jie,Jiawei Han 0001"
2018,"Real-time Personalization using Embeddings for Search Ranking at Airbnb.",KDD,"Mihajlo Grbovic,Haibin Cheng"
2009,"Catching the drift: learning broad matches from clickthrough data.",KDD,"Sonal Gupta,Mikhail Bilenko,Matthew Richardson"
2005,"A new scheme on privacy-preserving data classification.",KDD,"Nan Zhang 0004,Shengquan Wang,Wei Zhao 0001"
2020,"Map Generation from Large Scale Incomplete and Inaccurate Data Labels.",KDD,"Rui Zhang,Conrad M. Albrecht,Wei Zhang 0022,Xiaodong Cui,Ulrich Finkler,David S. Kung 0001,Siyuan Lu"
2015,"BatchRank: A Novel Batch Mode Active Learning Framework for Hierarchical Classification.",KDD,"Shayok Chakraborty,Vineeth Nallure Balasubramanian,Adepu Ravi Sankar,Sethuraman Panchanathan,Jieping Ye"
2017,"PNP: Fast Path Ensemble Method for Movie Design.",KDD,"Danai Koutra,Abhilash Dighe,Smriti Bhagat,Udi Weinsberg,Stratis Ioannidis,Christos Faloutsos,Jean Bolot"
2014,"Active-transductive learning with label-adapted kernels.",KDD,"Dan Kushnir"
2005,"A Bayesian network classifier with inverse tree structure for voxelwise magnetic resonance image analysis.",KDD,"Rong Chen 0005,Edward Herskovits"
1996,"Sharing Learned Models among Remote Database Partitions by Local Meta-Learning.",KDD,"Philip K. Chan,Salvatore J. Stolfo"
2012,"Subspace correlation clustering: finding locally correlated dimensions in subspace projections of the data.",KDD,"Stephan Günnemann,Ines Färber,Kittipat Virochsiri,Thomas Seidl 0001"
1997,"Increasing the Efficiency of Data Mining Algorithms with Breadth-First Marker Propagation.",KDD,"John M. Aronis,Foster J. Provost"
2007,"Weighting versus pruning in rule validation for detecting network and host anomalies.",KDD,"Gaurav Tandon,Philip K. Chan"
2017,"It Takes More than Math and Engineering to Hit the Bullseye with Data.",KDD,"Paritosh Desai"
2018,"Identify Susceptible Locations in Medical Records via Adversarial Attacks on Deep Predictive Models.",KDD,"Mengying Sun,Fengyi Tang,Jinfeng Yi,Fei Wang,Jiayu Zhou"
2000,"FreeSpan: frequent pattern-projected sequential pattern mining.",KDD,"Jiawei Han 0001,Jian Pei,Behzad Mortazavi-Asl,Qiming Chen,Umeshwar Dayal,Meichun Hsu"
2018,"Discovering Latent Patterns of Urban Cultural Interactions in WeChat for Modern City Planning.",KDD,"Xiao Zhou,Anastasios Noulas,Cecilia Mascolo,Zhongxiang Zhao"
2019,"Using Twitter to Predict When Vulnerabilities will be Exploited.",KDD,"Haipeng Chen 0001,Rui Liu,Noseong Park,V. S. Subrahmanian"
2011,"Diversity in ranking via resistive graph centers.",KDD,"Avinava Dubey,Soumen Chakrabarti,Chiranjib Bhattacharyya"
2019,"Do Simpler Models Exist and How Can We Find Them?",KDD,"Cynthia Rudin"
2014,"Data science through the lens of social science.",KDD,"Drew Conway"
2017,"Relay-Linking Models for Prominence and Obsolescence in Evolving Networks.",KDD,"Mayank Singh 0001,Rajdeep Sarkar,Pawan Goyal,Animesh Mukherjee 0001,Soumen Chakrabarti"
1997,"Bayesian Inference for Identifying Solar Active Regions.",KDD,"Michael J. Turmon,Saleem Mukhtar,Judit Pap"
2009,"Anonymizing healthcare data: a case study on the blood transfusion service.",KDD,"Noman Mohammed,Benjamin C. M. Fung,Patrick C. K. Hung,Cheuk-kwong Lee"
2020,"Residual Correlation in Graph Neural Network Regression.",KDD,"Junteng Jia,Austin R. Benson"
2018,"RapidScorer: Fast Tree Ensemble Evaluation by Maximizing Compactness in Data Level Parallelization.",KDD,"Ting Ye,Hucheng Zhou,Will Y. Zou,Bin Gao,Ruofei Zhang"
2008,"A sequential dual method for large scale multi-class linear svms.",KDD,"S. Sathiya Keerthi,S. Sundararajan,Kai-Wei Chang,Cho-Jui Hsieh,Chih-Jen Lin"
2006,"Sampling from large graphs.",KDD,"Jure Leskovec,Christos Faloutsos"
1995,"Discovery and Maintenance of Functional Dependencies by Independencies.",KDD,"Siegfried Bell"
1997,"Fast and Intuitive Clustering of Web Documents.",KDD,"Oren Zamir,Oren Etzioni,Omid Madani,Richard M. Karp"
2006,"Mining for misconfigured machines in grid systems.",KDD,"Noam Palatin,Arie Leizarowitz,Assaf Schuster,Ran Wolff"
2020,"Re-identification Attack to Privacy-Preserving Data Analysis with Noisy Sample-Mean.",KDD,"Du Su,Hieu Tri Huynh,Ziao Chen,Yi Lu 0001,Wenmiao Lu"
2006,"Mining progressive confident rules.",KDD,"Minghua Zhang,Wynne Hsu,Mong-Li Lee"
2011,"Multiple domain user personalization.",KDD,"Yucheng Low,Deepak Agarwal,Alexander J. Smola"
2008,"Banded structure in binary matrices.",KDD,"Gemma C. Garriga,Esa Junttila,Heikki Mannila"
