2020,"Semi-Supervised Multi-Label Learning from Crowds via Deep Sequential Generative Model.",KDD,"Wanli Shi,Victor S. Sheng,Xiang Li,Bin Gu"
2011,"Smoothing techniques for adaptive online language models: topic tracking in tweet streams.",KDD,"Jimmy J. Lin,Rion Snow,William Morgan"
2017,"Revisiting Power-law Distributions in Spectra of Real World Networks.",KDD,"Nicole Eikmeier,David F. Gleich"
2018,"D2K: Scalable Community Detection in Massive Networks via Small-Diameter k-Plexes.",KDD,"Alessio Conte,Tiziano De Matteis,Daniele De Sensi,Roberto Grossi,Andrea Marino,Luca Versari"
2007,"Predictive discrete latent factor models for large scale dyadic data.",KDD,"Deepak Agarwal,Srujana Merugu"
2010,"Scalable similarity search with optimized kernel hashing.",KDD,"Junfeng He,Wei Liu 0005,Shih-Fu Chang"
2018,"Dynamic Pricing under Competition on Online Marketplaces: A Data-Driven Approach.",KDD,"Rainer Schlosser,Martin Boissier 0001"
2018,"Active Opinion Maximization in Social Networks.",KDD,"Xinyue Liu,Xiangnan Kong,Philip S. Yu"
1996,"Extensibility in Data Mining Systems.",KDD,"Stefan Wrobel,Dietrich Wettschereck,Edgar Sommer,Werner Emde"
2014,"Reducing gang violence through network influence based targeting of social programs.",KDD,"Paulo Shakarian,Joseph Salmento,William R. Pulleyblank,John Bertetto"
2013,"One theme in all views: modeling consensus topics in multiple contexts.",KDD,"Jian Tang 0005,Ming Zhang 0004,Qiaozhu Mei"
2018,"The U.S. Census Bureau Adopts Differential Privacy.",KDD,"John M. Abowd"
2013,"WiseMarket: a new paradigm for managing wisdom of online social users.",KDD,"Caleb Chen Cao,Yongxin Tong,Lei Chen 0002,H. V. Jagadish"
2014,"Using strong triadic closure to characterize ties in social networks.",KDD,"Stavros Sintos,Panayiotis Tsaparas"
2019,"Deep Anomaly Detection with Deviation Networks.",KDD,"Guansong Pang,Chunhua Shen,Anton van den Hengel"
1996,"The Field Matching Problem: Algorithms and Applications.",KDD,"Alvaro E. Monge,Charles Elkan"
2000,"Visualization and the process of modeling: a cognitive-theoretic view.",KDD,"Andrew W. Crapo,Laurie B. Waisel,William A. Wallace,Thomas R. Willemain"
2015,"Panther: Fast Top-k Similarity Search on Large Networks.",KDD,"Jing Zhang 0001,Jie Tang 0001,Cong Ma,Hanghang Tong,Yu Jing,Juanzi Li"
2008,"Effective and efficient itemset pattern summarization: regression-based approaches.",KDD,"Ruoming Jin,Muad Abu-Ata,Yang Xiang,Ning Ruan"
2011,"A GPU-tailored approach for training kernelized SVMs.",KDD,"Andrew Cotter,Nathan Srebro,Joseph Keshet"
2005,"Information retrieval based on collaborative filtering with latent interest semantic map.",KDD,"Noriaki Kawamae,Katsumi Takahashi"
1999,"User Profiling in Personalization Applications Through Rule Discovery and Validation.",KDD,"Gediminas Adomavicius,Alexander Tuzhilin"
2014,"Distance metric learning using dropout: a structured regularization approach.",KDD,"Qi Qian,Juhua Hu,Rong Jin,Jian Pei,Shenghuo Zhu"
2003,"Improving spatial locality of programs via data mining.",KDD,"Karlton Sequeira,Mohammed Javeed Zaki,Boleslaw K. Szymanski,Christopher D. Carothers"
2017,"PPDsparse: A Parallel Primal-Dual Sparse Method for Extreme Classification.",KDD,"Ian En-Hsu Yen,Xiangru Huang,Wei Dai 0003,Pradeep Ravikumar,Inderjit S. Dhillon,Eric P. Xing"
2016,"FUSE: Full Spectral Clustering.",KDD,"Wei Ye 0001,Sebastian Goebl,Claudia Plant,Christian Böhm"
2020,"ST-SiameseNet: Spatio-Temporal Siamese Networks for Human Mobility Signature Identification.",KDD,"Huimin Ren,Menghai Pan,Yanhua Li,Xun Zhou,Jun Luo 0007"
2020,"Structural Patterns and Generative Models of Real-world Hypergraphs.",KDD,"Manh Tuan Do,Se-eun Yoon,Bryan Hooi,Kijung Shin"
2019,"Characterizing and Detecting Malicious Accounts in Privacy-Centric Mobile Social Networks: A Case Study.",KDD,"Zenghua Xia,Chang Liu,Neil Zhenqiang Gong,Qi Li 0002,Yong Cui 0001,Dawn Song"
2001,"Applications of generalized support vector machines to predictive modeling.",KDD,"Nitin Agrarwal"
1996,"Interactive Knowledge Discovery from Marketing Questionnaire Using Simulated Breeding and Inductive Learning Methods.",KDD,"Takao Terano,Yoko Ishino"
2012,"The missing models: a data-driven approach for learning how networks grow.",KDD,"Rob Patro,Geet Duggal,Emre Sefer,Hao Wang 0024,Darya Filippova,Carl Kingsford"
2004,"Tracking dynamics of topic trends using a finite mixture model.",KDD,"Satoshi Morinaga,Kenji Yamanishi"
2005,"Predicting the product purchase patterns of corporate customers.",KDD,"Bhavani Raskutti,Alan Herschtal"
2012,"Position-normalized click prediction in search advertising.",KDD,"Ye Chen,Tak W. Yan"
2002,"ADMIT: anomaly-based data mining for intrusions.",KDD,"Karlton Sequeira,Mohammed Javeed Zaki"
2015,"Probabilistic Modeling of a Sales Funnel to Prioritize Leads.",KDD,"Brendan Andrew Duncan,Charles Peter Elkan"
2007,"Estimating rates of rare events at multiple resolutions.",KDD,"Deepak Agarwal,Andrei Z. Broder,Deepayan Chakrabarti,Dejan Diklic,Vanja Josifovski,Mayssam Sayyadian"
2016,"Online Context-Aware Recommendation with Time Varying Multi-Armed Bandit.",KDD,"Chunqiu Zeng,Qing Wang 0016,Shekoofeh Mokhtari,Tao Li 0001"
2016,"Distributing the Stochastic Gradient Sampler for Large-Scale LDA.",KDD,"Yuan Yang,Jianfei Chen 0001,Jun Zhu 0001"
2008,"Information extraction from Wikipedia: moving down the long tail.",KDD,"Fei Wu 0003,Raphael Hoffmann,Daniel S. Weld"
2018,"Career Transitions and Trajectories: A Case Study in Computing.",KDD,"Tara Safavi,Maryam Davoodi,Danai Koutra"
2005,"Enhancing the lift under budget constraints: an application in the mutual fund industry.",KDD,"Lian Yan,Michael Fassino,Patrick Baldasare"
2020,"Debiasing Grid-based Product Search in E-commerce.",KDD,"Ruocheng Guo,Xiaoting Zhao,Adam Henderson,Liangjie Hong,Huan Liu 0001"
2020,"Malicious Attacks against Deep Reinforcement Learning Interpretations.",KDD,"Mengdi Huai,Jianhui Sun,Renqin Cai,Liuyi Yao,Aidong Zhang"
2020,"Polestar: An Intelligent, Efficient and National-Wide Public Transportation Routing Engine.",KDD,"Hao Liu 0026,Ying Li,Yanjie Fu,Huaibo Mei,Jingbo Zhou,Xu Ma,Hui Xiong 0001"
2020,"Multimodal Learning with Incomplete Modalities by Knowledge Distillation.",KDD,"Qi Wang,Liang Zhan,Paul M. Thompson,Jiayu Zhou"
2016,"Graphons and Machine Learning: Modeling and Estimation of Sparse Massive Networks.",KDD,"Jennifer T. Chayes"
2008,"Entity categorization over large document collections.",KDD,"Venkatesh Ganti,Arnd Christian König,Rares Vernica"
2005,"On the use of linear programming for unsupervised text classification.",KDD,"Mark Sandler 0002"
2015,"Regularity and Conformity: Location Prediction Using Heterogeneous Mobility Data.",KDD,"Yingzi Wang,Nicholas Jing Yuan,Defu Lian,Linli Xu,Xing Xie 0001,Enhong Chen,Yong Rui"
2011,"Fast locality-sensitive hashing.",KDD,"Anirban Dasgupta 0001,Ravi Kumar 0001,Tamás Sarlós"
2019,"E.T.-RNN: Applying Deep Learning to Credit Loan Applications.",KDD,"Dmitrii Babaev,Maxim Savchenko,Alexander Tuzhilin,Dmitrii Umerenkov"
2013,"Discovering latent influence in online social activities via shared cascade poisson processes.",KDD,"Tomoharu Iwata,Amar Shah,Zoubin Ghahramani"
2014,"Automated hypothesis generation based on mining scientific literature.",KDD,"W. Scott Spangler,Angela D. Wilkins,Benjamin J. Bachman,Meena Nagarajan,Tajhal Dayaram,Peter J. Haas,Sam Regenbogen,Curtis R. Pickering,Austin Comer,Jeffrey N. Myers,Ioana Stanoi,Linda Kato,Ana Lelescu,Jacques J. Labrie,Neha Parikh,Andreas Martin Lisewski,Lawrence A. Donehower,Ying Chen 0001,Olivier Lichtarge"
2019,"Is a Single Vector Enough?: Exploring Node Polysemy for Network Embedding.",KDD,"Ninghao Liu,Qiaoyu Tan,Yuening Li,Hongxia Yang,Jingren Zhou,Xia Hu"
1995,"Discovery of Concurrent Data Models from Experimental Tables: A Rough Set Approach.",KDD,"Andrzej Skowron,Zbigniew Suraj"
2011,"Estimating the number of users behind ip addresses for combating abusive traffic.",KDD,"Ahmed Metwally 0001,Matt Paduano"
2016,"Causal Clustering for 1-Factor Measurement Models.",KDD,"Erich Kummerfeld,Joseph D. Ramsey"
1997,"Mining Association Rules with Item Constraints.",KDD,"Ramakrishnan Srikant,Quoc Vu,Rakesh Agrawal 0001"
1996,"Data Mining and Tree-Based Optimization.",KDD,"Robert L. Grossman,Haim Bodek,Dave Northcutt,H. Vincent Poor"
2014,"Frontiers in E-commerce personalization.",KDD,"Sri Subramaniam"
2005,"Formulating distance functions via the kernel trick.",KDD,"Gang Wu 0005,Edward Y. Chang,Navneet Panda"
2018,"TaxoGen: Unsupervised Topic Taxonomy Construction by Adaptive Term Embedding and Clustering.",KDD,"Chao Zhang 0014,Fangbo Tao,Xiusi Chen,Jiaming Shen,Meng Jiang 0001,Brian M. Sadler,Michelle Vanni,Jiawei Han 0001"
1999,"The PanQ Tool and EMF SQL for Complex Data Management.",KDD,"Damianos Chatziantoniou"
2019,"Analytics Journey Map: An Approach Enable to ML at Scale.",KDD,"Ganesh Thondikulam"
2020,"Fraud Transactions Detection via Behavior Tree with Local Intention Calibration.",KDD,"Can Liu,Qiwei Zhong,Xiang Ao,Li Sun,Wangli Lin,Jinghua Feng,Qing He 0003,Jiayu Tang"
2006,"Group formation in large social networks: membership, growth, and evolution.",KDD,"Lars Backstrom,Daniel P. Huttenlocher,Jon M. Kleinberg,Xiangyang Lan"
2018,"A Distributed Quasi-Newton Algorithm for Empirical Risk Minimization with Nonsmooth Regularization.",KDD,"Ching-pei Lee,Cong Han Lim,Stephen J. Wright"
2011,"Ranking-based classification of heterogeneous information networks.",KDD,"Ming Ji,Jiawei Han 0001,Marina Danilevsky"
2013,"Information cartography: creating zoomable, large-scale maps of information.",KDD,"Dafna Shahaf,Jaewon Yang,Caroline Suen,Jeff Jacobs,Heidi Wang,Jure Leskovec"
2019,"Learning Network-to-Network Model for Content-rich Network Embedding.",KDD,"Zhicheng He,Jie Liu 0007,Na Li,Yalou Huang"
2012,"AssocExplorer: an association rule visualization system for exploratory data analysis.",KDD,"Guimei Liu,Andre Suchitra,Haojun Zhang,Mengling Feng,See-Kiong Ng,Limsoon Wong"
2011,"Activity analysis based on low sample rate smart meters.",KDD,"Feng Chen 0001,Jing Dai,Bingsheng Wang,Sambit Sahu,Milind R. Naphade,Chang-Tien Lu"
2006,"Opportunity map: identifying causes of failure - a deployed data mining system.",KDD,"Kaidi Zhao,Bing Liu 0001,Jeffrey Benkler,Weimin Xiao"
2012,"Understanding users' satisfaction for search engine evaluation.",KDD,"Gordon Sun"
2014,"Balanced graph edge partition.",KDD,"Florian Bourse,Marc Lelarge,Milan Vojnovic"
2002,"Tumor cell identification using features rules.",KDD,"Bin Fang,Wynne Hsu,Mong-Li Lee"
2012,"Anonymizing set-valued data by nonreciprocal recoding.",KDD,"Mingqiang Xue,Panagiotis Karras,Chedy Raïssi,Jaideep Vaidya,Kian-Lee Tan"
1997,"KESO: Minimizing Database Interaction.",KDD,"Arno Siebes,Martin L. Kersten"
2016,"Parallel Lasso Screening for Big Data Optimization.",KDD,"Qingyang Li,Shuang Qiu,Shuiwang Ji,Paul M. Thompson,Jieping Ye,Jie Wang 0005"
2010,"The topic-perspective model for social tagging systems.",KDD,"Caimei Lu,Xiaohua Hu 0001,Xin Chen,Jung-ran Park,Tingting He,Zhoujun Li"
2014,"Mining topics in documents: standing on the shoulders of big data.",KDD,"Zhiyuan Chen 0001,Bing Liu 0001"
2000,"Web mining for e-commerce (workshop session - title only).",KDD,"Ron Kohavi,Myra Spiliopoulou,Jaideep Srivastava"
2019,"Adaptive-Halting Policy Network for Early Classification.",KDD,"Thomas Hartvigsen,Cansu Sen,Xiangnan Kong,Elke A. Rundensteiner"
1995,"Learning Bayesian Networks with Discrete Variables from Data.",KDD,"Peter Spirtes,Christopher Meek"
2015,"Graph Query Reformulation with Diversity.",KDD,"Davide Mottin,Francesco Bonchi,Francesco Gullo"
2015,"Network Lasso: Clustering and Optimization in Large Graphs.",KDD,"David Hallac,Jure Leskovec,Stephen P. Boyd"
2019,"Real-time Event Detection on Social Data Streams.",KDD,"Mateusz Fedoryszak,Brent Frederick,Vijay Rajaram,Changtao Zhong"
2000,"On-line unsupervised outlier detection using finite mixtures with discounting learning algorithms.",KDD,"Kenji Yamanishi,Jun'ichi Takeuchi,Graham J. Williams,Peter Milne"
2019,"Tutorial: Are You My Neighbor?: Bringing Order to Neighbor Computing Problems.",KDD,"David C. Anastasiu,Huzefa Rangwala,Andrea Tagarelli"
1999,"Evaluating a Class of Distance-Mapping Algorithms for Data Mining and Clustering.",KDD,"Jason Tsong-Li Wang,Xiong Wang,King-Ip Lin,Dennis E. Shasha,Bruce A. Shapiro,Kaizhong Zhang"
1996,"Combining Data Mining and Machine Learning for Effective User Profiling.",KDD,"Tom Fawcett,Foster J. Provost"
2013,"Financing lead triggers: empowering sales reps through knowledge discovery and fusion.",KDD,"Kareem S. Aggour,Bethany Hoogs"
2016,"Dynamic and Robust Wildfire Risk Prediction System: An Unsupervised Approach.",KDD,"Mahsa Salehi,Laura Irina Rusu,Timothy M. Lynar,Anna Phan"
2010,"Ensemble pruning via individual contribution ordering.",KDD,"Zhenyu Lu,Xindong Wu 0001,Xingquan Zhu,Josh Bongard"
2002,"ANF: a fast and scalable tool for data mining in massive graphs.",KDD,"Christopher R. Palmer,Phillip B. Gibbons,Christos Faloutsos"
2001,"A streaming ensemble algorithm (SEA) for large-scale classification.",KDD,"W. Nick Street,YongSeog Kim"
2019,"Dynamic Pricing for Airline Ancillaries with Customer Context.",KDD,"Naman Shukla,Arinbjörn Kolbeinsson,Ken Otwell,Lavanya Marla,Kartik Yellepeddi"
2020,"MoFlow: An Invertible Flow Model for Generating Molecular Graphs.",KDD,"Chengxi Zang,Fei Wang"
2006,"Introducing perpetual analytics.",KDD,"Jeff Jonas"
2020,"LogPar: Logistic PARAFAC2 Factorization for Temporal Binary Data with Missing Values.",KDD,"Kejing Yin,Ardavan Afshar,Joyce C. Ho,William K. Cheung,Chao Zhang 0014,Jimeng Sun"
2005,"Generation of synthetic data sets for evaluating the accuracy of knowledge discovery systems.",KDD,"Daniel R. Jeske,Behrokh Samadi,Pengyue J. Lin,Lan Ye,Sean Cox,Rui Xiao,Ted Younglove,Minh Ly,Douglas Holt,Ryan Rich"
2009,"Characterizing individual communication patterns.",KDD,"R. Dean Malmgren,Jake M. Hofman,Luís A. Nunes Amaral,Duncan J. Watts"
2016,"Deep Visual-Semantic Hashing for Cross-Modal Retrieval.",KDD,"Yue Cao 0001,Mingsheng Long,Jianmin Wang 0001,Qiang Yang 0001,Philip S. Yu"
2009,"Toward autonomic grids: analyzing the job flow with affinity streaming.",KDD,"Xiangliang Zhang 0001,Cyril Furtlehner,Julien Perez,Cécile Germain-Renaud,Michèle Sebag"
2011,"Leakage in data mining: formulation, detection, and avoidance.",KDD,"Shachar Kaufman,Saharon Rosset,Claudia Perlich"
2013,"SEA: a system for event analysis on chinese tweets.",KDD,"Yaqiong Wang,Hongfu Liu,Hao Lin 0002,Junjie Wu 0002,Zhiang Wu 0001,Jie Cao 0001"
2019,"Real-time On-Device Troubleshooting Recommendation for Smartphones.",KDD,"Keiichi Ochiai,Kohei Senkawa,Naoki Yamamoto,Yuya Tanaka,Yusuke Fukazawa"
2019,"Hypothesis Generation From Text Based On Co-Evolution Of Biomedical Concepts.",KDD,"Kishlay Jha,Guangxu Xun,Yaqing Wang,Aidong Zhang"
2015,"Entity Matching across Heterogeneous Sources.",KDD,"Yang Yang 0009,Yizhou Sun,Jie Tang 0001,Bo Ma,Juan-Zi Li"
2017,"Real-Time Optimization of Web Publisher RTB Revenues.",KDD,"Pedro Chahuara,Nicolas Grislain,Grégoire Jauvion,Jean-Michel Renders"
2019,"FoodAI: Food Image Recognition via Deep Learning for Smart Food Logging.",KDD,"Doyen Sahoo,Wang Hao,Shu Ke,Xiongwei Wu,Hung Le,Palakorn Achananuparp,Ee-Peng Lim,Steven C. H. Hoi"
2015,"Locally Densest Subgraph Discovery.",KDD,"Lu Qin,Rong-Hua Li,Lijun Chang,Chengqi Zhang"
2011,"Fast approximate similarity search based on degree-reduced neighborhood graphs.",KDD,"Kazuo Aoyama,Kazumi Saito,Hiroshi Sawada,Naonori Ueda"
2016,"QUINT: On Query-Specific Optimal Networks.",KDD,"Liangyue Li,Yuan Yao 0001,Jie Tang 0001,Wei Fan 0001,Hanghang Tong"
2012,"Transparent user models for personalization.",KDD,"Khalid El-Arini,Ulrich Paquet,Ralf Herbrich,Jurgen Van Gael,Blaise Agüera y Arcas"
2006,"Acclimatizing taxonomic semantics for hierarchical content classification from semantics to data-driven taxonomy.",KDD,"Lei Tang 0001,Jianping Zhang,Huan Liu 0001"
2007,"Practical learning from one-sided feedback.",KDD,"D. Sculley"
2016,"Recruitment Market Trend Analysis with Sequential Latent Variable Models.",KDD,"Chen Zhu,Hengshu Zhu,Hui Xiong 0001,Pengliang Ding,Fang Xie"
2014,"Grouping students in educational settings.",KDD,"Rakesh Agrawal 0001,Behzad Golshan,Evimaria Terzi"
2013,"Predictive model performance: offline and online evaluations.",KDD,"Jeonghee Yi,Ye Chen,Jie Li,Swaraj Sett,Tak W. Yan"
2010,"Privacy-preserving outsourcing support vector machines with random transformation.",KDD,"Keng-Pei Lin,Ming-Syan Chen"
2003,"Understanding captions in biomedical publications.",KDD,"William W. Cohen,Richard C. Wang,Robert F. Murphy"
2020,"In Search for a Cure: Recommendation With Knowledge Graph on CORD-19.",KDD,"Iris Shen,Le Zhang,Jianxun Lian,Chieh-Han Wu,Miguel González-Fierro,Andreas Argyriou,Tao Wu"
2020,"AutoShuffleNet: Learning Permutation Matrices via an Exact Lipschitz Continuous Penalty in Deep Convolutional Neural Networks.",KDD,"Jiancheng Lyu,Shuai Zhang 0009,Yingyong Qi,Jack Xin"
2014,"Community detection in graphs through correlation.",KDD,"Lian Duan,William Nick Street,Yanchi Liu,Haibing Lu"
2009,"CP-summary: a concise representation for browsing frequent itemsets.",KDD,"Ardian Kristanto Poernomo,Vivekanand Gopalkrishnan"
2018,"Building Near Realtime Contextual Recommendations for Active Communities on LinkedIn.",KDD,"Hema Raghavan"
2015,"Large Scale Distributed Data Science using Apache Spark.",KDD,"James G. Shanahan,Liang Dai"
2012,"Overlapping decomposition for causal graphical modeling.",KDD,"Lei Han,Guojie Song,Gao Cong,Kunqing Xie"
2006,"Outlier detection by active learning.",KDD,"Naoki Abe,Bianca Zadrozny,John Langford 0001"
2019,"Seven Years of Data Science at Airbnb.",KDD,"Elena Grewal"
2018,"Accurate and Fast Asymmetric Locality-Sensitive Hashing Scheme for Maximum Inner Product Search.",KDD,"Qiang Huang,Guihong Ma,Jianlin Feng,Qiong Fang,Anthony K. H. Tung"
2014,"DeepWalk: online learning of social representations.",KDD,"Bryan Perozzi,Rami Al-Rfou,Steven Skiena"
2004,"GPCA: an efficient dimension reduction scheme for image compression and retrieval.",KDD,"Jieping Ye,Ravi Janardan,Qi Li 0001"
2002,"Selecting the right interestingness measure for association patterns.",KDD,"Pang-Ning Tan,Vipin Kumar,Jaideep Srivastava"
2011,"MultiRank: co-ranking for objects and relations in multi-relational data.",KDD,"Michael Kwok-Po Ng,Xutao Li,Yunming Ye"
2020,"Causal Inference Meets Machine Learning.",KDD,"Peng Cui 0001,Zheyan Shen,Sheng Li 0001,Liuyi Yao,Yaliang Li,Zhixuan Chu,Jing Gao"
2014,"Open-domain quantity queries on web tables: annotation, response, and consensus models.",KDD,"Sunita Sarawagi,Soumen Chakrabarti"
2020,"Support for Diverse Students.",KDD,"Daniel A. Jiménez"
2019,"Constructing and Mining Heterogeneous Information Networks from Massive Text.",KDD,"Jingbo Shang,Jiaming Shen,Liyuan Liu,Jiawei Han 0001"
2012,"Vertex neighborhoods, low conductance cuts, and good seeds for local community methods.",KDD,"David F. Gleich,C. Seshadhri"
2009,"Time series shapelets: a new primitive for data mining.",KDD,"Lexiang Ye,Eamonn J. Keogh"
2019,"Graph Transformation Policy Network for Chemical Reaction Prediction.",KDD,"Kien Do,Truyen Tran 0001,Svetha Venkatesh"
2020,"Multi-objective Optimization for Guaranteed Delivery in Video Service Platform.",KDD,"Hang Lei,Yin Zhao,Longjun Cai"
2003,"Fast vertical mining using diffsets.",KDD,"Mohammed Javeed Zaki,Karam Gouda"
2009,"On burstiness-aware search for document sequences.",KDD,"Theodoros Lappas,Benjamin Arai,Manolis Platakis,Dimitrios Kotsakos,Dimitrios Gunopulos"
2014,"Modeling professional similarity by mining professional career trajectories.",KDD,"Ye Xu,Zang Li,Abhishek Gupta,Ahmet Bugdayci,Anmol Bhasin"
2010,"PET: a statistical model for popular events tracking in social communities.",KDD,"Cindy Xide Lin,Bo Zhao 0001,Qiaozhu Mei,Jiawei Han 0001"
2015,"Modeling Truth Existence in Truth Discovery.",KDD,"Shi Zhi,Bo Zhao 0001,Wenzhu Tong,Jing Gao 0004,Dian Yu,Heng Ji,Jiawei Han 0001"
2018,"Recommendations with Negative Feedback via Pairwise Deep Reinforcement Learning.",KDD,"Xiangyu Zhao,Liang Zhang,Zhuoye Ding,Long Xia,Jiliang Tang,Dawei Yin"
2005,"Query chains: learning to rank from implicit feedback.",KDD,"Filip Radlinski,Thorsten Joachims"
2002,"Bursty and hierarchical structure in streams.",KDD,"Jon M. Kleinberg"
2020,"Truth Discovery against Strategic Sybil Attack in Crowdsourcing.",KDD,"Yue Wang,Ke Wang,Chunyan Miao"
1997,"Fast Robust Visual Data Mining.",KDD,"Ted Mihalisin,John Timlin"
2012,"Mining contentions from discussions and debates.",KDD,"Arjun Mukherjee,Bing Liu 0001"
2014,"Applying data mining techniques to address critical process optimization needs in advanced manufacturing.",KDD,"Li Zheng 0001,Chunqiu Zeng,Lei Li 0001,Yexi Jiang,Wei Xue,Jingxuan Li,Chao Shen 0005,Wubai Zhou,Hongtai Li,Liang Tang,Tao Li 0001,Bing Duan,Ming Lei,Pengnian Wang"
2002,"Visualization support for a user-centered KDD process.",KDD,"Tu Bao Ho,Trong Dung Nguyen,DucDung Nguyen"
2013,"Evaluating the crowd with confidence.",KDD,"Manas Joglekar,Hector Garcia-Molina,Aditya G. Parameswaran"
2014,"Big data for social good.",KDD,"Nathan Eagle"
2015,"On the Formation of Circles in Co-authorship Networks.",KDD,"Tanmoy Chakraborty 0002,Sikhar Patranabis,Pawan Goyal,Animesh Mukherjee 0001"
2010,"Community-based greedy algorithm for mining top-K influential nodes in mobile social networks.",KDD,"Yu Wang,Gao Cong,Guojie Song,Kunqing Xie"
2016,"Accelerating Online CP Decompositions for Higher Order Tensors.",KDD,"Shuo Zhou 0001,Xuan Vinh Nguyen,James Bailey 0001,Yunzhe Jia,Ian Davidson"
2012,"PageRank on an evolving graph.",KDD,"Bahman Bahmani,Ravi Kumar 0001,Mohammad Mahdian,Eli Upfal"
2006,"Mining quantitative correlated patterns using an information-theoretic approach.",KDD,"Yiping Ke,James Cheng,Wilfred Ng"
2020,"Disentangled Self-Supervision in Sequential Recommenders.",KDD,"Jianxin Ma,Chang Zhou,Hongxia Yang,Peng Cui 0001,Xin Wang 0019,Wenwu Zhu 0001"
1996,"Quakefinder: A Scalable Data Mining System for Detecting Earthquakes from Space.",KDD,"Paul E. Stolorz,Christopher Dean"
2016,"Collaborative Multi-View Denoising.",KDD,"Lei Zhang 0116,Shupeng Wang,Xiaoyu Zhang 0002,Yong Wang,Binbin Li,Dinggang Shen,Shuiwang Ji"
2016,"Batch Model for Batched Timestamps Data Analysis with Application to the SSA Disability Program.",KDD,"Qingqi Yue,Ao Yuan,Xuan Che,Minh Huynh,Chunxiao Zhou"
2020,"Exploring Automatic Diagnosis of COVID-19 from Crowdsourced Respiratory Sound Data.",KDD,"Chloë Brown,Jagmohan Chauhan,Andreas Grammenos,Jing Han,Apinan Hasthanasombat,Dimitris Spathis,Tong Xia,Pietro Cicuta,Cecilia Mascolo"
2015,"Reconstructing Textual Documents from n-grams.",KDD,"Matthias Gallé,Matías Tealdi"
2020,"The NodeHopper: Enabling Low Latency Ranking with Constraints via a Fast Dual Solver.",KDD,"Anton Zhernov,Krishnamurthy (Dj) Dvijotham,Ivan Lobov,Dan A. Calian,Michelle Gong,Natarajan Chandrashekar,Timothy A. Mann"
2016,"Keeping it Short and Simple: Summarising Complex Event Sequences with Multivariate Patterns.",KDD,"Roel Bertens,Jilles Vreeken,Arno Siebes"
2017,"Clustering Individual Transactional Data for Masses of Users.",KDD,"Riccardo Guidotti,Anna Monreale,Mirco Nanni,Fosca Giannotti,Dino Pedreschi"
2005,"Web object indexing using domain knowledge.",KDD,"Muyuan Wang,Zhiwei Li 0006,Lie Lu,Wei-Ying Ma,Naiyao Zhang"
2020,"Spectrum-Guided Adversarial Disparity Learning.",KDD,"Zhe Liu,Lina Yao,Lei Bai 0001,Xianzhi Wang 0001,Can Wang 0004"
2014,"The setwise stream classification problem.",KDD,"Charu C. Aggarwal"
1998,"Data Reduction Based on Hyper Relations.",KDD,"Hui Wang 0001,Ivo Düntsch,David A. Bell"
2019,"AutoNE: Hyperparameter Optimization for Massive Network Embedding.",KDD,"Ke Tu,Jianxin Ma,Peng Cui 0001,Jian Pei,Wenwu Zhu 0001"
2016,"Predict Risk of Relapse for Patients with Multiple Stages of Treatment of Depression.",KDD,"Zhi Nie,Pinghua Gong,Jieping Ye"
2000,"Text mining (workshop session - title only).",KDD,"Marko Grobelnik,Dunja Mladenic,Natasa Milic-Frayling"
2008,"Text classification, business intelligence, and interactivity: automating C-Sat analysis for services industry.",KDD,"Shantanu Godbole,Shourya Roy"
2008,"Local peculiarity factor and its application in outlier detection.",KDD,"Jian Yang 0016,Ning Zhong 0001,Yiyu Yao,Jue Wang"
2002,"Privacy preserving mining of association rules.",KDD,"Alexandre V. Evfimievski,Ramakrishnan Srikant,Rakesh Agrawal 0001,Johannes Gehrke"
1996,"A Linear Method for Deviation Detection in Large Databases.",KDD,"Andreas Arning,Rakesh Agrawal 0001,Prabhakar Raghavan"
2015,"Exploiting Data Mining for Authenticity Assessment and Protection of High-Quality Italian Wines from Piedmont.",KDD,"Marco Arlorio,Jean Daniel Coïsson,Giorgio Leonardi,Monica Locatelli,Luigi Portinale"
2013,"Big data analytics for healthcare.",KDD,"Jimeng Sun,Chandan K. Reddy"
2020,"How AI Can Help Build Resiliency for Small Businesses in a Global Economic Crisis.",KDD,"Nhung Ho"
2019,"A Deep Value-network Based Approach for Multi-Driver Order Dispatching.",KDD,"Xiaocheng Tang,Zhiwei (Tony) Qin,Fan Zhang,Zhaodong Wang,Zhe Xu,Yintai Ma,Hongtu Zhu,Jieping Ye"
2016,"Towards Robust and Versatile Causal Discovery for Business Applications.",KDD,"Giorgos Borboudakis,Ioannis Tsamardinos"
2009,"Efficient anomaly monitoring over moving object trajectory streams.",KDD,"Yingyi Bu,Lei Chen 0002,Ada Wai-Chee Fu,Dawei Liu"
2020,"Advances in Recommender Systems: From Multi-stakeholder Marketplaces to Automated RecSys.",KDD,"Rishabh Mehrotra,Ben Carterette,Yong Li 0008,Quanming Yao,Chen Gao,James T. Kwok,Qiang Yang,Isabelle Guyon"
2014,"Statistically sound pattern discovery.",KDD,"Wilhelmiina Hämäläinen,Geoffrey I. Webb"
2019,"Isolation Set-Kernel and Its Application to Multi-Instance Learning.",KDD,"Bi-Cun Xu,Kai Ming Ting,Zhi-Hua Zhou"
2015,"Online Controlled Experiments: Lessons from Running A/B/n Tests for 12 Years.",KDD,"Ron Kohavi"
