2009,"Self-Presentation of Personality During Online Profile Creation.",ICWSM,"Scott Counts,Kristin Brooke Stecher"
2020,"Towards Measuring Adversarial Twitter Interactions against Candidates in the US Midterm Elections.",ICWSM,"Yiqing Hua,Thomas Ristenpart,Mor Naaman"
2020,"Style Matters! Investigating Linguistic Style in Online Communities.",ICWSM,"Osama Khalid,Padmini Srinivasan"
2012,"Automatic Versus Human Navigation in Information Networks.",ICWSM,"Robert West 0001,Jure Leskovec"
2013,"The Value of Completing Crowdfunding Projects.",ICWSM,"Rick Wash"
2010,"An Overview of SMOB 2: Open, Semantic and Distributed Microblogging.",ICWSM,"Alexandre Passant,Uldis Bojars,John G. Breslin,Tuukka Hastrup,Milan Stankovic,Philippe Laublet"
2013,"Families on Facebook.",ICWSM,"Moira Burke,Lada A. Adamic,Karyn Marciniak"
2018,"Understanding Self-Narration of Personally Experienced Racism on Reddit.",ICWSM,"Diyi Yang,Scott Counts"
2014,"How to Ask for a Favor: A Case Study on the Success of Altruistic Requests.",ICWSM,"Tim Althoff,Cristian Danescu-Niculescu-Mizil,Dan Jurafsky"
2016,"Message Impartiality in Social Media Discussions.",ICWSM,"Muhammad Bilal Zafar,Krishna P. Gummadi,Cristian Danescu-Niculescu-Mizil"
2017,"Fostering User Engagement: Rhetorical Devices for Applause Generation Learnt from TED Talks.",ICWSM,"Zhe Liu 0002,Anbang Xu,Mengdi Zhang,Jalal Mahmud,Vibha Sinha"
2017,"Fashion Conversation Data on Instagram.",ICWSM,"Yu-i Ha,Sejeong Kwon,Meeyoung Cha,Jungseock Joo"
2015,"Leveraging Product Adopter Information from Online Reviews for Product Recommendation.",ICWSM,"Jinpeng Wang,Wayne Xin Zhao,Yulan He,Xiaoming Li"
2008,"Approximating the Community Structure of the Long Tail.",ICWSM,"Akshay Java,Anupam Joshi,Tim Finin"
2014,"Discussion Graphs: Putting Social Media Analysis in Context.",ICWSM,"Emre Kiciman,Scott Counts,Michael Gamon,Munmun De Choudhury,Bo Thiesson"
2020,""Trust Me, I Have a Ph.D.": A Propensity Score Analysis on the Halo Effect of Disclosing One's Offline Social Status in Online Communities.",ICWSM,"Kunwoo Park,Haewoon Kwak,Hyunho Song,Meeyoung Cha"
2015,"Characterizing Silent Users in Social Media Communities.",ICWSM,"Wei Gong,Ee-Peng Lim,Feida Zhu 0001"
2018,"Can You Verifi This? Studying Uncertainty and Decision-Making About Misinformation Using Visual Analytics.",ICWSM,"Alireza Karduni,Ryan Wesslen,Sashank Santhanam,Isaac Cho,Svitlana Volkova,Dustin Arendt,Samira Shaikh,Wenwen Dou"
2020,"Sentiment Paradoxes in Social Networks: Why Your Friends Are More Positive Than You?",ICWSM,"Xinyi Zhou,Shengmin Jin,Reza Zafarani"
2014,"The Call of the Crowd: Event Participation in Location-Based Social Services.",ICWSM,"Petko Georgiev,Anastasios Noulas,Cecilia Mascolo"
2008,"Space Planning for Online Community.",ICWSM,"Danyel Fisher,Tammara Combs Turner,Marc A. Smith"
2016,"On the Correlation between Topic and User Behaviour in Online Communities.",ICWSM,"Erik Aumayr,Conor Hayes"
2018,"$FAKE: Evidence of Spam and Bot Activity in Stock Microblogs on Twitter.",ICWSM,"Stefano Cresci,Fabrizio Lillo,Daniele Regoli,Serena Tardelli,Maurizio Tesconi"
2020,"Diffusion of Scientific Articles across Online Platforms.",ICWSM,"Igor Zakhlebin,Emoke-Ágnes Horvát"
2011,"Exploiting User Interest on Social Media for Aggregating Diverse Data and Predicting Interest.",ICWSM,"Nozomi Nori,Danushka Bollegala,Mitsuru Ishizuka"
2008,"Document Representation and Query Expansion Models for Blog Recommendation.",ICWSM,"Jaime Arguello,Jonathan L. Elsas,Jamie Callan,Jaime G. Carbonell"
2012,"Have You Heard?: How Gossip Flows Through Workplace Email.",ICWSM,"Tanushree Mitra,Eric Gilbert"
2008,"Logsonomy: A Search Engine Folksonomy.",ICWSM,"Robert Jäschke,Beate Krause,Andreas Hotho,Gerd Stumme"
2012,"An Evaluation of the Role of Sentiment in Second Screen Microblog Search Tasks.",ICWSM,"Adam Bermingham,Alan F. Smeaton"
2016,"Are Social Bots on Twitter Political Actors? Empirical Evidence from a Ukrainian Social Botnet.",ICWSM,"Simon Hegelich,Dietmar Janetzko"
2015,"On the k-Anonymization of Time-Varying and Multi-Layer Social Graphs.",ICWSM,"Luca Rossi 0004,Mirco Musolesi,Andrea Torsello"
2013,"Visualization Techniques for the Analysis of Twitter Users' Behavior.",ICWSM,"Guilherme Coletto Rotta,Vinícius Silva de Lemos,Felipe Lammel,Isabel Harb Manssour,Milene Selbach Silveira,André Fagundes Pase"
2017,"Two-Phase Influence Maximization in Social Networks with Seed Nodes and Referral Incentives.",ICWSM,"Sneha Mondal,Swapnil Dhamal,Y. Narahari"
2019,"Detecting Social Bots on Facebook in an Information Veracity Context.",ICWSM,"Giovanni C. Santia,Munif Ishad Mujib,Jake Ryland Williams"
2016,"Targeted Interest-Driven Advertising in Cities Using Twitter.",ICWSM,"Aris Anagnostopoulos,Fabio Petroni,Mara Sorella"
2011,"Language Matters In Twitter: A Large Scale Study.",ICWSM,"Lichan Hong,Gregorio Convertino,Ed H. Chi"
2011,"Summarizing User-Contributed Comments.",ICWSM,"Elham Khabiri,James Caverlee,Chiao-Fang Hsu"
2018,"Network Structure, Efficiency, and Performance in WikiProjects.",ICWSM,"Edward L. Platt,Daniel M. Romero"
2014,"Facebook, Twitter and Google Plus for Breaking News: Is There a Winner?",ICWSM,"Miles Osborne,Mark Dredze"
2016,"Sequential Voting Promotes Collective Discovery in Social Recommendation Systems.",ICWSM,"L. Elisa Celis,Peter M. Krafft,Nathan Kobe"
2013,"Feature Sentiment Diversification of User Generated Reviews: The FREuD Approach.",ICWSM,"Nasir Naveed,Thomas Gottron,Steffen Staab"
2009,"Stylometric Analysis of Bloggers' Age and Gender.",ICWSM,"Sumit Goswami,Sudeshna Sarkar,Mayur Rustagi"
2008,"Competing to Share Expertise: The Taskcn Knowledge Sharing Community.",ICWSM,"Jiang Yang,Lada A. Adamic,Mark S. Ackerman"
2012,"Emotional Divergence Influences Information Spreading in Twitter.",ICWSM,"René Pfitzner,Antonios Garas,Frank Schweitzer"
2013,"Leveraging Browsing Patterns for Topic Discovery and Photostream Recommendation.",ICWSM,"Luca Chiarandini,Przemyslaw A. Grabowicz,Michele Trevisiol,Alejandro Jaimes"
2007,"Identifying Facets in Query-Biased Sets of Blog Posts.",ICWSM,"Wouter de Winter,Maarten de Rijke"
2019,"Race, Ethnicity and National Origin-Based Discrimination in Social Media and Hate Crimes across 100 U.S. Cities.",ICWSM,"Kunal Relia,Zhengyi Li,Stephanie H. Cook,Rumi Chunara"
2015,"Two Studies Investigating Gender Differences in Response to Facebook Status Updates.",ICWSM,"Richard Joiner,Lina Dapkeviciute,Helen Johnson 0001,Jeff Gavin,Mark J. Brosnan"
2017,"The Ebb and Flow of Controversial Debates on Social Media.",ICWSM,"Kiran Garimella,Gianmarco De Francisci Morales,Aristides Gionis,Michael Mathioudakis"
2020,"MimicProp: Learning to Incorporate Lexicon Knowledge into Distributed Word Representation for Social Media Analysis.",ICWSM,"Muheng Yan,Yu-Ru Lin,Rebecca Hwa,Ali Mert Ertugrul,Meiqi Guo,Wen-Ting Chung"
2017,"Kek, Cucks, and God Emperor Trump: A Measurement Study of 4chan's Politically Incorrect Forum and Its Effects on the Web.",ICWSM,"Gabriel Emile Hine,Jeremiah Onaolapo,Emiliano De Cristofaro,Nicolas Kourtellis,Ilias Leontiadis,Riginos Samaras,Gianluca Stringhini,Jeremy Blackburn"
2013,"CrowdE: Filtering Tweets for Direct Customer Engagements.",ICWSM,"Jilin Chen,Allen Cypher,Clemens Drews,Jeffrey Nichols"
2017,"Measuring, Predicting and Visualizing Short-Term Change in Word Representation and Usage in VKontakte Social Network.",ICWSM,"Ian Stewart,Dustin Arendt,Eric Bell,Svitlana Volkova"
2015,"Modeling Response Time in Digital Human Communication.",ICWSM,"Nicholas Martin Navaroli,Padhraic Smyth"
2012,"Creating Stories: Social Curation of Twitter Messages.",ICWSM,"Kevin Duh,Tsutomu Hirao,Akisato Kimura,Katsuhiko Ishiguro,Tomoharu Iwata,Ching-man Au Yeung"
2007,"BLOGRANK: Ranking on the blogosphere.",ICWSM,"Apostolos Kritikopoulos,Martha Sideri,Iraklis Varlamis"
2020,"Identifying and Quantifying Coordinated Manipulation of Upvotes and Downvotes in Naver News Comments.",ICWSM,"Jiwan Jeong,Jeong-han Kang,Sue Moon"
2018,"You Are Your Metadata: Identification and Obfuscation of Social Media Users Using Metadata Information.",ICWSM,"Beatrice Perez,Mirco Musolesi,Gianluca Stringhini"
2010,"Sequential Influence Models in Social Networks.",ICWSM,"Dan Cosley,Daniel P. Huttenlocher,Jon M. Kleinberg,Xiangyang Lan,Siddharth Suri"
2015,"Voting Behaviour and Power in Online Democracy: A Study of LiquidFeedback in Germany's Pirate Party.",ICWSM,"Christoph Carl Kling,Jérôme Kunegis,Heinrich Hartmann,Markus Strohmaier,Steffen Staab"
2007,"Building Trust with Corporate Blogs.",ICWSM,"Paul Dwyer"
2020,"The Structure of U.S. College Networks on Facebook.",ICWSM,"Jan Overgoor,Bogdan State,Lada A. Adamic"
2012,"Modeling Diffusion in Social Networks Using Network Properties.",ICWSM,"Duc Minh Luu,Ee-Peng Lim,Tuan-Anh Hoang,Freddy Chong Tat Chua"
2015,"Participation Barriers to Youth Civic Engagement in Social Media.",ICWSM,"Petter Bae Brandtzæg,Ida Maria Haugstveit,Marika Lüders,Asbjørn Følstad"
2020,"See and Read: Detecting Depression Symptoms in Higher Education Students Using Multimodal Social Media Data.",ICWSM,"Paulo Mann,Aline Paes,Elton H. Matsushima"
2009,"Motivational, Structural and Tenure Factors that Impact Online Community Photo Sharing.",ICWSM,"Oded Nov,Mor Naaman,Chen Ye"
2010,"Study of Static Classification of Social Spam Profiles in MySpace.",ICWSM,"Danesh Irani,Steve Webb,Calton Pu"
2012,"How You Met Me.",ICWSM,"Lada A. Adamic,Thomas M. Lento,Andrew T. Fiore"
2012,"OMG, I Have to Tweet that! A Study of Factors that Influence Tweet Rates.",ICWSM,"Emre Kiciman"
2019,"Gender Differences in the Global Music Industry: Evidence from MusicBrainz and The Echo Nest.",ICWSM,"Yixue Wang,Emoke-Ágnes Horvát"
2019,"Wikipedia Cultural Diversity Dataset: A Complete Cartography for 300 Language Editions.",ICWSM,"Marc Miquel-Ribé,David Laniado"
2017,"Community Identity and User Engagement in a Multi-Community Landscape.",ICWSM,"Justine Zhang,William L. Hamilton,Cristian Danescu-Niculescu-Mizil,Dan Jurafsky,Jure Leskovec"
2020,"Communal Quirks and Circlejerks: A Taxonomy of Processes Contributing to Insularity in Online Communities.",ICWSM,"Kimberley R. Allison,Kay Bussey"
2017,"Spice Up Your Chat: The Intentions and Sentiment Effects of Using Emojis.",ICWSM,"Tianran Hu,Han Guo,Hao Sun,Thuy-vy Thi Nguyen,Jiebo Luo"
2016,"Understanding Communities via Hashtag Engagement: A Clustering Based Approach.",ICWSM,"Orianna DeMasi,Douglas Mason,Jeff Ma"
2007,"Analyzing Temporal Collocations in Weblogs.",ICWSM,"Chun-Yuan Teng,Hsin-Hsi Chen"
2007,"A Usability Study of an Access Control System for Group Blogs.",ICWSM,"Indratmo,Julita Vassileva"
2020,""Musicalization of the Culture": Is Music Becoming Louder, More Repetitive, Monotonous and Simpler?",ICWSM,"Yukun Yang"
2018,"Modeling and Visualizing Locus of Control with Facebook Language.",ICWSM,"Kokil Jaidka,Anneke Buffone,Johannes C. Eichstaedt,Masoud Rouhizadeh,Lyle H. Ungar"
2012,"Catching the Long-Tail: Extracting Local News Events from Twitter.",ICWSM,"Puneet Agarwal,Rajgopal Vaithiyanathan,Saurabh Sharma,Gautam Shroff"
2020,"Hierarchical Propagation Networks for Fake News Detection: Investigation and Exploitation.",ICWSM,"Kai Shu,Deepak Mahudeswaran,Suhang Wang,Huan Liu 0001"
2010,"How to Become Famous in the Microblog World.",ICWSM,"Takeshi Sakaki,Yutaka Matsuo"
2017,"DeepCity: A Feature Learning Framework for Mining Location Check-Ins.",ICWSM,"Jun Pang 0001,Yang Zhang 0016"
2017,"Programming Languages in GitHub: A Visualization in Hyperbolic Plane.",ICWSM,"Dorota Celinska,Eryk Kopczynski"
2016,"Characterizing Deleted Tweets and Their Authors.",ICWSM,"Parantapa Bhattacharya,Niloy Ganguly"
2013,""How Old Do You Think I Am?" A Study of Language and Age in Twitter.",ICWSM,"Dong Nguyen 0002,Rilana Gravel,Dolf Trieschnigg,Theo Meder"
2016,"Aligning Popularity and Quality in Online Cultural Markets.",ICWSM,"Pascal Van Hentenryck,Andrés Abeliuk,Franco Berbeglia,Felipe Maldonado,Gerardo Berbeglia"
2011,"Maintaining Ties on Social Media Sites: The Competing Effects of Balance, Exchange, and Betweenness.",ICWSM,"Daniel Mauricio Romero,Brendan Meeder,Vladimir Barash,Jon M. Kleinberg"
2019,"Fairness in Proprietary Image Tagging Algorithms: A Cross-Platform Audit on People Images.",ICWSM,"Kyriakos Kyriakou,Pinar Barlas,Styliani Kleanthous,Jahna Otterbacher"
2010,"Modeling Personality Influences on YouTube Usage.",ICWSM,"T. E. Dominic Yeo"
2020,"Quasi-Experimental Designs for Assessing Response on Social Media to Policy Changes.",ICWSM,"Yijun Tian,Rumi Chunara"
2013,"Detecting Friendship Within Dynamic Online Interaction Networks.",ICWSM,"Sears A. Merritt,Abigail Z. Jacobs,Winter A. Mason,Aaron Clauset"
2012,"Crossing Media Streams with Sentiment: Domain Adaptation in Blogs, Reviews and Twitter.",ICWSM,"Yelena Mejova,Padmini Srinivasan"
2008,"Predicting Success and Failure in Weight Loss Blogs through Natural Language Use.",ICWSM,"Cindy K. Chung,Clinton Jones,Alexander Liu,James W. Pennebaker"
2009,"Gesundheit! Modeling Contagion through Facebook News Feed.",ICWSM,"Eric Sun,Itamar Rosenn,Cameron Marlow,Thomas M. Lento"
2011,"Differential Adaptive Diffusion: Understanding Diversity and Learning whom to Trust in Viral Marketing.",ICWSM,"Hossam Sharara,William Rand,Lise Getoor"
2009,"Sidelines: An Algorithm for Increasing Diversity in News and Opinion Aggregators.",ICWSM,"Sean A. Munson,Daniel Xiaodan Zhou,Paul Resnick"
2017,"Characterizing Online Communities Using Coarse Discourse Structures.",ICWSM,"Amy X. Zhang,Bryan Culbertson,Praveen Paritosh"
2020,"Auditing News Curation Systems: A Case Study Examining Algorithmic and Editorial Logic in Apple News.",ICWSM,"Jack Bandy,Nicholas Diakopoulos"
2007,"Structural Link Analysis from User Profiles and Friends Networks: A Feature Construction Approach.",ICWSM,"William H. Hsu,Joseph P. Lancaster,Martin S. R. Paradesi,Tim Weninger"
2017,"Mood Congruence or Mood Consistency? Examining Aggregated Twitter Sentiment Towards Ads in 2016 Super Bowl.",ICWSM,"Yuheng Hu,Tingting Nian,Cheng Chen"
2011,"Is Twitter a Good Place for Asking Questions? A Characterization Study.",ICWSM,"Sharoda A. Paul,Lichan Hong,Ed H. Chi"
2013,"Is the Sample Good Enough? Comparing Data from Twitter's Streaming API with Twitter's Firehose.",ICWSM,"Fred Morstatter,Jürgen Pfeffer,Huan Liu 0001,Kathleen M. Carley"
2010,"Finding Gold in Intranet Data: A Comparison of Mined and Surveyed Social Networks.",ICWSM,"Chen Zhao,Baozhong Liu"
2018,"Self-Representation on Twitter Using Emoji Skin Color Modifiers.",ICWSM,"Alexander Robertson,Walid Magdy,Sharon Goldwater"
2016,"TiDeH: Time-Dependent Hawkes Process for Predicting Retweet Dynamics.",ICWSM,"Ryota Kobayashi,Renaud Lambiotte"
2015,"Characterizing Information Diets of Social Media Users.",ICWSM,"Juhi Kulshrestha,Muhammad Bilal Zafar,Lisette Espin Noboa,Krishna P. Gummadi,Saptarshi Ghosh 0001"
2009,"The Evolution of Scientific Paper Title Networks.",ICWSM,"Vahed Qazvinian,Dragomir R. Radev"
2020,"Understanding the Political Ideology of Legislators from Social Media Images.",ICWSM,"Nan Xi,Di Ma,Marcus Liou,Zachary C. Steinert-Threlkeld,Jason Anastasopoulos,Jungseock Joo"
2012,"Tracking Sentiment and Topic Dynamics from Social Media.",ICWSM,"Yulan He,Chenghua Lin,Wei Gao 0001,Kam-Fai Wong"
2020,"What Makes People Feel Close to Online Groups? The Roles of Group Attributes and Group Types.",ICWSM,"Robert E. Kraut,John M. Levine,Marisol Martinez-Escobar,Amaç Herdagdelen"
2017,"How to Manipulate Social Media: Analyzing Political Astroturfing Using Ground Truth Data from South Korea.",ICWSM,"Franziska B. Keller,David Schoch,Sebastian Stier,JungHwan Yang"
2018,""With 1 Follower I Must Be AWESOME : P." Exploring the Role of Irony Markers in Irony Recognition.",ICWSM,"Debanjan Ghosh,Smaranda Muresan"
2010,"Toward Social Causality: An Analysis of Interpersonal Relationships in Online Blogs and Forums.",ICWSM,"Roxana Girju"
2018,"Collaboration in N-th Order Derivative Creation.",ICWSM,"Shiori Hironaka,Kosetsu Tsukuda,Masahiro Hamasaki,Masataka Goto"
2017,"Antagonism Also Flows Through Retweets: The Impact of Out-of-Context Quotes in Opinion Polarization Analysis.",ICWSM,"Pedro Calais Guerra,Roberto Nalon,Renato M. Assunção,Wagner Meira Jr."
2008,"Cross-Lingual Blog Analysis based on Multilingual Blog Distillation from Multilingual Wikipedia Entries.",ICWSM,"Mariko Kawaba,Hiroyuki Nakasaki,Takehito Utsuro,Tomohiro Fukuhara"
2013,"Para 'Normal' Activity: On the Distribution of Average Ratings.",ICWSM,"Nilesh N. Dalvi,Ravi Kumar 0001,Bo Pang 0001"
2018,"QDEE: Question Difficulty and Expertise Estimation in Community Question Answering Sites.",ICWSM,"Jiankai Sun,Sobhan Moosavi,Rajiv Ramnath,Srinivasan Parthasarathy 0001"
2016,"Sensing Real-World Events Using Arabic Twitter Posts.",ICWSM,"Nasser Alsaedi,Pete Burnap,Omer F. Rana"
2014,"On Understanding the Divergence of Online Social Group Discussion.",ICWSM,"Hemant Purohit,Yiye Ruan,David Fuhry,Srinivasan Parthasarathy 0001,Amit P. Sheth"
2009,"CourseRank: A Closed-Community Social System through the Magnifying Glass.",ICWSM,"Georgia Koutrika,Benjamin Bercovitz,Filip Kaliszan,Henry Liou,Hector Garcia-Molina"
2014,"Linguistic Reflections of Student Engagement in Massive Open Online Courses.",ICWSM,"Miaomiao Wen,Diyi Yang,Carolyn Penstein Rosé"
2020,"Modeling and Measuring Expressed (Dis)belief in (Mis)information.",ICWSM,"Shan Jiang 0008,Miriam J. Metzger,Andrew J. Flanagin,Christo Wilson"
2017,"Why Do Men Get More Attention? Exploring Factors Behind Success in An Online Design Community.",ICWSM,"Johannes Wachs,Aniko Hannak,András Vörös 0002,Bálint Daróczy"
2011,"Event Detection in Twitter.",ICWSM,"Jianshu Weng,Bu-Sung Lee"
2011,"You Are What You Tweet: Analyzing Twitter for Public Health.",ICWSM,"Michael J. Paul,Mark Dredze"
2012,"Learning the Nature of Information in Social Networks.",ICWSM,"Rakesh Agrawal 0001,Michalis Potamias,Evimaria Terzi"
2011,"What Stops Social Epidemics?",ICWSM,"Greg Ver Steeg,Rumi Ghosh,Kristina Lerman"
2011,"Who Should I Follow? Recommending People in Directed Social Networks.",ICWSM,"Michael J. Brzozowski,Daniel M. Romero"
2010,"Decomposing Discussion Forums and Boards Using User Roles.",ICWSM,"Jeffrey Chan,Conor Hayes,Elizabeth M. Daly"
2014,"Link and Triadic Closure Delay: Temporal Metrics for Social Network Dynamics.",ICWSM,"Matteo Zignani,Sabrina Gaito,Gian Paolo Rossi 0001,Xiaohan Zhao,Haitao Zheng 0001,Ben Y. Zhao"
2016,"SentiWorld: Understanding Emotions between Countries Based on Tweets.",ICWSM,"Sang-Jun Yea,Sejin Kim,John-Michaël To,Jae-Gil Lee 0001"
2011,"An Empirical Study of Geographic User Activity Patterns in Foursquare.",ICWSM,"Anastasios Noulas,Salvatore Scellato,Cecilia Mascolo,Massimiliano Pontil"
2009,"Event Detection and Tracking in Social Streams.",ICWSM,"Hassan Sayyadi,Matthew Hurst,Alexey Maykov"
2009,"Personal Information Management vs. Resource Sharing: Towards a Model of Information Behavior in Social Tagging Systems.",ICWSM,"Markus Heckner,Michael Heilemann,Christian Wolff 0001"
2007,"The OASYS 2.0 Opinion Analysis System.",ICWSM,"Carmine Cesarano,Antonio Picariello,Diego Reforgiato Recupero,V. S. Subrahmanian"
2018,"Automatic Story Evolution Wikification from Social Data.",ICWSM,"Omar Alonso,Vasileios Kandylas,Serge-Eric Tremblay"
2011,"Beyond Trending Topics: Real-World Event Identification on Twitter.",ICWSM,"Hila Becker,Mor Naaman,Luis Gravano"
2011,"Social Lens: Personalization Around User Defined Collections for Filtering Enterprise Message Streams.",ICWSM,"Elizabeth M. Daly,Michael J. Muller,Liang Gou,David R. Millen"
2019,"Multimodal Social Media Analysis for Gang Violence Prevention.",ICWSM,"Philipp Blandfort,Desmond Upton Patton,William R. Frey,Svebor Karaman,Surabhi Bhargava,Fei-Tzin Lee,Siddharth Varia,Chris Kedzie,Michael B. Gaskell,Rossano Schifanella,Kathleen R. McKeown,Shih-Fu Chang"
2018,"Quootstrap: Scalable Unsupervised Extraction of Quotation-Speaker Pairs from Large News Corpora via Bootstrapping.",ICWSM,"Dario Pavllo,Tiziano Piccardi,Robert West 0001"
2008,"Second Space: A Generative Model for the Blogosphere.",ICWSM,"Amit Karandikar,Akshay Java,Anupam Joshi,Tim Finin,Yaacov Yesha,Yelena Yesha"
2018,"CoupleNet: Paying Attention to Couples with Coupled Attention for Relationship Recommendation.",ICWSM,"Yi Tay,Luu Anh Tuan,Siu Cheung Hui"
2020,"Pie Chart or Pizza: Identifying Chart Types and Their Virality on Twitter.",ICWSM,"Pavlos Vougiouklis,Leslie Carr,Elena Simperl"
2017,"Visualizing Health Awareness in the Middle East.",ICWSM,"Matheus Lima Diniz Araújo,Yelena Mejova,Michaël Aupetit,Ingmar Weber"
2008,"Blog Link Classification.",ICWSM,"Justin Martineau,Matthew Hurst"
2017,"Suitable for All Ages: Using Reviews to Determine Appropriateness of Products.",ICWSM,"Elizabeth M. Daly,Oznur Alkan,Michael J. Muller"
2018,"When Politicians Talk About Politics: Identifying Political Tweets of Brazilian Congressmen.",ICWSM,"Lucas S. Oliveira,Pedro O. S. Vaz de Melo,Marcelo S. Amaral,José Antônio G. Pinho"
2014,"WeDo: End-To-End Computer Supported Collective Action.",ICWSM,"Haoqi Zhang,Andrés Monroy-Hernández,Aaron D. Shaw,Sean A. Munson,Elizabeth M. Gerber,Benjamin Mako Hill,Peter Kinnaird,Shelly Diane Farnham,Patrick Minder"
2017,"A Motif-Based Approach for Identifying Controversy.",ICWSM,"Mauro Coletto,Kiran Garimella,Aristides Gionis,Claudio Lucchese"
2018,"Measuring the Impact of Anxiety on Online Social Interactions.",ICWSM,"Sarmistha Dutta,Jennifer Ma,Munmun De Choudhury"
2020,"BotSlayer: DIY Real-Time Influence Campaign Detection.",ICWSM,"Pik-Mai Hui,Kai-Cheng Yang,Christopher Torres-Lugo,Filippo Menczer"
2015,"Analyzing and Modeling Special Offer Campaigns in Location-Based Social Networks.",ICWSM,"Ke Zhang 0013,Konstantinos Pelechrinis,Theodoros Lappas"
2016,"The Emotional and Chromatic Layers of Urban Smells.",ICWSM,"Daniele Quercia,Luca Maria Aiello,Rossano Schifanella"
2012,"Enhancing Event Descriptions through Twitter Mining.",ICWSM,"Hristo Tanev,Maud Ehrmann,Jakub Piskorski,Vanni Zavarella"
2017,"Is Slacktivism Underrated? Measuring the Value of Slacktivists for Online Social Movements.",ICWSM,"Lia Bozarth,Ceren Budak"
2013,"Self-Censorship on Facebook.",ICWSM,"Sauvik Das,Adam D. I. Kramer"
2017,"#NotOkay: Understanding Gender-Based Violence in Social Media.",ICWSM,"Mai ElSherief,Elizabeth M. Belding,Dana Nguyen"
2019,"Analyzing the Traits and Anomalies of Political Discussions on Reddit.",ICWSM,"Anna Guimarães,Oana Balalau,Erisa Terolli,Gerhard Weikum"
2015,"Self-Characterized Illness Phase and Information Needs of Participants in an Online Cancer Forum.",ICWSM,"Jordan Eschler,Zakariya Dehlawi,Wanda Pratt"
2009,"RevRank: A Fully Unsupervised Algorithm for Selecting the Most Helpful Book Reviews.",ICWSM,"Oren Tsur,Ari Rappoport"
2014,"When Politicians Talk: Assessing Online Conversational Practices of Political Parties on Twitter.",ICWSM,"Haiko Lietz,Claudia Wagner,Arnim Bleier,Markus Strohmaier"
2012,"Evolutionary Clustering and Analysis of User Behaviour in Online Forums.",ICWSM,"Donn Morrison,Ian McLoughlin,Alice Hogan,Conor Hayes"
2014,"Newsworthiness and Network Gatekeeping on Twitter: The Role of Social Deviance.",ICWSM,"Nicholas Diakopoulos,Arkaitz Zubiaga"
2018,""I'm Never Happy with What I Write": Challenges and Strategies of People with Dyslexia on Social Media.",ICWSM,"Lindsay Reynolds,Shaomei Wu"
2009,"Adaptive Weblog Post Filtering Based on User Browsing History.",ICWSM,"Ali Farahmand Nejad,Sadegh Kharazmi,Shahabedin Bayati,Hassan Abolhassani,Koosha Koosha Golmohammadi"
2018,"CrisisMMD: Multimodal Twitter Datasets from Natural Disasters.",ICWSM,"Firoj Alam,Ferda Ofli,Muhammad Imran 0002"
2011,"Relevance Modeling for Microblog Summarization.",ICWSM,"Sanda M. Harabagiu,Andrew Hickl"
2017,"Wearing Many (Social) Hats: How Different Are Your Different Social Network Personae?",ICWSM,"Changtao Zhong,Hau-Wen Chang,Dmytro Karamshuk,Dongwon Lee 0001,Nishanth Sastry"
2017,"Understanding Emoji Ambiguity in Context: The Role of Text in Emoji-Related Miscommunication.",ICWSM,"Hannah Jean Miller,Daniel Kluver,Jacob Thebault-Spieker,Loren G. Terveen,Brent J. Hecht"
2007,"Large-Scale Sentiment Analysis for News and Blogs (system demonstration).",ICWSM,"Namrata Godbole,Manjunath Srinivasaiah,Steven Skiena"
2019,"View, Like, Comment, Post: Analyzing User Engagement by Topic at 4 Levels across 5 Social Media Platforms for 53 News Organizations.",ICWSM,"Kholoud Khalil Aldous,Jisun An,Bernard J. Jansen"
2014,"Personalizing Forum Search using Multidimensional Random Walks.",ICWSM,"Gayatree Ganu,Amélie Marian"
2016,"Dynamic Data Capture from Social Media Streams: A Contextual Bandit Approach.",ICWSM,"Thibault Gisselbrecht,Sylvain Lamprier,Patrick Gallinari"
2014,"Using Co-Following for Personalized Out-of-Context Twitter Friend Recommendation.",ICWSM,"Ingmar Weber,Venkata Rama Kiran Garimella"
2017,"Ranking with Social Cues: Integrating Online Review Scores and Popularity Information.",ICWSM,"Pantelis P. Analytis,Alexia Delfino,Juliane E. Kämmer,Mehdi Moussaïd,Thorsten Joachims"
2015,"Impact of Entity Disambiguation Errors on Social Network Properties.",ICWSM,"Jana Diesner,Craig S. Evans,Jinseok Kim 0001"
2018,"Bumper Stickers on the Twitter Highway: Analyzing the Speed and Substance of Profile Changes.",ICWSM,"Ryan Wesslen,Sagar Nandu,Omar Eltayeby,Tiffany Gallicano,Sara Levens,Min Jiang,Samira Shaikh"
2018,"Using Longitudinal Social Media Analysis to Understand the Effects of Early College Alcohol Use.",ICWSM,"Emre Kiciman,Scott Counts,Melissa Gasser"
2016,"Who Are Like-Minded: Mining User Interest Similarity in Online Social Networks.",ICWSM,"Chunfeng Yang,Yipeng Zhou,Dah Ming Chiu"
2016,"Predicting Perceived Brand Personality with Social Media.",ICWSM,"Anbang Xu,Haibin Liu,Liang Gou,Rama Akkiraju,Jalal Mahmud,Vibha Sinha,Yuheng Hu,Mu Qiao"
2009,"A Utility for Estimating the Relative Contributions of Wiki Authors.",ICWSM,"Ofer Arazy,Eleni Stroulia"
