2012,"Targeting converters for new campaigns through factor models.",WWW,"Deepak Agarwal,Sandeep Pandey,Vanja Josifovski"
2019,"Distributed Tensor Decomposition for Large Scale Health Analytics.",WWW,"Huan He,Jette Henderson,Joyce C. Ho"
2016,"Identifying Web Queries with Question Intent.",WWW,"Gilad Tsur,Yuval Pinter,Idan Szpektor,David Carmel"
2001,"Web-based personalization and management of interactive video.",WWW,"Rune Hjelsvold,Subu Vdaygiri,Yves Léauté"
2017,"Collaborative Optimization for Collective Decision-making in Continuous Spaces.",WWW,"Nikhil Garg,Vijay Kamble,Ashish Goel,David Marn,Kamesh Munagala"
2019,"Growing Attributed Networks through Local Processes.",WWW,"Harshay Shah,Suhansanu Kumar,Hari Sundaram"
2011,"Incentivizing high-quality user-generated content.",WWW,"Arpita Ghosh,R. Preston McAfee"
2003,"Scaling personalized web search.",WWW,"Glen Jeh,Jennifer Widom"
2019,"No More than What I Post: Preventing Linkage Attacks on Check-in Services.",WWW,"Fengli Xu,Zhen Tu,Hongjia Huang,Shuhao Chang,Funing Sun,Diansheng Guo,Yong Li 0008"
2001,"ViBE: virtual biology experiments.",WWW,"Rajaram Subramanian,Ivan Marsic"
2017,"Budget Management Strategies in Repeated Auctions.",WWW,"Santiago R. Balseiro,Anthony Kim,Mohammad Mahdian,Vahab S. Mirrokni"
2014,"Was this review helpful to you?: it depends! context and voting patterns in online content.",WWW,"Ruben Sipos,Arpita Ghosh,Thorsten Joachims"
2019,"From Small-scale to Large-scale Text Classification.",WWW,"Kang-Min Kim,Yeachan Kim,Jungho Lee,Ji-Min Lee,SangKeun Lee 0001"
2013,"WTF: the who to follow service at Twitter.",WWW,"Pankaj Gupta,Ashish Goel,Jimmy J. Lin,Aneesh Sharma,Dong Wang,Reza Zadeh"
2005,"Debugging OWL ontologies.",WWW,"Bijan Parsia,Evren Sirin,Aditya Kalyanpur"
2019,"Auto-EM: End-to-end Fuzzy Entity-Matching using Pre-trained Deep Models and Transfer Learning.",WWW,"Chen Zhao,Yeye He"
2006,"Geographically focused collaborative crawling.",WWW,"Weizheng Gao,Hyun Chul Lee,Yingbo Miao"
2007,"A content-driven reputation system for the wikipedia.",WWW,"B. Thomas Adler,Luca de Alfaro"
2017,"Promoting Relevant Results in Time-Ranked Mail Search.",WWW,"David Carmel,Liane Lewin-Eytan,Alex Libov,Yoelle Maarek,Ariel Raviv"
2016,"Stress Testing the Booters: Understanding and Undermining the Business of DDoS Services.",WWW,"Mohammad Karami,Youngsam Park,Damon McCoy"
2009,"Using graphics processors for high performance IR query processing.",WWW,"Shuai Ding,Jinru He,Hao Yan,Torsten Suel"
2010,"A contextual-bandit approach to personalized news article recommendation.",WWW,"Lihong Li 0001,Wei Chu,John Langford 0001,Robert E. Schapire"
2006,"Generation of multimedia TV news contents for WWW.",WWW,"Hsin-Chia Fu,Yeong-Yuh Xu,Cheng-Lung Tseng"
2006,"Requirements for multimedia document enrichment.",WWW,"Ajay Chakravarthy,Vitaveska Lanfranchi,Fabio Ciravegna"
2019,"Sarcasm Detection with Self-matching Networks and Low-rank Bilinear Pooling.",WWW,"Tao Xiong,Peiran Zhang,Hongbo Zhu,Yihui Yang"
2015,"Skolemising Blank Nodes while Preserving Isomorphism.",WWW,"Aidan Hogan"
2019,"Learning Novelty-Aware Ranking of Answers to Complex Questions.",WWW,"Shahar Harel,Sefi Albo,Eugene Agichtein,Kira Radinsky"
2020,"Recommending Themes for Ad Creative Design via Visual-Linguistic Representations.",WWW,"Yichao Zhou,Shaunak Mishra,Manisha Verma,Narayan Bhamidipati,Wei Wang 0010"
2016,"Pushing the Frontier: Exploring the African Web Ecosystem.",WWW,"Rodérick Fanou,Gareth Tyson,Pierre François,Arjuna Sathiaseelan"
2002,"Mobile streaming media CDN enabled by dynamic SMIL.",WWW,"Takeshi Yoshimura,Yoshifumi Yonemoto,Tomoyuki Ohya,Minoru Etoh,Susie J. Wee"
2008,"Using subspace analysis for event detection from web click-through data.",WWW,"Ling Chen 0002,Yiqun Hu,Wolfgang Nejdl"
2011,"Information credibility on twitter.",WWW,"Carlos Castillo 0001,Marcelo Mendoza,Barbara Poblete"
2020,"StageNet: Stage-Aware Neural Networks for Health Risk Prediction.",WWW,"Junyi Gao,Cao Xiao,Yasha Wang,Wen Tang,Lucas M. Glass,Jimeng Sun"
2017,"What's in a Name?: Understanding Profile Name Reuse on Twitter.",WWW,"Enrico Mariconti,Jeremiah Onaolapo,Syed Sharique Ahmad,Nicolas Nikiforou,Manuel Egele,Nick Nikiforakis,Gianluca Stringhini"
2015,"Hierarchical Neural Language Models for Joint Representation of Streaming Documents and their Content.",WWW,"Nemanja Djuric,Hao Wu,Vladan Radosavljevic,Mihajlo Grbovic,Narayan Bhamidipati"
2020,"Beyond the Front Page: Measuring Third Party Dynamics in the Field.",WWW,"Tobias Urban,Martin Degeling,Thorsten Holz,Norbert Pohlmann"
2018,"Better Caching in Search Advertising Systems with Rapid Refresh Predictions.",WWW,"Conglong Li,David G. Andersen,Qiang Fu,Sameh Elnikety,Yuxiong He"
2008,"Matching independent global constraints for composite web services.",WWW,"Nalaka Gooneratne,Zahir Tari"
2020,"Inferring Passengers' Interactive Choices on Public Transits via MA-AL: Multi-Agent Apprenticeship Learning.",WWW,"Mingzhou Yang,Yanhua Li,Xun Zhou,Hui Lu,Zhihong Tian,Jun Luo 0007"
2015,"LightLDA: Big Topic Models on Modest Computer Clusters.",WWW,"Jinhui Yuan,Fei Gao,Qirong Ho,Wei Dai 0003,Jinliang Wei,Xun Zheng,Eric Po Xing,Tie-Yan Liu,Wei-Ying Ma"
2020,"Deep Global and Local Generative Model for Recommendation.",WWW,"Huafeng Liu,Liping Jing,Jingxuan Wen,Zhicheng Wu,Xiaoyi Sun,Jiaqi Wang,Lin Xiao,Jian Yu"
2007,"Organizing and searching the world wide web of facts -- step two: harnessing the wisdom of the crowds.",WWW,"Marius Pasca"
2017,"An Army of Me: Sockpuppets in Online Discussion Communities.",WWW,"Srijan Kumar,Justin Cheng,Jure Leskovec,V. S. Subrahmanian"
2006,"'e-science and cyberinfrastructure: a middleware perspective'.",WWW,"Anthony J. G. Hey"
2019,"Adversarial Point-of-Interest Recommendation.",WWW,"Fan Zhou 0002,Ruiyang Yin,Kunpeng Zhang,Goce Trajcevski,Ting Zhong,Jin Wu"
2007,"Defeating script injection attacks with browser-enforced embedded policies.",WWW,"Trevor Jim,Nikhil Swamy,Michael Hicks 0001"
2008,"Spatial variation in search engine queries.",WWW,"Lars Backstrom,Jon M. Kleinberg,Ravi Kumar 0001,Jasmine Novak"
2014,"User profiling in an ego network: co-profiling attributes and relationships.",WWW,"Rui Li,Chi Wang 0001,Kevin Chen-Chuan Chang"
2019,"(Mis)Information Dissemination in WhatsApp: Gathering, Analyzing and Countermeasures.",WWW,"Gustavo Resende,Philipe F. Melo,Hugo Sousa,Johnnatan Messias,Marisa Vasconcelos,Jussara M. Almeida,Fabrício Benevenuto"
2016,"Strengthening Weak Identities Through Inter-Domain Trust Transfer.",WWW,"Giridhari Venkatadri,Oana Goga,Changtao Zhong,Bimal Viswanath,Krishna P. Gummadi,Nishanth R. Sastry"
2017,"Mobile Sensing at the Service of Mental Well-being: a Large-scale Longitudinal Study.",WWW,"Sandra Servia Rodríguez,Kiran K. Rachuri,Cecilia Mascolo,Peter J. Rentfrow,Neal Lathia,Gillian M. Sandstrom"
2013,"TopRec: domain-specific recommendation through community topic mining in social network.",WWW,"Xi Zhang 0018,Jian Cheng 0001,Ting Yuan,Biao Niu,Hanqing Lu"
2020,"On the Robustness of Cascade Diffusion under Node Attacks.",WWW,"Alvis Logins,Yuchen Li 0001,Panagiotis Karras"
2003,"Scalable techniques for memory-efficient CDN simulations.",WWW,"Purushottam Kulkarni,Prashant J. Shenoy,Weibo Gong"
2010,"HTTP database connector (HDBC): RESTful access to relational databases.",WWW,"Alexandros Marinos,Erik Wilde,Jiannan Lu"
2020,"A Feedback Shift Correction in Predicting Conversion Rates under Delayed Feedback.",WWW,"Shota Yasui,Gota Morishita,Komei Fujita,Masashi Shibata"
2018,"Discovering Progression Stages in Trillion-Scale Behavior Logs.",WWW,"Kijung Shin,Mahdi Shafiei,Myunghwan Kim 0002,Aastha Jain,Hema Raghavan"
2013,"Rethinking the web as a personal archive.",WWW,"Siân E. Lindley,Catherine C. Marshall,Richard Banks,Abigail Sellen,Tim Regan"
2019,"Detect Rumors on Twitter by Promoting Information Campaigns with Generative Adversarial Learning.",WWW,"Jing Ma 0004,Wei Gao 0001,Kam-Fai Wong"
2019,"Learning Binary Hash Codes for Fast Anchor Link Retrieval across Networks.",WWW,"Yongqing Wang,Huawei Shen,Jinhua Gao,Xueqi Cheng"
2008,"Web graph similarity for anomaly detection (poster).",WWW,"Panagiotis Papadimitriou 0002,Ali Dasdan,Hector Garcia-Molina"
2009,"Where to adapt dynamic service compositions.",WWW,"Bo Jiang 0001,W. K. Chan 0001,Zhenyu Zhang 0004,T. H. Tse"
2020,"One Picture Is Worth a Thousand Words? The Pricing Power of Images in e-Commerce.",WWW,"Christof Naumzik,Stefan Feuerriegel"
2006,"Geographic locations of web servers.",WWW,"Katsuko T. Nakahira,Tetsuya Hoshino,Yoshiki Mikami"
2018,"On Ridesharing Competition and Accessibility: Evidence from Uber, Lyft, and Taxi.",WWW,"Shan Jiang 0008,Le Chen,Alan Mislove,Christo Wilson"
2014,"A time-based collective factorization for topic discovery and monitoring in news.",WWW,"Carmen K. Vaca,Amin Mantrach,Alejandro Jaimes,Marco Saerens"
2016,"Modeling User Consumption Sequences.",WWW,"Austin R. Benson,Ravi Kumar 0001,Andrew Tomkins"
2008,"Visualizing historical content of web pages.",WWW,"Adam Jatowt,Yukiko Kawai,Katsumi Tanaka"
2020,"Efficient Non-Sampling Factorization Machines for Optimal Context-Aware Recommendation.",WWW,"Chong Chen,Min Zhang 0006,Weizhi Ma,Yiqun Liu 0001,Shaoping Ma"
2019,"Measurement and Early Detection of Third-Party Application Abuse on Twitter.",WWW,"Shehroze Farooqi,Zubair Shafiq"
2008,"Improving relevance judgment of web search results with image excerpts.",WWW,"Zhiwei Li 0006,Shuming Shi 0001,Lei Zhang 0001"
2018,"Your Secrets Are Safe: How Browsers' Explanations Impact Misconceptions About Private Browsing Mode.",WWW,"Yuxi Wu,Panya Gupta,Miranda Wei,Yasemin Acar,Sascha Fahl,Blase Ur"
2013,"Ad impression forecasting for sponsored search.",WWW,"Abhirup Nath,Shibnath Mukherjee,Prateek Jain 0002,Navin Goyal,Srivatsan Laxman"
2016,"Using Hierarchical Skills for Optimized Task Assignment in Knowledge-Intensive Crowdsourcing.",WWW,"Panagiotis Mavridis,David Gross-Amblard,Zoltán Miklós 0001"
2019,"Unbiased LambdaMART: An Unbiased Pairwise Learning-to-Rank Algorithm.",WWW,"Ziniu Hu,Yang Wang,Qu Peng,Hang Li"
2013,"Pricing mechanisms for crowdsourcing markets.",WWW,"Yaron Singer,Manas Mittal"
2018,"RaRE: Social Rank Regulated Large-scale Network Embedding.",WWW,"Yupeng Gu,Yizhou Sun,Yanen Li,Yang Yang 0008"
2017,"Why We Read Wikipedia.",WWW,"Philipp Singer,Florian Lemmerich,Robert West 0001,Leila Zia,Ellery Wulczyn,Markus Strohmaier,Jure Leskovec"
2019,"Constructing Test Collections using Multi-armed Bandits and Active Learning.",WWW,"Md. Mustafizur Rahman,Mücahid Kutlu,Matthew Lease"
2001,"A RTP to HTTP video gateway.",WWW,"Mathias Johanson"
2009,"Learning consensus opinion: mining data from a labeling game.",WWW,"Paul N. Bennett,David Maxwell Chickering,Anton Mityagin"
2007,"The largest scholarly semantic network...ever.",WWW,"Johan Bollen,Marko A. Rodriguez,Herbert Van de Sompel,Lyudmila Balakireva,Aric A. Hagberg"
2009,"User-centric content freshness metrics for search engines.",WWW,"Ali Dasdan,Xinh Huynh"
2017,"Ex Machina: Personal Attacks Seen at Scale.",WWW,"Ellery Wulczyn,Nithum Thain,Lucas Dixon"
2012,"Understanding web images by object relation network.",WWW,"Na Chen 0002,Qian-Yi Zhou,Viktor K. Prasanna"
2013,"Predictive web automation assistant for people with vision impairments.",WWW,"Yury Puzis,Yevgen Borodin,Rami Puzis,I. V. Ramakrishnan"
2016,"A Study of Retrieval Models for Long Documents and Queries in Information Retrieval.",WWW,"Ronan Cummins"
2009,"Identifying vertical search intention of query through social tagging propagation.",WWW,"Ning Liu 0001,Jun Yan 0001,Weiguo Fan,Qiang Yang 0001,Zheng Chen 0001"
2013,"Do social explanations work?: studying and modeling the effects of social explanations in recommender systems.",WWW,"Amit Sharma,Dan Cosley"
2004,"Incremental formalization of document annotations through ontology-based paraphrasing.",WWW,"Jim Blythe,Yolanda Gil"
2001,"A case study in web search using TREC algorithms.",WWW,"Amit Singhal 0001,Marcin Kaszkiel"
2005,"AwareDAV: a generic WebDAV notification framework and implementation.",WWW,"Henning Qin Jehøj,Niels Olof Bouvin,Kaj Grønbæk"
2015,"Overcoming Relational Learning Biases to Accurately Predict Preferences in Large Scale Networks.",WWW,"Joseph J. Pfeiffer III,Jennifer Neville,Paul N. Bennett"
2020,"Don't Count Me Out: On the Relevance of IP Address in the Tracking Ecosystem.",WWW,"Vikas Mishra,Pierre Laperdrix,Antoine Vastel,Walter Rudametkin,Romain Rouvoy,Martin Lopatka"
2019,"A Family of Fuzzy Orthogonal Projection Models for Monolingual and Cross-lingual Hypernymy Prediction.",WWW,"Chengyu Wang 0001,Yan Fan,Xiaofeng He,Aoying Zhou"
2004,"Trust-serv: model-driven lifecycle management of trust negotiation policies for web services.",WWW,"Halvard Skogsrud,Boualem Benatallah,Fabio Casati"
2010,"Exposing audio data to the web: an API and prototype.",WWW,"David Humphrey,Corban Brook,Alistair MacDonald"
2019,"Enlisting the Public to Build a Healthier Web Information Commons.",WWW,"Claire Wardle"
2013,"Google+Ripples: a native visualization of information flow.",WWW,"Fernanda B. Viégas,Martin Wattenberg,Jack Hebert,Geoffrey Borggaard,Alison Cichowlas,Jonathan Feinberg,Jon Orwant,Christopher Richard Wren"
2019,"Hierarchical Neural Variational Model for Personalized Sequential Recommendation.",WWW,"Teng Xiao,Shangsong Liang,Zaiqiao Meng"
2006,"Effective web-scale crawling through website analysis.",WWW,"Iván Gonzlez,Adam Marcus 0002,Daniel N. Meredith,Linda A. Nguyen"
2006,"GIO: a semantic web application using the information grid framework.",WWW,"Omar Alonso,Sandeepan Banerjee,Mark Drake"
2019,"Keyphrase Extraction from Disaster-related Tweets.",WWW,"Jishnu Ray Chowdhury,Cornelia Caragea,Doina Caragea"
2006,"Invisible participants: how cultural capital relates to lurking behavior.",WWW,"Vladimir Soroka,Sheizaf Rafaeli"
2010,"Context-aware citation recommendation.",WWW,"Qi He,Jian Pei,Daniel Kifer,Prasenjit Mitra,C. Lee Giles"
2020,"Evolution of a Web-Scale Near Duplicate Image Detection System.",WWW,"Andrey Gusev,Jiajing Xu"
2013,"Hierarchical geographical modeling of user locations from social media posts.",WWW,"Amr Ahmed,Liangjie Hong,Alexander J. Smola"
2009,"To join or not to join: the illusion of privacy in social networks with mixed public and private user profiles.",WWW,"Elena Zheleva,Lise Getoor"
2008,"Learning deterministic regular expressions for the inference of schemas from XML data.",WWW,"Geert Jan Bex,Wouter Gelade,Frank Neven,Stijn Vansummeren"
2014,"Unveiling group characteristics in online social games: a socio-economic analysis.",WWW,"Taejoong Chung,Jinyoung Han,Daejin Choi,Ted Taekyoung Kwon,Huy Kang Kim,Yanghee Choi"
2006,"Beyond PageRank: machine learning for static ranking.",WWW,"Matthew Richardson,Amit Prakash,Eric Brill"
2016,"Which to View: Personalized Prioritization for Broadcast Emails.",WWW,"Beidou Wang,Martin Ester,Jiajun Bu,Yu Zhu,Ziyu Guan,Deng Cai 0001"
2005,"Using XForms to simplify Web programming.",WWW,"Richard Cardone,Danny Soroker,Alpana Tiwari"
2019,"SamWalker: Social Recommendation with Informative Sampling Strategy.",WWW,"Jiawei Chen 0007,Can Wang 0001,Sheng Zhou,Qihao Shi,Yan Feng,Chun Chen 0001"
2007,"The use of XML to express a historical knowledge base.",WWW,"Katsuko T. Nakahira,Masashi Matsui,Yoshiki Mikami"
2016,"On Sampling Nodes in a Network.",WWW,"Flavio Chierichetti,Anirban Dasgupta 0001,Ravi Kumar 0001,Silvio Lattanzi,Tamás Sarlós"
2017,"Measuring and Improving the Reliability of Wide-Area Cloud Paths.",WWW,"Osama Haq,Mamoon Raja,Fahad R. Dogar"
2008,"Low-load server crawler: design and evaluation.",WWW,"Katsuko T. Nakahira,Tetsuya Hoshino,Yoshiki Mikami"
2008,"Cm-pmi: improved web-based association measure with contextual label matching.",WWW,"Xiaojun Wan 0001"
2020,"A Cue Adaptive Decoder for Controllable Neural Response Generation.",WWW,"Weichao Wang,Shi Feng,Wei Gao,Daling Wang,Yifei Zhang 0003"
2008,"Location and the web (LocWeb 2008).",WWW,"Susanne Boll,Christopher B. Jones,Eric Kansa,Puneet Kishor,Mor Naaman,Ross Purves,Arno Scharl,Erik Wilde"
2007,"Adaptive record extraction from web pages.",WWW,"Justin Park,Denilson Barbosa"
2019,"CnGAN: Generative Adversarial Networks for Cross-network user preference generation for non-overlapped users.",WWW,"Dilruk Perera,Roger Zimmermann"
2009,"Retaining personal expression for social search.",WWW,"Praphul Chandra,Ajay Gupta"
2003,"On admission control for profit maximization of networked service providers.",WWW,"Akshat Verma,Sugata Ghosal"
2017,"An Efficient Approach to Event Detection and Forecasting in Dynamic Multivariate Social Media Networks.",WWW,"Minglai Shao,Jianxin Li,Feng Chen 0001,Hongyi Huang,Shuai Zhang,Xunxun Chen"
2010,"TWC data-gov corpus: incrementally generating linked government data from data.gov.",WWW,"Li Ding 0001,Dominic DiFranzo,Alvaro Graves,James Michaelis,Xian Li,Deborah L. McGuinness,James A. Hendler"
2016,"Exploring Patterns of Identity Usage in Tweets: A New Problem, Solution and Case Study.",WWW,"Kenneth Joseph,Wei Wei 0019,Kathleen M. Carley"
2020,"FiDo: Ubiquitous Fine-Grained WiFi-based Localization for Unlabelled Users via Domain Adaptation.",WWW,"Xi Chen,Hang Li,Chenyi Zhou,Xue Liu,Di Wu,Gregory Dudek"
2007,"MedSearch: a specialized search engine for medical information.",WWW,"Gang Luo 0001,Chunqiang Tang,Hao Yang,Xing Wei"
2017,"ESCAPE: Efficiently Counting All 5-Vertex Subgraphs.",WWW,"Ali Pinar,C. Seshadhri,Vaidyanathan Vishal"
2017,"PhLeGrA: Graph Analytics in Pharmacology over the Web of Life Sciences Linked Open Data.",WWW,"Maulik R. Kamdar,Mark A. Musen"
2008,"Learning to classify short and sparse text & web with hidden topics from large-scale data collections.",WWW,"Xuan Hieu Phan,Minh Le Nguyen,Susumu Horiguchi"
2017,"The Long-Standing Privacy Debate: Mobile Websites vs Mobile Apps.",WWW,"Elias P. Papadopoulos,Michalis Diamantaris,Panagiotis Papadopoulos,Thanasis Petsas,Sotiris Ioannidis,Evangelos P. Markatos"
2008,"Investigation of partial query proximity in web search.",WWW,"Jing Bai,Yi Chang 0001,Hang Cui,Zhaohui Zheng,Gordon Sun,Xin Li"
2011,"A case for query by image and text content: searching computer help using screenshots and keywords.",WWW,"Tom Yeh,Brandyn White,José San Pedro,Boris Katz,Larry S. Davis"
2007,"XML-based multimodal interaction framework for contact center applications.",WWW,"Nikolay A. Anisimov,Brian Galvin,Herbert Ristock"
2019,"On the Impact of Choice Architectures on Inequality in Online Donation Platforms.",WWW,"Abhijnan Chakraborty,Nuno Mota,Asia J. Biega,Krishna P. Gummadi,Hoda Heidari"
2008,"Race: finding and ranking compact connected trees for keyword proximity search over xml documents.",WWW,"Guoliang Li 0001,Jianhua Feng,Jianyong Wang 0001,Bei Yu,Yukai He"
2017,"GB-CENT: Gradient Boosted Categorical Embedding and Numerical Trees.",WWW,"Qian Zhao,Yue Shi,Liangjie Hong"
2009,"Visual diversification of image search results.",WWW,"Reinier H. van Leuken,Lluis Garcia Pueyo,Ximena Olivares,Roelof van Zwol"
2016,"The Death and Life of Great Italian Cities: A Mobile Phone Data Perspective.",WWW,"Marco De Nadai,Jacopo Staiano,Roberto Larcher,Nicu Sebe,Daniele Quercia,Bruno Lepri"
2020,"DyCRS: Dynamic Interpretable Postoperative Complication Risk Scoring.",WWW,"Wen Wang,Han Zhao 0002,Honglei Zhuang,Nirav Shah,Rema Padman"
2002,"Web page scoring systems for horizontal and vertical search.",WWW,"Michelangelo Diligenti,Marco Gori,Marco Maggini"
2013,"Google+ or Google-?: dissecting the evolution of the new OSN in its first year.",WWW,"Roberto Gonzalez,Rubén Cuevas,Reza Motamedi,Reza Rejaie,Ángel Cuevas"
2015,"Crowd Fraud Detection in Internet Advertising.",WWW,"Tian Tian 0001,Jun Zhu 0001,Fen Xia,Xin Zhuang,Tong Zhang"
2003,"Xspect: bridging open hypermedia and XLink.",WWW,"Bent Guldbjerg Christensen,Frank Allan Hansen,Niels Olof Bouvin"
2020,"Learning the Structure of Auto-Encoding Recommenders.",WWW,"Farhan Khawar,Leonard K. M. Poon,Nevin L. Zhang"
2010,"Automatic extraction of clickable structured web contents for name entity queries.",WWW,"Xiaoxin Yin,Wenzhao Tan,Xiao Li,Yi-Chin Tu"
2009,"Why is the web loosely coupled?: a multi-faceted metric for service design.",WWW,"Cesare Pautasso,Erik Wilde"
2014,"Price competition in online combinatorial markets.",WWW,"Moshe Babaioff,Noam Nisan,Renato Paes Leme"
2013,"A predictive model for advertiser value-per-click in sponsored search.",WWW,"Eric Sodomka,Sébastien Lahaie,Dustin Hillard"
2009,"Towards intent-driven bidterm suggestion.",WWW,"William Chang,Patrick Pantel,Ana-Maria Popescu,Evgeniy Gabrilovich"
2003,"Sensor-enhanced mobile web clients: an XForms approach.",WWW,"John J. Barton,Tim Kindberg,Hui Dai,Nissanka Bodhi Priyantha,Fahd Al-Bin-Ali"
2020,"Dynamic Flow Distribution Prediction for Urban Dockless E-Scooter Sharing Reconfiguration.",WWW,"Suining He,Kang G. Shin"
2010,"Detection and analysis of drive-by-download attacks and malicious JavaScript code.",WWW,"Marco Cova,Christopher Krügel,Giovanni Vigna"
2013,"Anatomy of a web-scale resale market: a data mining approach.",WWW,"Yuchen Zhao,Neel Sundaresan,Zeqian Shen,Philip S. Yu"
2017,"Harnessing the Web for Population-Scale Physiological Sensing: A Case Study of Sleep and Performance.",WWW,"Tim Althoff,Eric Horvitz,Ryen W. White,Jamie Zeitzer"
2008,"WWW 2008 workshop: NLPIX2008 summary.",WWW,"Hiroshi Nakagawa,Kentaro Torisawa,Marasu Kitsuregawa"
2015,"Compressed Indexes for String Searching in Labeled Graphs.",WWW,"Paolo Ferragina,Francesco Piccinno,Rossano Venturini"
2007,"Optimizing web search using social annotations.",WWW,"Shenghua Bao,Gui-Rong Xue,Xiaoyuan Wu,Yong Yu 0001,Ben Fei,Zhong Su"
2009,"Search result re-ranking based on gap between search queries and social tags.",WWW,"Jun Yan 0001,Ning Liu 0001,Elaine Qing Chang,Lei Ji,Zheng Chen 0001"
2015,"Bringing CUPID Indoor Positioning System to Practice.",WWW,"Souvik Sen,Dongho Kim,Stephane Laroche,Kyu-Han Kim,Jeongkeun Lee"
2015,"Asymmetric Minwise Hashing for Indexing Binary Inner Products and Set Containment.",WWW,"Anshumali Shrivastava,Ping Li 0001"
2007,"Web page classification with heterogeneous data fusion.",WWW,"Zenglin Xu,Irwin King,Michael R. Lyu"
2006,"The distribution of pageRank follows a power-law only for particular values of the damping factor.",WWW,"Luca Becchetti,Carlos Castillo 0001"
2010,"LINKREC: a unified framework for link recommendation with user attributes and graph structure.",WWW,"Zhijun Yin,Manish Gupta 0001,Tim Weninger,Jiawei Han 0001"
2014,"Automated runtime recovery for QoS-based service composition.",WWW,"Tian Huat Tan,Manman Chen,Étienne André,Jun Sun 0001,Yang Liu 0003,Jin Song Dong"
2018,"What We Read, What We Search: Media Attention and Public Attention Among 193 Countries.",WWW,"Haewoon Kwak,Jisun An,Joni Salminen,Soon-Gyo Jung,Bernard J. Jansen"
2009,"Graffiti: node labeling in heterogeneous networks.",WWW,"Ralitsa Angelova,Gjergji Kasneci,Fabian M. Suchanek,Gerhard Weikum"
2020,"Field-aware Calibration: A Simple and Empirically Strong Method for Reliable Probabilistic Predictions.",WWW,"Feiyang Pan,Xiang Ao,Pingzhong Tang,Min Lu,Dapeng Liu,Lei Xiao,Qing He 0003"
2020,"ResQueue: A Smarter Datacenter Flow Scheduler.",WWW,"Hamed Rezaei,Balajee Vamanan"
2018,"I'll Be Back: On the Multiple Lives of Users of a Mobile Activity Tracking Application.",WWW,"Zhiyuan Lin 0001,Tim Althoff,Jure Leskovec"
2016,"When do Recommender Systems Work the Best?: The Moderating Effects of Product Attributes and Consumer Reviews on Recommender Performance.",WWW,"Dokyun Lee,Kartik Hosanagar"
2009,"Is there anything worth finding on the semantic web?",WWW,"Harry Halpin"
2020,"Improved Touch-screen Inputting Using Sequence-level Prediction Generation.",WWW,"Xin Wang,Xu Li,Jinxing Yu,Mingming Sun,Ping Li 0001"
2019,"Learning Resolution Parameters for Graph Clustering.",WWW,"Nate Veldt,David F. Gleich,Anthony Wirth"
2020,"Efficient Online Multi-Task Learning via Adaptive Kernel Selection.",WWW,"Peng Yang,Ping Li 0001"
2020,"SMART-KG: Hybrid Shipping for SPARQL Querying on the Web.",WWW,"Amr Azzam,Javier D. Fernández,Maribel Acosta,Martin Beno,Axel Polleres"
2006,"Dynamic placement for clustered web applications.",WWW,"Alexei A. Karve,Tracy Kimbrel,Giovanni Pacifici,Mike Spreitzer,Malgorzata Steinder,Maxim Sviridenko,Asser N. Tantawi"
2009,"Combining global optimization with local selection for efficient QoS-aware service composition.",WWW,"Mohammad Alrifai,Thomas Risse 0001"
2015,"From "Selena Gomez" to "Marlon Brando": Understanding Explorative Entity Search.",WWW,"Iris Miliaraki,Roi Blanco,Mounia Lalmas"
2006,"SecuBat: a web vulnerability scanner.",WWW,"Stefan Kals,Engin Kirda,Christopher Krügel,Nenad Jovanovic"
2009,"A general framework for adaptive and online detection of web attacks.",WWW,"Wei Wang 0012,Florent Masseglia,Thomas Guyet,Rene Quiniou,Marie-Odile Cordier"
2012,"Collective context-aware topic models for entity disambiguation.",WWW,"Prithviraj Sen"
2018,"Me, My Echo Chamber, and I: Introspection on Social Media Polarization.",WWW,"Nabeel Gillani,Ann Yuan,Martin Saveski,Soroush Vosoughi,Deb Roy"
2011,"EP-SPARQL: a unified language for event processing and stream reasoning.",WWW,"Darko Anicic,Paul Fodor,Sebastian Rudolph,Nenad Stojanovic"
2018,"AdaError: An Adaptive Learning Rate Method for Matrix Approximation-based Collaborative Filtering.",WWW,"Dongsheng Li 0002,Chao Chen 0016,Qin Lv,Hansu Gu,Tun Lu,Li Shang,Ning Gu,Stephen M. Chu"
2015,"LN-Annote: An Alternative Approach to Information Extraction from Emails using Locally-Customized Named-Entity Recognition.",WWW,"YoungHoon Jung,Karl Stratos,Luca P. Carloni"
2012,"A habit mining approach for discovering similar mobile users.",WWW,"Haiping Ma,Huanhuan Cao,Qiang Yang 0001,Enhong Chen,Jilei Tian"
2017,"Collaborative Metric Learning.",WWW,"Cheng-Kang Hsieh,Longqi Yang,Yin Cui,Tsung-Yi Lin,Serge J. Belongie,Deborah Estrin"
2006,"Keynote talk.",WWW,"Richard Granger"
