2008,"Optimal marketing strategies over social networks.",WWW,"Jason D. Hartline,Vahab S. Mirrokni,Mukund Sundararajan"
2019,"Learning How to Correct a Knowledge Base from the Edit History.",WWW,"Thomas Pellissier Tanon,Camille Bourgaux,Fabian M. Suchanek"
2019,"CityFlow: A Multi-Agent Reinforcement Learning Environment for Large Scale City Traffic Scenario.",WWW,"Huichu Zhang,Siyuan Feng,Chang Liu 0021,Yaoyao Ding,Yichen Zhu,Zihan Zhou 0002,Weinan Zhang 0001,Yong Yu 0001,Haiming Jin,Zhenhui Li"
2005,"Shared lexicon for distributed annotations on the Web.",WWW,"Paolo Avesani,Marco Cova"
2005,"On the lack of typical behavior in the global Web traffic network.",WWW,"Mark R. Meiss,Filippo Menczer,Alessandro Vespignani"
2019,"Learning Intent to Book Metrics for Airbnb Search.",WWW,"Bradley C. Turnbull"
2008,"As we may perceive: finding the boundaries of compound documents on the web.",WWW,"Pavel Dmitriev"
2006,"Exploring social annotations for the semantic web.",WWW,"Xian Wu,Lei Zhang 0007,Yong Yu 0001"
2015,"When Does Improved Targeting Increase Revenue?",WWW,"Patrick Hummel,R. Preston McAfee"
2009,"Web 2.0: blind to an accessible new world.",WWW,"Joshua M. Hailpern,Loretta Guarino Reid,Richard Boardman,Srinivas Annam"
2019,"Modeling Relational Drug-Target-Disease Interactions via Tensor Factorization with Multiple Web Sources.",WWW,"Huiyuan Chen,Jing Li 0002"
2017,"Is Saki #delicious?: The Food Perception Gap on Instagram and Its Relation to Health.",WWW,"Ferda Ofli,Yusuf Aytar,Ingmar Weber,Raggi al Hammouri,Antonio Torralba 0001"
2019,"Sampled in Pairs and Driven by Text: A New Graph Embedding Framework.",WWW,"Liheng Chen,Yanru Qu,Zhenghui Wang,Lin Qiu,Weinan Zhang 0001,Ken Chen,Shaodian Zhang,Yong Yu 0001"
2010,"Shout out: integrating news and reader comments.",WWW,"Lisa M. Gandy,Nathan D. Nichols,Kristian J. Hammond"
2008,"Exploiting semantic web technologies to model web form interactions.",WWW,"Wolfgang Holzinger,Bernhard Krüpl,Robert Baumgartner"
2020,"Graph Attention Topic Modeling Network.",WWW,"Liang Yang 0002,Fan Wu,Junhua Gu,Chuan Wang,Xiaochun Cao,Di Jin,Yuanfang Guo"
2007,"On building graphs of documents with artificial ants.",WWW,"Hanane Azzag,Julien Lavergne,Christiane Guinot,Gilles Venturini"
2001,"A metro map metaphor for guided tours on the Web: the Webvise guided tour system.",WWW,"Elmer Sandvad,Kaj Grønbæk,Lennert Sloth,Jørgen Lindskov Knudsen"
2007,"Automatic search engine performance evaluation with click-through data analysis.",WWW,"Yiqun Liu 0001,Yupeng Fu,Min Zhang 0006,Shaoping Ma,Liyun Ru"
2020,"Mining Implicit Entity Preference from User-Item Interaction Data for Knowledge Graph Completion via Adversarial Learning.",WWW,"Gaole He,Junyi Li,Wayne Xin Zhao,Peiju Liu,Ji-Rong Wen"
2018,"Strategies for Geographical Scoping and Improving a Gazetteer.",WWW,"Sanket Kumar Singh,Davood Rafiei"
2006,"Learning and inferencing in user ontology for personalized semantic web services.",WWW,"Xing Jiang,Ah-Hwee Tan"
2001,"On representation of a highlight on the Web: the amber room as a cultural phenomenon in progress.",WWW,"Tatyana G. Bogomazova,Cyrill A. Malevanov"
2020,"Deep Adversarial Completion for Sparse Heterogeneous Information Network Embedding.",WWW,"Kai Zhao,Ting Bai,Bin Wu,Bai Wang,Youjie Zhang,Yuanyu Yang,Jian-Yun Nie"
2007,"Towards environment generated media: object-participation-type weblog in home sensor network.",WWW,"Takuya Maekawa,Yutaka Yanagisawa,Takeshi Okadome"
2005,"Design for verification for asynchronously communicating Web services.",WWW,"Aysu Betin-Can,Tevfik Bultan,Xiang Fu"
2018,"Provable and Practical Approximations for the Degree Distribution using Sublinear Graph Samples.",WWW,"Talya Eden,Shweta Jain 0003,Ali Pinar,Dana Ron,C. Seshadhri"
2016,"Dot Everyone!!: Power, the Internet and You.",WWW,"Martha Lane Fox"
2006,"Towards content trust of web resources.",WWW,"Yolanda Gil,Donovan Artz"
2018,"Mining Tours and Paths in Activity Networks.",WWW,"Sofia Maria Nikolakaki,Charalampos Mavroforakis,Alina Ene,Evimaria Terzi"
2014,"Organizing the digital world to empower people to do more, know more, and be more.",WWW,"Qi Lu"
2017,"Neural Network-based Question Answering over Knowledge Graphs on Word and Character Level.",WWW,"Denis Lukovnikov,Asja Fischer,Jens Lehmann 0001,Sören Auer"
2020,"Traffic Flow Prediction via Spatial Temporal Graph Neural Network.",WWW,"Xiaoyang Wang,Yao Ma 0001,Yiqi Wang,Wei Jin,Xin Wang,Jiliang Tang,Caiyan Jia,Jian Yu"
2019,"Click Feedback-Aware Query Recommendation Using Adversarial Examples.",WWW,"Ruirui Li,Liangda Li,Xian Wu,Yunhong Zhou,Wei Wang 0010"
2006,"Examining the content and privacy of web browsing incidental information.",WWW,"Kirstie Hawkey,Kori M. Inkpen"
2019,"Large-Scale Talent Flow Forecast with Dynamic Latent Factor Model?",WWW,"Le Zhang,Hengshu Zhu,Tong Xu,Chen Zhu,Chuan Qin 0002,Hui Xiong 0001,Enhong Chen"
2007,"A novel collaborative filtering-based framework for personalized services in m-commerce.",WWW,"Qiudan Li,Chunheng Wang,Guanggang Geng,Ruwei Dai"
2019,"Link Prediction in Networks with Core-Fringe Data.",WWW,"Austin R. Benson,Jon M. Kleinberg"
2010,"Trend detection model.",WWW,"Noriaki Kawamae,Ryuichiro Higashinaka"
2001,"Keys for XML.",WWW,"Peter Buneman,Susan B. Davidson,Wenfei Fan,Carmem S. Hara,Wang Chiew Tan"
2012,"Understanding and combating link farming in the twitter social network.",WWW,"Saptarshi Ghosh 0001,Bimal Viswanath,Farshad Kooti,Naveen Kumar Sharma,Gautam Korlam,Fabrício Benevenuto,Niloy Ganguly,P. Krishna Gummadi"
2018,"Find the Conversation Killers: A Predictive Study of Thread-ending Posts.",WWW,"Yunhao Jiao,Cheng Li 0012,Fei Wu 0001,Qiaozhu Mei"
2004,"Unsupervised learning of soft patterns for generating definitions from online news.",WWW,"Hang Cui,Min-Yen Kan,Tat-Seng Chua"
2019,"How Intention Informed Recommendations Modulate Choices: A Field Study of Spoken Word Content.",WWW,"Longqi Yang,Michael Sobolev,Yu Wang,Jenny Chen,Drew Dunne,Christina Tsangouri,Nicola Dell,Mor Naaman,Deborah Estrin"
2012,"Distributed graph pattern matching.",WWW,"Shuai Ma 0001,Yang Cao 0012,Jinpeng Huai,Tianyu Wo"
2006,"AutoTag: a collaborative approach to automated tag assignment for weblog posts.",WWW,"Gilad Mishne"
2009,"Crawling English-Japanese person-name transliterations from the web.",WWW,"Satoshi Sato"
2008,"Trust-based recommendation systems: an axiomatic approach.",WWW,"Reid Andersen,Christian Borgs,Jennifer T. Chayes,Uriel Feige,Abraham D. Flaxman,Adam Kalai,Vahab S. Mirrokni,Moshe Tennenholtz"
2016,"Winning Arguments: Interaction Dynamics and Persuasion Strategies in Good-faith Online Discussions.",WWW,"Chenhao Tan,Vlad Niculae,Cristian Danescu-Niculescu-Mizil,Lillian Lee"
2009,"Bootstrapped extraction of class attributes.",WWW,"Joseph Reisinger,Marius Pasca"
2006,"Semantic link based top-K join queries in P2P networks.",WWW,"Jie Liu,Liang Feng,Chao He"
2016,"The Case for Robotic Wireless Networks.",WWW,"Mahanth Gowda,Ashutosh Dhekne,Romit Roy Choudhury"
2007,"Causal relation of queries from temporal logs.",WWW,"Yizhou Sun,Kunqing Xie,Ning Liu 0001,Shuicheng Yan,Benyu Zhang,Zheng Chen 0001"
2008,"Incremental web page template detection.",WWW,"Yu Wang 0009,Binxing Fang,Xueqi Cheng,Li Guo 0001,Hongbo Xu"
2020,"Designing Fairly Fair Classifiers Via Economic Fairness Notions.",WWW,"Safwan Hossain,Andjela Mladenovic,Nisarg Shah 0001"
2016,"Entity Disambiguation with Linkless Knowledge Bases.",WWW,"Yang Li,Shulong Tan,Huan Sun,Jiawei Han 0001,Dan Roth,Xifeng Yan"
2009,"Combining anchor text categorization and graph analysis for paid link detection.",WWW,"Kirill Nikolaev 0002,Ekaterina Zudina,Andrey Gorshkov"
2013,"Is this app safe for children?: a comparison study of maturity ratings on Android and iOS applications.",WWW,"Ying Chen,Heng Xu,Yilu Zhou,Sencun Zhu"
2016,"Linking Users Across Domains with Location Data: Theory and Validation.",WWW,"Christopher J. Riederer,Yunsung Kim,Augustin Chaintreau,Nitish Korula,Silvio Lattanzi"
2008,"Falcons: searching and browsing entities on the semantic web.",WWW,"Gong Cheng 0001,Weiyi Ge,Yuzhong Qu"
2005,"Static approximation of dynamically generated Web pages.",WWW,"Yasuhiko Minamide"
2016,"Tweet Properly: Analyzing Deleted Tweets to Understand and Identify Regrettable Ones.",WWW,"Lu Zhou,Wenbo Wang 0002,Keke Chen"
2017,"Neural Underpinnings of Website Legitimacy and Familiarity Detection: An fNIRS Study.",WWW,"Ajaya Neupane,Nitesh Saxena,Leanne M. Hirshfield"
2013,"From cookies to cooks: insights on dietary patterns via analysis of web usage logs.",WWW,"Robert West 0001,Ryen W. White,Eric Horvitz"
2006,"Selective early request termination for busy internet services.",WWW,"Jingyu Zhou,Tao Yang 0009"
2003,"Peer-to-peer architecture for content-based music retrieval on acoustic data.",WWW,"Cheng Yang"
2010,"Tracking the random surfer: empirically measured teleportation parameters in PageRank.",WWW,"David F. Gleich,Paul G. Constantine,Abraham D. Flaxman,Asela Gunawardana"
2018,"Adaptive Sensitive Reweighting to Mitigate Bias in Fairness-aware Classification.",WWW,"Emmanouil Krasanakis,Eleftherios Spyromitros Xioufis,Symeon Papadopoulos,Yiannis Kompatsiaris"
2019,"Choosing to Grow a Graph: Modeling Network Formation as Discrete Choice.",WWW,"Jan Overgoor,Austin R. Benson,Johan Ugander"
2008,"Validating the use and role of visual elements of web pages in navigation with an eye-tracking study.",WWW,"Yeliz Yesilada,Caroline Jay,Robert Stevens 0001,Simon Harper"
2009,"Building term suggestion relational graphs from collective intelligence.",WWW,"Jyh-Ren Shieh,Yung-Huan Hsieh,Yang-Ting Yeh,Tse-Chung Su,Ching-Yung Lin,Ja-Ling Wu"
2015,"Events and Controversies: Influences of a Shocking News Event on Information Seeking.",WWW,"Danai Koutra,Paul N. Bennett,Eric Horvitz"
2018,"Modeling Success and Engagement for the App Economy.",WWW,"Haim Mendelson,Ken Moon"
2019,"Inferring Search Queries from Web Documents via a Graph-Augmented Sequence to Attention Network.",WWW,"Fred X. Han,Di Niu,Kunfeng Lai,Weidong Guo,Yancheng He,Yu Xu"
2004,"Mining models of human activities from the web.",WWW,"Mike Perkowitz,Matthai Philipose,Kenneth P. Fishkin,Donald J. Patterson"
2017,"Regions, Periods, Activities: Uncovering Urban Dynamics via Cross-Modal Representation Learning.",WWW,"Chao Zhang 0014,Keyang Zhang,Quan Yuan 0001,Haoruo Peng,Yu Zheng 0004,Tim Hanratty,Shaowen Wang,Jiawei Han 0001"
2019,"Nonlinear Diffusion for Community Detection and Semi-Supervised Learning.",WWW,"Rania Ibrahim,David F. Gleich"
2007,"Spam and popularity ratings for combating link spam.",WWW,"Mukesh Dalal"
2010,"Reining in the web with content security policy.",WWW,"Sid Stamm,Brandon Sterne,Gervase Markham"
2010,"A pattern tree-based approach to learning URL normalization rules.",WWW,"Tao Lei,Rui Cai,Jiang-Ming Yang,Yan Ke,Xiaodong Fan,Lei Zhang 0001"
2019,"Genre Differences of Song Lyrics and Artist Wikis: An Analysis of Popularity, Length, Repetitiveness, and Readability.",WWW,"Markus Schedl"
2003,"Modeling redirection in geographically diverse server sets.",WWW,"Lisa Amini,Anees Shaikh,Henning Schulzrinne"
2014,"Effective named entity recognition for idiosyncratic web collections.",WWW,"Roman Prokofyev,Gianluca Demartini,Philippe Cudré-Mauroux"
2007,"Query topic detection for reformulation.",WWW,"Xuefeng He,Jun Yan 0001,Jinwen Ma,Ning Liu 0001,Zheng Chen 0001"
2007,"Page-level template detection via isotonic smoothing.",WWW,"Deepayan Chakrabarti,Ravi Kumar 0001,Kunal Punera"
2020,"Apophanies or Epiphanies? How Crawlers Impact Our Understanding of the Web.",WWW,"Syed Suleman Ahmad,Muhammad Daniyal Dar,Muhammad Fareed Zaffar,Narseo Vallina-Rodriguez,Rishab Nithyanand"
2020,"Multi-Objective Ranking Optimization for Product Search Using Stochastic Label Aggregation.",WWW,"David Carmel,Elad Haramaty,Arnon Lazerson,Liane Lewin-Eytan"
2008,"Restful web services vs. "big"' web services: making the right architectural decision.",WWW,"Cesare Pautasso,Olaf Zimmermann,Frank Leymann"
2007,"Robust methodologies for modeling web click distributions.",WWW,"Kamal Ali,Mark Scarr"
2010,"Hierarchical feature selection for ranking.",WWW,"Guichun Hua,Min Zhang 0006,Yiqun Liu 0001,Shaoping Ma,Liyun Ru"
2013,"A CRM system for social media: challenges and experiences.",WWW,"Jitendra Ajmera,Hyung-Il Ahn,Meena Nagarajan,Ashish Verma,Danish Contractor,Stephen Dill,Matthew Denesuk"
2009,"Extracting community structure through relational hypergraphs.",WWW,"Yu-Ru Lin,Jimeng Sun,Paul C. Castro,Ravi B. Konuru,Hari Sundaram,Aisling Kelliher"
2010,"Document recommendation in social tagging services.",WWW,"Ziyu Guan,Can Wang 0001,Jiajun Bu,Chun Chen 0001,Kun Yang,Deng Cai 0001,Xiaofei He 0001"
2020,"Natural Key Discovery in Wikipedia Tables.",WWW,"Leon Bornemann,Tobias Bleifuß,Dmitri V. Kalashnikov,Felix Naumann,Divesh Srivastava"
2020,"Asking Questions the Human Way: Scalable Question-Answer Generation from Text Corpus.",WWW,"Bang Liu,Haojie Wei,Di Niu,Haolan Chen,Yancheng He"
2019,"Understanding Reader Backtracking Behavior in Online News Articles.",WWW,"Uzi Smadja,Max Grusky,Yoav Artzi,Mor Naaman"
2005,"A convenient method for securely managing passwords.",WWW,"J. Alex Halderman,Brent Waters,Edward W. Felten"
2010,"Facetedpedia: dynamic generation of query-dependent faceted interfaces for wikipedia.",WWW,"Chengkai Li,Ning Yan,Senjuti Basu Roy,Lekhendro Lisham,Gautam Das 0001"
2003,"Quality driven web services composition.",WWW,"Liangzhao Zeng,Boualem Benatallah,Marlon Dumas,Jayant Kalagnanam,Quan Z. Sheng"
2018,"A Cross-Platform Consumer Behavior Analysis of Large-Scale Mobile Shopping Data.",WWW,"Hong Huang 0001,Bo Zhao 0016,Hao Zhao,Zhou Zhuang,Zhenxuan Wang,Xiaoming Yao,Xinggang Wang,Hai Jin 0001,Xiaoming Fu 0001"
2019,"Dynamic Ensemble of Contextual Bandits to Satisfy Users' Changing Interests.",WWW,"Qingyun Wu,Huazheng Wang,Yanen Li,Hongning Wang"
2005,"Learning domain ontologies for Web service descriptions: an experiment in bioinformatics.",WWW,"Marta Sabou,Chris Wroe,Carole A. Goble,Gilad Mishne"
2019,"Learning Fast Matching Models from Weak Annotations.",WWW,"Xue Li,Zhipeng Luo,Hao Sun,Jianjin Zhang,Weihao Han,Xianqi Chu,Liangjie Zhang,Qi Zhang"
2014,"Recommending investors for crowdfunding projects.",WWW,"Jisun An,Daniele Quercia,Jon Crowcroft"
2009,"Towards context-aware search by learning a very large variable length hidden markov model from search logs.",WWW,"Huanhuan Cao,Daxin Jiang,Jian Pei,Enhong Chen,Hang Li 0001"
2019,"Detecting Low Self-Esteem in Youths from Web Search Data.",WWW,"Anis Zaman,Rupam Acharyya,Henry A. Kautz,Vincent Silenzio"
2005,"G-ToPSS: fast filtering of graph-based metadata.",WWW,"Milenko Petrovic,Haifeng Liu,Hans-Arno Jacobsen"
2006,"Determining user interests about museum collections.",WWW,"Lloyd Rutledge,Lora Aroyo,Natalia Stash"
2012,"Structured query suggestion for specialization and parallel movement: effect on search behaviors.",WWW,"Makoto P. Kato,Tetsuya Sakai,Katsumi Tanaka"
2013,"Distributed large-scale natural graph factorization.",WWW,"Amr Ahmed,Nino Shervashidze,Shravan M. Narayanamurthy,Vanja Josifovski,Alexander J. Smola"
2018,"Co-Regularized Deep Multi-Network Embedding.",WWW,"Jingchao Ni,Shiyu Chang,Xiao Liu,Wei Cheng 0002,Haifeng Chen,Dongkuan Xu,Xiang Zhang 0001"
2006,"Verifying genre-based clustering approach to content extraction.",WWW,"Suhit Gupta,Hila Becker,Gail E. Kaiser,Salvatore J. Stolfo"
2010,"Do you want to take notes?: identifying research missions in Yahoo! search pad.",WWW,"Debora Donato,Francesco Bonchi,Tom Chi,Yoëlle S. Maarek"
2008,"A framework for fast community extraction of large-scale networks.",WWW,"Yutaka I. Leon-Suematsu,Kikuo Yuta"
2014,"Quizz: targeted crowdsourcing with a billion (potential) users.",WWW,"Panagiotis G. Ipeirotis,Evgeniy Gabrilovich"
2001,"Mixed-initiative, multi-source information assistants.",WWW,"Craig A. Knoblock,Steven Minton,José Luis Ambite,Maria Muslea,Jean Oh,Martin Frank"
2017,"Explicit Semantic Ranking for Academic Search via Knowledge Graph Embedding.",WWW,"Chenyan Xiong,Russell Power,Jamie Callan"
2007,"Mirror site maintenance based on evolution associations of web directories.",WWW,"Ling Chen 0002,Sourav S. Bhowmick,Wolfgang Nejdl"
2013,"Predicting advertiser bidding behaviors in sponsored search by rationality modeling.",WWW,"Haifeng Xu,Bin Gao 0001,Diyi Yang,Tie-Yan Liu"
2003,"Design, implementation, and evaluation of a client characterization driven web server.",WWW,"Balachander Krishnamurthy,Yin Zhang,Craig E. Wills,Kashi Venkatesh Vishwanath"
2019,"Distributed Algorithms for Fully Personalized PageRank on Large Graphs.",WWW,"Wenqing Lin"
2019,"Using Variability as a Guiding Principle to Reduce Latency in Web Applications via OS Profiling.",WWW,"Amoghavarsha Suresh,Anshul Gandhi"
2008,"Mining for personal name aliases on the web.",WWW,"Danushka Bollegala,Taiki Honma,Yutaka Matsuo,Mitsuru Ishizuka"
2001,"A component model for stardardized web-based education.",WWW,"Luis E. Anido-Rifón,Martín Llamas Nistal,Manuel J. Fernández Iglesias"
2007,"Supporting end-users in the creation of dependable web clips.",WWW,"Sandeep Lingam,Sebastian G. Elbaum"
2018,"Dual Graph Convolutional Networks for Graph-Based Semi-Supervised Classification.",WWW,"Chenyi Zhuang,Qiang Ma 0001"
2006,"Off the beaten tracks: exploring three aspects of web navigation.",WWW,"Harald Weinreich,Hartmut Obendorf,Eelco Herder,Matthias Mayer"
2008,"Information retrieval and knowledge discovery on the semantic web of traditional chinese medicine.",WWW,"Zhaohui Wu 0001,Tong Yu 0003,Huajun Chen,Xiaohong Jiang,Yi Feng 0004,Yuxin Mao,Heng Wang,Jingming Tang,Chunying Zhou"
2019,"Semi-Supervised Graph Classification: A Hierarchical Graph Perspective.",WWW,"Jia Li,Yu Rong,Hong Cheng 0001,Helen Meng,Wen-bing Huang,Junzhou Huang"
2019,"Semi-Supervised Entity Alignment via Knowledge Graph Embedding with Awareness of Degree Difference.",WWW,"Shichao Pei,Lu Yu 0006,Robert Hoehndorf,Xiangliang Zhang 0001"
2008,"Fast algorithms for topk personalized pagerank queries.",WWW,"Manish S. Gupta,Amit Pathak,Soumen Chakrabarti"
2019,"Spectrum-enhanced Pairwise Learning to Rank.",WWW,"Wenhui Yu,Zheng Qin"
2003,"A large-scale study of the evolution of web pages.",WWW,"Dennis Fetterly,Mark S. Manasse,Marc Najork,Janet L. Wiener"
2020,"Towards IP-based Geolocation via Fine-grained and Stable Webcam Landmarks.",WWW,"Zhihao Wang,Qiang Li 0007,Jinke Song,Haining Wang,Limin Sun"
2006,"Browsing on small screens: recasting web-page segmentation into an efficient machine learning framework.",WWW,"Shumeet Baluja"
2019,"Self- and Cross-Excitation in Stack Exchange Question & Answer Communities.",WWW,"Tiago Santos,Simon Walk,Roman Kern,Markus Strohmaier,Denis Helic"
2006,"Topic-oriented query expansion for web search.",WWW,"Shao-Chi Wang,Yuzuru Tanaka"
2020,"Higher-Order Label Homogeneity and Spreading in Graphs.",WWW,"Dhivya Eswaran,Srijan Kumar,Christos Faloutsos"
2008,"Finding the right facts in the crowd: factoid question answering over social media.",WWW,"Jiang Bian,Yandong Liu,Eugene Agichtein,Hongyuan Zha"
2019,"Who Watches the Watchmen: Exploring Complaints on the Web.",WWW,"Damilola Ibosiola,Ignacio Castro,Gianluca Stringhini,Steve Uhlig,Gareth Tyson"
2008,"A unified framework for name disambiguation.",WWW,"Jie Tang 0001,Jing Zhang 0001,Duo Zhang 0001,Juanzi Li"
2017,"Understanding and Discovering Deliberate Self-harm Content in Social Media.",WWW,"Yilin Wang,Jiliang Tang,Jundong Li,Baoxin Li,Yali Wan,Clayton Mellina,Neil O'Hare,Yi Chang 0001"
2015,"PriVaricator: Deceiving Fingerprinters with Little White Lies.",WWW,"Nick Nikiforakis,Wouter Joosen,Benjamin Livshits"
2007,"Why we search: visualizing and predicting user behavior.",WWW,"Eytan Adar,Daniel S. Weld,Brian N. Bershad,Steven D. Gribble"
2013,"Inferring the demographics of search users: social data meets search queries.",WWW,"Bin Bi,Milad Shokouhi,Michal Kosinski,Thore Graepel"
2009,"A densitometric analysis of web template content.",WWW,"Christian Kohlschütter"
2019,"Learning Task-Specific City Region Partition.",WWW,"Hongjian Wang 0002,Porter Jenkins,Hua Wei 0001,Fei Wu 0007,Zhenhui Li"
2009,"Relationalizing RDF stores for tools reusability.",WWW,"Sunitha Ramanujam,Anubha Gupta,Latifur Khan,Steven Seida,Bhavani M. Thuraisingham"
2018,"Are All People Married?: Determining Obligatory Attributes in Knowledge Bases.",WWW,"Jonathan Lajus,Fabian M. Suchanek"
2020,"Patient-Trial Matching with Deep Embedding and Entailment Prediction.",WWW,"Xingyao Zhang,Cao Xiao,Lucas Glass,Jimeng Sun"
2017,"GSP: The Cinderella of Mechanism Design.",WWW,"Christopher A. Wilkens,Ruggiero Cavallo,Rad Niazadeh"
2020,"Sampling Query Variations for Learning to Rank to Improve Automatic Boolean Query Generation in Systematic Reviews.",WWW,"Harrisen Scells,Guido Zuccon,Mohamed A. Sharaf,Bevan Koopman"
2015,"A Weighted Correlation Index for Rankings with Ties.",WWW,"Sebastiano Vigna"
2020,"Clustering in graphs and hypergraphs with categorical edge labels.",WWW,"Ilya Amburg,Nate Veldt,Austin R. Benson"
2018,"Hiding in the Crowd: an Analysis of the Effectiveness of Browser Fingerprinting at Large Scale.",WWW,"Alejandro Gómez-Boix,Pierre Laperdrix,Benoit Baudry"
2020,"Weakly Supervised Attention for Hashtag Recommendation using Graph Data.",WWW,"Amin Javari,Zhankui He,Zijie Huang,Jeetu Raj,Kevin Chen-Chuan Chang"
2007,"Building and managing personalized semantic portals.",WWW,"Melike Sah,Wendy Hall"
2009,"Anycast-aware transport for content delivery networks.",WWW,"Zakaria Al-Qudah,Seungjoon Lee,Michael Rabinovich,Oliver Spatscheck,Jacobus E. van der Merwe"
2015,"Mining Missing Hyperlinks from Human Navigation Traces: A Case Study of Wikipedia.",WWW,"Robert West 0001,Ashwin Paranjape,Jure Leskovec"
2007,"A framework for rapid integration of presentation components.",WWW,"Jin Yu 0006,Boualem Benatallah,Régis Saint-Paul,Fabio Casati,Florian Daniel,Maristella Matera"
2020,"Next Point-of-Interest Recommendation on Resource-Constrained Mobile Devices.",WWW,"Qinyong Wang,Hongzhi Yin,Tong Chen 0005,Zi Huang,Hao Wang 0005,Yanchang Zhao,Nguyen Quoc Viet Hung"
2010,"Hearsay: a new generation context-driven multi-modal assistive web browser.",WWW,"Yevgen Borodin,Faisal Ahmed 0001,Muhammad Asiful Islam,Yury Puzis,Valentyn Melnyk,Song Feng,I. V. Ramakrishnan,Glenn Dausch"
2006,"HTML2RSS: automatic generation of RSS feed based on structure analysis of HTML document.",WWW,"Tomoyuki Nanno,Manabu Okumura"
2019,"TableNet: An Approach for Determining Fine-grained Relations for Wikipedia Tables.",WWW,"Besnik Fetahu,Avishek Anand,Maria Koutraki"
2008,"Xml data dissemination using automata on top of structured overlay networks.",WWW,"Iris Miliaraki,Zoi Kaoudi,Manolis Koubarakis"
2008,"Improving personalized services in mobile commerce by a novel multicriteria rating approach.",WWW,"Qiudan Li,Chunheng Wang,Guanggang Geng"
2017,"The Demographics of Mail Search and their Application to Query Suggestion.",WWW,"David Carmel,Liane Lewin-Eytan,Alex Libov,Yoelle Maarek,Ariel Raviv"
2006,"Towards DSL-based web engineering.",WWW,"Martin Nussbaumer,Patrick Freudenstein,Martin Gaedke"
2010,"Learning based access control in online social networks.",WWW,"Mohamed Shehab,Gorrell P. Cheek,Hakim Touati,Anna Cinzia Squicciarini,Pau-Chen Cheng"
2016,"Abusive Language Detection in Online User Content.",WWW,"Chikashi Nobata,Joel R. Tetreault,Achint Thomas,Yashar Mehdad,Yi Chang 0001"
2009,"A measurement-driven analysis of information propagation in the flickr social network.",WWW,"Meeyoung Cha,Alan Mislove,P. Krishna Gummadi"
2015,"Automatic Online Evaluation of Intelligent Assistants.",WWW,"Jiepu Jiang,Ahmed Hassan Awadallah,Rosie Jones,Umut Ozertem,Imed Zitouni,Ranjitha Gurunath Kulkarni,Omar Zia Khan"
2012,"Online team formation in social networks.",WWW,"Aris Anagnostopoulos,Luca Becchetti,Carlos Castillo 0001,Aristides Gionis,Stefano Leonardi"
2002,"XL: an XML programming language for web service specification and composition.",WWW,"Daniela Florescu,Andreas Grünhagen,Donald Kossmann"
2011,"Context-sensitive query auto-completion.",WWW,"Ziv Bar-Yossef,Naama Kraus"
2017,"Do "Also-Viewed" Products Help User Rating Prediction?",WWW,"Chanyoung Park,Dong Hyun Kim,Jinoh Oh,Hwanjo Yu"
2014,"Exploring the filter bubble: the effect of using recommender systems on content diversity.",WWW,"Tien T. Nguyen,Pik-Mai Hui,F. Maxwell Harper,Loren G. Terveen,Joseph A. Konstan"
2010,"Multi-modality in one-class classification.",WWW,"Matthijs Hovelynck,Boris Chidlovskii"
2013,"Interactive exploratory search for multi page search results.",WWW,"Xiaoran Jin,Marc Sloan,Jun Wang 0012"
2009,"Purely URL-based topic classification.",WWW,"Eda Baykan,Monika Rauch Henzinger,Ludmila Marian,Ingmar Weber"
2008,"A generic framework for collaborative multi-perspective ontology acquisition.",WWW,"Maayan Zhitomirsky-Geffet,Judit Bar-Ilan,Yitzchak Miller,Snunith Shoham"
2015,"The K-clique Densest Subgraph Problem.",WWW,"Charalampos E. Tsourakakis"
2014,"Engaging with massive online courses.",WWW,"Ashton Anderson,Daniel P. Huttenlocher,Jon M. Kleinberg,Jure Leskovec"
2005,"WEESA: Web engineering for semantic Web applications.",WWW,"Gerald Reif,Harald C. Gall,Mehdi Jazayeri"
2003,"Improving pseudo-relevance feedback in web information retrieval using web page segmentation.",WWW,"Shipeng Yu,Deng Cai 0001,Ji-Rong Wen,Wei-Ying Ma"
2017,"Leveraging Large Amounts of Weakly Supervised Data for Multi-Language Sentiment Classification.",WWW,"Jan Deriu,Aurélien Lucchi,Valeria De Luca,Aliaksei Severyn,Simon Müller,Mark Cieliebak,Thomas Hofmann,Martin Jaggi"
2020,"Bursts of Activity: Temporal Patterns of Help-Seeking and Support in Online Mental Health Forums.",WWW,"Taisa Kushner,Amit Sharma"
2019,"Tracy: Tracing Facts over Knowledge Graphs and Text.",WWW,"Mohamed H. Gad-Elrab,Daria Stepanova 0001,Jacopo Urbani,Gerhard Weikum"
2018,"Facebook (A)Live?: Are Live Social Broadcasts Really ",WWW,"Aravindh Raman,Gareth Tyson,Nishanth Sastry"
