2016,"Distinguishing between Topical and Non-Topical Information Diffusion Mechanisms in Social Media.",ICWSM,"Przemyslaw A. Grabowicz,Niloy Ganguly,Krishna P. Gummadi"
2017,"Online Human-Bot Interactions: Detection, Estimation, and Characterization.",ICWSM,"Onur Varol,Emilio Ferrara,Clayton A. Davis,Filippo Menczer,Alessandro Flammini"
2012,"On the Study of Diurnal Urban Routines on Twitter.",ICWSM,"Mor Naaman,Amy X. Zhang,Samuel Brody,Gilad Lotan"
2008,"StoryUpgrade: Finding Stories in Internet Weblogs.",ICWSM,"Andrew S. Gordon,Reid Swanson"
2009,"I Think You Know Who I Am: Bloggers' Perceived Identifiability.",ICWSM,"Chyng-Yang Jang,Michael Stefanone"
2020,"Gravity of Location-Based Service: Analyzing the Effects for Mobility Pattern and Location Prediction.",ICWSM,"Keiichi Ochiai,Yusuke Fukazawa,Wataru Yamada,Hiroyuki Manabe,Yutaka Matsuo"
2020,"Gossip and Attend: Context-Sensitive Graph Representation Learning.",ICWSM,"Zekarias T. Kefato,Sarunas Girdzijauskas"
2010,"Tweeting from the Town Square: Measuring Geographic Local Networks.",ICWSM,"Sarita Yardi,danah boyd"
2012,"Identifying Microblogs for Targeted Contextual Advertising.",ICWSM,"Kushal Shailesh Dave,Vasudeva Varma"
2014,"Gender Asymmetries in Reality and Fiction: The Bechdel Test of Social Media.",ICWSM,"David García 0001,Ingmar Weber,Venkata Rama Kiran Garimella"
2014,"Users Joining Multiple Sites: Distributions and Patterns.",ICWSM,"Reza Zafarani,Huan Liu 0001"
2016,"Understanding Cognitive Styles from User-Generated Social Media Content.",ICWSM,"Yi Wang,Jalal Mahmud,Taikun Liu"
2018,"Mobilizing the Trump Train: Understanding Collective Action in a Political Trolling Community.",ICWSM,"Claudia Flores-Saviaga,Brian C. Keegan,Saiph Savage"
2018,"EviDense: A Graph-Based Method for Finding Unique High-Impact Events with Succinct Keyword-Based Descriptions.",ICWSM,"Oana Balalau,Carlos Castillo 0001,Mauro Sozio"
2014,"Identifying and Analyzing Moral Evaluation Frames in Climate Change Blog Discourse.",ICWSM,"Nicholas Diakopoulos,Amy X. Zhang,Dag Elgesem,Andrew Salway"
2018,"DeepCredit: Exploiting User Cickstream for Loan Risk Prediction in P2P Lending.",ICWSM,"Zhi Yang 0001,Yusi Zhang,Binghui Guo,Ben Y. Zhao,Yafei Dai"
2011,"The Prevalence of Political Discourse in Non-Political Blogs.",ICWSM,"Sean A. Munson,Paul Resnick"
2011,"RT to Win! Predicting Message Propagation in Twitter.",ICWSM,"Sasa Petrovic,Miles Osborne,Victor Lavrenko"
2020,"Toward a Better Performance Evaluation Framework for Fake News Classification.",ICWSM,"Lia Bozarth,Ceren Budak"
2011,""Dancing with the Stars, " NBA Games, Politics: An Exploration of Twitter Users' Response to Events.",ICWSM,"Ana-Maria Popescu,Marco Pennacchiotti"
2011,"A Bootstrapping Approach to Identifying Relevant Tweets for Social TV.",ICWSM,"Ovidiu Dan,Junlan Feng,Brian D. Davison 0001"
2007,"TagAssist: Automatic Tag Suggestion for Blog Posts.",ICWSM,"Sanjay Sood,Sara Owsley,Kristian J. Hammond,Larry Birnbaum"
2010,"What's Worthy of Comment? Content and Comment Volume in Political Blogs.",ICWSM,"Tae Yano,Noah A. Smith"
2020,"Characterizing Variation in Toxic Language by Social Context.",ICWSM,"Bahar Radfar,Karthik Shivaram,Aron Culotta"
2017,"Gendered Conversation in a Social Game-Streaming Platform.",ICWSM,"Supun Chathuranga Nakandala"
2016,"Power of Earned Advertising on Social Network Services: A Case Study of Friend Tagging on Facebook.",ICWSM,"Jaimie Yejean Park,Yunkyu Sohn,Sue Moon"
2017,"The Rich Get Richer? Limited Learning in Charitable Giving on donorschoose.org.",ICWSM,"Chankyung Pak,Rick Wash"
2011,"Two Paths of Glory - Structural Positions and Trajectories of Websites within Their Topical Territory.",ICWSM,"Dominique Cardon,Guilhem Fouetillou,Camille Roth"
2017,"Detecting Socio-Economic Impact of Cultural Investment Through Geo-Social Network Analysis.",ICWSM,"Xiao Zhou,Desislava Hristova,Anastasios Noulas,Cecilia Mascolo"
2018,"From the User to the Medium: Neural Profiling Across Web Communities.",ICWSM,"Mohammad Akbari,Kunal Relia,Anas Elghafari,Rumi Chunara"
2020,"Aggressive, Repetitive, Intentional, Visible, and Imbalanced: Refining Representations for Cyberbullying Classification.",ICWSM,"Caleb Ziems,Ymir Vigfusson,Fred Morstatter"
2012,"Where Online Friends Meet: Social Communities in Location-Based Networks.",ICWSM,"Chloë Brown,Vincenzo Nicosia,Salvatore Scellato,Anastasios Noulas,Cecilia Mascolo"
2015,"Multilayer Brokerage in Geo-Social Networks.",ICWSM,"Desislava Hristova,Pietro Panzarasa,Cecilia Mascolo"
2007,"Modeling Trust and Influence in the Blogosphere Using Link Polarity.",ICWSM,"Anubhav Kale,Amit Karandikar,Pranam Kolari,Akshay Java,Tim Finin,Anupam Joshi"
2010,"Predicting the Speed, Scale, and Range of Information Diffusion in Twitter.",ICWSM,"Jiang Yang,Scott Counts"
2013,"Local Knowledge Matters for Crowdsourcing Systems: Experience from Transferring an American Site to China.",ICWSM,"Fernando Torre,Yanjie Liu,Zhengjie Liu,Loren G. Terveen"
2017,"A Computational Approach to Perceived Trustworthiness of Airbnb Host Profiles.",ICWSM,"Xiao Ma,Trishala Neeraj,Mor Naaman"
2011,"Modelling Action Cascades in Social Networks.",ICWSM,"Kushal Shailesh Dave,Rushi Bhatt,Vasudeva Varma"
2007,"Understanding Sentiment of People from News Articles: Temporal Sentiment Analysis of Social Events.",ICWSM,"Tomohiro Fukuhara,Hiroshi Nakagawa,Toyoaki Nishida"
2020,"Source Attribution: Recovering the Press Releases Behind Health Science News.",ICWSM,"Ansel MacLaughlin,John Wihbey,Aleszu Bajak,David A. Smith"
2012,"Network Analysis of Recurring YouTube Spam Campaigns.",ICWSM,"Derek O'Callaghan,Martin Harrigan,Joe Carthy,Pádraig Cunningham"
2017,"How Fast Will You Get a Response? Predicting Interval Time for Reciprocal Link Creation.",ICWSM,"Vachik S. Dave,Mohammad Al Hasan,Chandan K. Reddy"
2008,"Exploring Social Media Scenarios for the Television.",ICWSM,"Noor F. Ali-Hasan"
2009,"A Comparative Analysis of Trust-Enhanced Recommenders for Controversial Items.",ICWSM,"Patricia Victor,Chris Cornelis,Martine De Cock,Ankur Teredesai"
2012,"Facebook and Privacy: The Balancing Act of Personality, Gender, and Relationship Currency.",ICWSM,"Daniele Quercia,Diego B. Las Casas,João Paulo Pesce,David Stillwell,Michal Kosinski,Virgílio A. F. Almeida,Jon Crowcroft"
2014,"Get Back! You Don't Know Me Like That: The Social Mediation of Fact Checking Interventions in Twitter Conversations.",ICWSM,"Aniko Hannak,Drew Margolin,Brian Keegan,Ingmar Weber"
2017,"The Power of the Patient Voice: Learning Indicators of Treatment Adherence From An Online Breast Cancer Forum.",ICWSM,"Zhijun Yin,Bradley A. Malin,Jeremy L. Warner,Pei-Yun Sabrina Hsueh,Ching-Hua Chen"
2018,"Anatomy of Online Hate: Developing a Taxonomy and Machine Learning Models for Identifying and Classifying Hate in Online News Media.",ICWSM,"Joni Salminen,Hind Almerekhi,Milica Milenkovic,Soon-Gyo Jung,Jisun An,Haewoon Kwak,Bernard J. Jansen"
2010,"Governance in Social Media: A Case Study of the Wikipedia Promotion Process.",ICWSM,"Jure Leskovec,Daniel P. Huttenlocher,Jon M. Kleinberg"
2016,"Precise Localization of Homes and Activities: Detecting Drinking-While-Tweeting Patterns in Communities.",ICWSM,"Nabil Hossain,Tianran Hu,Roghayeh Feizi,Ann Marie White,Jiebo Luo,Henry A. Kautz"
2017,"Should We Be Confident in Peer Effects Estimated From Social Network Crawls?",ICWSM,"Jiasen Yang,Bruno Ribeiro 0001,Jennifer Neville"
2008,"Thin Slices of Online Profile Attributes.",ICWSM,"Kristin Brooke Stecher,Scott Counts"
2015,"Misalignment Between Supply and Demand of Quality Content in Peer Production Communities.",ICWSM,"Morten Warncke-Wang,Vivek Ranjan,Loren G. Terveen,Brent J. Hecht"
2018,"BuzzFace: A News Veracity Dataset with Facebook User Commentary and Egos.",ICWSM,"Giovanni C. Santia,Jake Ryland Williams"
2017,"On Quitting: Performance and Practice in Online Game Play.",ICWSM,"Tushar Agarwal,Keith Burghardt,Kristina Lerman"
2010,"Classifier Calibration for Multi-Domain Sentiment Classification.",ICWSM,"Stephan Raaijmakers,Wessel Kraaij"
2018,"Predicting PISA Scores from Students' Digital Traces.",ICWSM,"Ivan Smirnov"
2017,"Online Popularity Under Promotion: Viral Potential, Forecasting, and the Economics of Time.",ICWSM,"Marian-Andrei Rizoiu,Lexing Xie"
2013,"Measuring and Summarizing Movement in Microblog Postings.",ICWSM,"Eduardo J. Ruiz,Vagelis Hristidis,Carlos Castillo 0001,Aristides Gionis"
2007,"Sentiment Mining and Indexing in Opinmind.",ICWSM,"I-Heng Mei,Hongcheng Mi,Julius Quiaot"
2012,"On the Study of Social Interactions in Twitter.",ICWSM,"Sofus A. Macskassy"
2013,"What's in a Name? Understanding the Interplay between Titles, Content, and Communities in Social Media.",ICWSM,"Himabindu Lakkaraju,Julian J. McAuley,Jure Leskovec"
2009,"Connecting Corresponding Identities across Communities.",ICWSM,"Reza Zafarani,Huan Liu 0001"
2013,"Towards Supporting Search over Trending Events with Social Media.",ICWSM,"Sanjay Ram Kairam,Meredith Ringel Morris,Jaime Teevan,Daniel J. Liebling,Susan T. Dumais"
2017,"Spam Users Identification in Wikipedia Via Editing Behavior.",ICWSM,"Thomas Green,Francesca Spezzano"
2014,"CrisisLex: A Lexicon for Collecting and Filtering Microblogged Communications in Crises.",ICWSM,"Alexandra Olteanu,Carlos Castillo 0001,Fernando Diaz 0001,Sarah Vieweg"
2008,"Extraction of Topical Consumer Products from Weblogs.",ICWSM,"Shinichi Nagano,Masumi Inaba,Yumiko Mizoguchi,Takahiro Kawamura"
2017,"Designing a Social Support System for College Adjustment and Social Support.",ICWSM,"Donghee Yvette Wohn,Mousa Ahmadi,Leiping Gong,Indraneel Kulkarni,Atisha Poojari"
2008,"BLEWS: Using Blogs to Provide Context for News Articles.",ICWSM,"Michael Gamon,Sumit Basu,Dmitriy Belenko,Danyel Fisher,Matthew Hurst,Arnd Christian König"
2013,"Predicting Depression via Social Media.",ICWSM,"Munmun De Choudhury,Michael Gamon,Scott Counts,Eric Horvitz"
2016,"How Content, Community, and Engagement Affect the Life Cycles of Online Photo Sharing Groups.",ICWSM,"Lyndon Kennedy,David Ayman Shamma"
2018,"Discovering Political Slang in Readers' Comments.",ICWSM,"Nabil Hossain,Thanh Thuy Trang Tran,Henry A. Kautz"
2018,"Modeling Popularity in Asynchronous Social Media Streams with Recurrent Neural Networks.",ICWSM,"Swapnil Mishra,Marian-Andrei Rizoiu,Lexing Xie"
2008,"GroupMe! - Combining Ideas of Wikis, Social Bookmarking, and Blogging.",ICWSM,"Fabian Abel,Mischa Frank,Nicola Henze,Daniel Krause,Patrick Siehndel"
2015,"It's a Man's Wikipedia? Assessing Gender Inequality in an Online Encyclopedia.",ICWSM,"Claudia Wagner,David García 0001,Mohsen Jadidi,Markus Strohmaier"
2010,"Socio-Legal Analysis of Criminal Sentences: A Preliminary Study.",ICWSM,"Giuseppe Giura,Giovanni Giuffrida,Carlo Pennisi,Calogero G. Zarba"
2009,"High-level Features for Learning Subjective Language across Domains.",ICWSM,"Gaël Dias,Dinko Dimchev Lambov,Veska Noncheva"
2013,"Extracting Diurnal Patterns of Real World Activity from Social Media.",ICWSM,"Nir Grinberg,Mor Naaman,Blake Shaw,Gilad Lotan"
2017,"QT2S: A System for Monitoring Road Traffic Via Fine Grounding of Tweets.",ICWSM,"Noora Al Emadi,Sofiane Abbar,Javier Borge-Holthoefer,Francisco Guzmán,Fabrizio Sebastiani 0001"
2018,"AbuSniff: Automatic Detection and Defenses Against Abusive Facebook Friends.",ICWSM,"Sajedul Rahim Talukder,Bogdan Carbunar"
2020,"Raiders of the Lost Kek: 3.5 Years of Augmented 4chan Posts from the Politically Incorrect Board.",ICWSM,"Antonis Papasavva,Savvas Zannettou,Emiliano De Cristofaro,Gianluca Stringhini,Jeremy Blackburn"
2020,"Examining Peer-to-Peer and Patient-Provider Interactions on a Social Media Community Facilitating Ask the Doctor Services.",ICWSM,"Alicia L. Nobles,Eric C. Leas,Mark Dredze,John W. Ayers"
2015,"A Platform for Visually Exploring the Development of Wikipedia Articles.",ICWSM,"Erik Borra,David Laniado,Esther Weltevrede,Michele Mauri,Giovanni Magni,Tommaso Venturini,Paolo Ciuccarelli,Richard Rogers,Andreas Kaltenbrunner"
2015,"Distant Supervision for Tweet Classification Using YouTube Labels.",ICWSM,"Walid Magdy,Hassan Sajjad,Tarek El-Ganainy,Fabrizio Sebastiani 0001"
2011,"Does Bad News Go Away Faster?",ICWSM,"Shaomei Wu,Chenhao Tan,Jon M. Kleinberg,Michael W. Macy"
2010,"Faceplant: Impression (Mis)management in Facebook Status Updates.",ICWSM,"Vladimir Barash,Nicolas Ducheneaut,Ellen Isaacs,Victoria Bellotti"
2017,"25 Tweets to Know You: A New Model to Predict Personality with Social Media.",ICWSM,"Pierre-Hadrien Arnoux,Anbang Xu,Neil Boyette,Jalal Mahmud,Rama Akkiraju,Vibha Sinha"
2019,"Smart, Responsible, and Upper Caste Only: Measuring Caste Attitudes through Large-Scale Analysis of Matrimonial Profiles.",ICWSM,"Ashwin Rajadesingan,Ramaswami Mahalingam,David Jurgens"
2012,"Modeling Polarizing Topics: When Do Different Political Communities Respond Differently to the Same News?",ICWSM,"Ramnath Balasubramanyan,William W. Cohen,Douglas Pierce,David P. Redlawsk"
2013,"Automatic Summarization of Events from Social Media.",ICWSM,"Freddy Chong Tat Chua,Sitaram Asur"
2012,"Network Sampling Designs for Relational Classification.",ICWSM,"Nesreen K. Ahmed,Jennifer Neville,Ramana Rao Kompella"
2016,"Expertise in Social Networks: How Do Experts Differ from Other Users?",ICWSM,"Benjamin D. Horne,Dorit Nevo,Jesse Freitas,Heng Ji,Sibel Adali"
2012,"Conversation Practices and Network Structure in Twitter.",ICWSM,"Luca Rossi 0003,Matteo Magnani"
2014,"Scalable Social Analytics for Live Viral Event Prediction.",ICWSM,"Puneet Jain,Justin Manweiler,Arup Acharya,Romit Roy Choudhury"
2009,"From Episodes to Sagas: Understanding the News by Identifying Temporally Related Story Sequences.",ICWSM,"Ramnath Balasubramanyan,Frank Lin,William W. Cohen,Matthew Hurst,Noah A. Smith"
2018,"Twits, Twats and Twaddle: Trends in Online Abuse towards UK Politicians.",ICWSM,"Genevieve Gorrell,Mark A. Greenwood,Ian Roberts,Diana Maynard,Kalina Bontcheva"
2007,"Tags are not metadata, but "just more content" - to some people.",ICWSM,"Bettina Berendt,Christoph Hanser"
2020,"A Benchmark Dataset of Check-Worthy Factual Claims.",ICWSM,"Fatma Arslan,Naeemul Hassan,Chengkai Li,Mark Tremayne"
2011,"Using Twitter to Detect and Tag Important Events in Sports Media.",ICWSM,"James Lanagan,Alan F. Smeaton"
2016,"Automatic Detection and Categorization of Election-Related Tweets.",ICWSM,"Prashanth Vijayaraghavan,Soroush Vosoughi,Deb Roy"
2013,"Sharing the Loves: Understanding the How and Why of Online Content Curation.",ICWSM,"Changtao Zhong,Sunil Shah,Karthik Sundaravadivelan,Nishanth Sastry"
2018,"Predicting News Coverage of Scientific Articles.",ICWSM,"Ansel MacLaughlin,John Wihbey,David A. Smith"
2012,"Filtering Noisy Web Data by Identifying and Leveraging Users' Contributions.",ICWSM,"Alina Mihaela Stoica"
2011,"Exploring Feature Definition and Selection for Sentiment Classifiers.",ICWSM,"Yelena Mejova,Padmini Srinivasan"
2008,"Preliminary Semantic Analysis of Political Blogs.",ICWSM,"Maojin Jiang,Shlomo Argamon"
2013,"Crowdphysics: Planned and Opportunistic Crowdsourcing for Physical Tasks.",ICWSM,"Adam Sadilek,John Krumm,Eric Horvitz"
2016,"Power Imbalance and Rating Systems.",ICWSM,"Bogdan State,Bruno D. Abrahao,Karen Cook"
2019,"Adapting Sequence to Sequence Models for Text Normalization in Social Media.",ICWSM,"Ismini Lourentzou,Kabir Manghnani,ChengXiang Zhai"
2014,"Rumor Cascades.",ICWSM,"Adrien Friggeri,Lada A. Adamic,Dean Eckles,Justin Cheng"
2013,"Blind Men and the Elephant: Detecting Evolving Groups in Social News.",ICWSM,"Roja Bandari,Hazhir Rahmandad,Vwani P. Roychowdhury"
2011,"Sentiment Flow Through Hyperlink Networks.",ICWSM,"Mahalia Miller,Conal Sathi,Daniel Wiesenthal,Jure Leskovec,Christopher Potts"
2011,"Escaping Information Poverty through Internet Newsgroups.",ICWSM,"Laura Hasler,Ian Ruthven"
2012,"Event Diffusion Patterns in Social Media.",ICWSM,"Minkyoung Kim,Lexing Xie,Peter Christen"
2008,"International Sentiment Analysis for News and Blogs.",ICWSM,"Mikhail Bautin,Lohit Vijayarenu,Steven Skiena"
2019,"Measuring Professional Skill Development in U.S. Cities Using Internet Search Queries.",ICWSM,"Shagun Jhaver,Justin Cranshaw,Scott Counts"
2014,"Working with Friends: Unveiling Working Affinity Features from Facebook Data.",ICWSM,"Douglas Castilho,Pedro O. S. Vaz de Melo,Daniele Quercia,Fabrício Benevenuto"
2009,"Open Domain Collaborative Storytelling with Say Anything.",ICWSM,"Reid Swanson,Andrew S. Gordon"
2011,"Automatically Identifying Groups Based on Content and Collective Behavioral Patterns of Group Members.",ICWSM,"Michelle L. Gregory,Dave W. Engel,Eric Belanga Bell,Andy Piatt,Scott Dowson,Andrew J. Cowell"
2016,"InsightMe: Raising Awareness of Conveyed Personality in Social Media Traces.",ICWSM,"Bin Xu 0002,Liang Gou,Anbang Xu,Dan Cosley,Jalal Mahmud"
2010,"User Interest and Interaction Structure in Online Forums.",ICWSM,"Di Liu,Daniel Percival,Stephen E. Fienberg"
2007,"Monitoring RSS Feeds Based on User Browsing Pattern.",ICWSM,"Ka Cheung Sia,Junghoo Cho,Koji Hino,Yun Chi,Shenghuo Zhu,Belle L. Tseng"
2011,"TweetTrader.net: Leveraging Crowd Wisdom in a Stock Microblogging Forum.",ICWSM,"Timm Oliver Sprenger"
2020,"Variation across Scales: Measurement Fidelity under Twitter Data Sampling.",ICWSM,"Siqi Wu,Marian-Andrei Rizoiu,Lexing Xie"
2014,"Topic-Based Clusters in Egocentric Networks on Facebook.",ICWSM,"Lilian Weng,Thomas M. Lento"
2007,"The Boardscape: Creating a Super Social Network of Message Boards.",ICWSM,"John G. Breslin,Ron Kass,Uldis Bojars"
2015,"On Analyzing Hashtags in Twitter.",ICWSM,"Paolo Ferragina,Francesco Piccinno,Roberto Santoro 0002"
2007,"An Empirical Investigation of Social Networks in the Blogosphere.",ICWSM,"Uldis Bojars,Andreas Harth,Sheila Kinsella,Sriniva Raghavendra"
2012,"De-Layering Social Networks by Shared Tastes of Friendships.",ICWSM,"Laura Dietz,Ben Gamari,John Guiver,Edward Snelson,Ralf Herbrich"
2008,"Collecting and Analyzing Japanese Splogs based on Characteristics of Keywords.",ICWSM,"Yuuki Sato,Takehito Utsuro,Tomohiro Fukuhara,Yasuhide Kawada,Yoshiaki Murakami,Hiroshi Nakagawa,Noriko Kando"
2012,"If Likes Were Votes: An Empirical Study on the 2011 Italian Administrative Elections.",ICWSM,"Fabio Giglietto"
2011,"Improving Text Clustering with Social Tagging.",ICWSM,"M. Eduardo Ares,Javier Parapar,Alvaro Barreiro"
2017,"Shocking the Crowd: The Effect of Censorship Shocks on Chinese Wikipedia.",ICWSM,"Ark Fangzhou Zhang,Danielle Livneh,Ceren Budak,Lionel Robert 0001,Daniel M. Romero"
2010,"A Comparison of Information Seeking Using Search Engines and Social Networks.",ICWSM,"Meredith Ringel Morris,Jaime Teevan,Katrina Panovich"
2012,"Grassroots Professional Development: How Teachers Use Twitter.",ICWSM,"Andrea Forte,Melissa Humphreys,Thomas H. Park"
2012,"Epidemic Intelligence for the Crowd, by the Crowd.",ICWSM,"Ernesto Diaz-Aviles,Avaré Stewart,Edward Velasco,Kerstin Denecke,Wolfgang Nejdl"
2020,"Empirical Evaluation of Three Common Assumptions in Building Political Media Bias Datasets.",ICWSM,"Soumen Ganguly,Juhi Kulshrestha,Jisun An,Haewoon Kwak"
2014,"Modeling User Attitude toward Controversial Topics in Online Social Media.",ICWSM,"Huiji Gao,Jalal Mahmud,Jilin Chen,Jeffrey Nichols,Michelle X. Zhou"
2013,"Dude, srsly?: The Surprisingly Formal Nature of Twitter's Language.",ICWSM,"Yuheng Hu,Kartik Talamadupula,Subbarao Kambhampati"
2007,"Intertemporal Topic Correlations in Online Media: A Comparative Study on Weblogs and News Websites.",ICWSM,"Jean-Philippe Cointet,Emmanuel Faure,Camille Roth"
2009,"Attentio Brand Maps.",ICWSM,"Frizo Janssens"
2009,"Detecting Topic Drift with Compound Topic Models.",ICWSM,"Dan Knights,Michael C. Mozer,Nicolas Nicolov"
2019,"Uncertainty During New Disease Outbreaks in Wikipedia.",ICWSM,"Reham Al Tamime,Wendy Hall,Richard Giordano"
2014,"User-Created Groups in Health Forums: What Makes Them Special?",ICWSM,"V. G. Vinod Vydiswaran,Yang Liu 0019,Kai Zheng 0002,David A. Hanauer,Qiaozhu Mei"
2016,"Analyzing the Political Sentiment of Tweets in Farsi.",ICWSM,"Elham Vaziripour,Christophe G. Giraud-Carrier,Daniel Zappala"
2017,"How Editorial, Temporal and Social Biases Affect Online Food Popularity and Appreciation.",ICWSM,"Markus Rokicki,Eelco Herder,Christoph Trattner"
2020,"Towards Using Word Embedding Vector Space for Better Cohort Analysis.",ICWSM,"Mohamed Bahgat,Steve Wilson,Walid Magdy"
2016,"Evaluating Public Response to the Boston Marathon Bombing and Other Acts of Terrorism through Twitter.",ICWSM,"Cody Buntain,Jennifer Golbeck,Brooke Liu,Gary LaFree"
2010,"Devils, Angels, and Robots: Tempting Destructive Users in Social Media.",ICWSM,"Kyumin Lee,Brian David Eoff,James Caverlee"
2020,"Two Computational Models for Analyzing Political Attention in Social Media.",ICWSM,"Libby Hemphill,Angela M. Schöpke-Gonzalez"
2011,"Trends in Social Media: Persistence and Decay.",ICWSM,"Sitaram Asur,Bernardo A. Huberman,Gábor Szabó 0002,Chunyan Wang 0015"
2010,"Modeling Group Dynamics in Virtual Worlds.",ICWSM,"Fahad Shah,Gita Reese Sukthankar,Chris Usher"
2016,"Twitter's Glass Ceiling: The Effect of Perceived Gender on Online Visibility.",ICWSM,"Shirin Nilizadeh,Anne Groggel,Peter Lista,Srijita Das,Yong-Yeol Ahn,Apu Kapadia,Fabio Rojas"
2012,"Evaluating Real-Time Search over Tweets.",ICWSM,"Dean McCullough,Jimmy J. Lin,Craig Macdonald,Iadh Ounis,Richard McCreadie"
2015,"Project Recommendation Using Heterogeneous Traits in Crowdfunding.",ICWSM,"Vineeth Rakesh,Jaegul Choo,Chandan K. Reddy"
2014,"Efficient Filtering on Hidden Document Streams.",ICWSM,"Eduardo J. Ruiz,Vagelis Hristidis,Panagiotis G. Ipeirotis"
2010,"Longevity in Second Life.",ICWSM,"ChunYuen Teng,Lada A. Adamic"
2016,"Hyphe, a Curation-Oriented Approach to Web Crawling for the Social Sciences.",ICWSM,"Mathieu Jacomy,Paul Girard,Benjamin Ooghe-Tabanou,Tommaso Venturini"
2009,"Does Showing Off Help to Make Friends? Experimenting a Sociological Game on Self-Exhibition and Social Networks.",ICWSM,"Christophe Aguiton,Dominique Cardon,Aymeric Castelain,Pierre Fremaux,Hélène Girard,Fabien Granjon,Charles Nepote,Zbigniew Smoreda,Dilara Trupia,Cezary Ziemlicki"
2012,"Impact and Diffusion of Sentiment in Political Communication - An Empirical Analysis of Political Weblogs.",ICWSM,"Linh Dang-Xuan,Stefan Stieglitz"
2012,"Extracting Diverse Sentiment Expressions with Target-Dependent Polarity from Twitter.",ICWSM,"Lu Chen,Wenbo Wang 0002,Meenakshi Nagarajan,Shaojun Wang,Amit P. Sheth"
2012,"On the Geo-Indicativeness of Non-Georeferenced Text.",ICWSM,"Benjamin Adams,Krzysztof Janowicz"
2016,"EigenTransitions with Hypothesis Testing: The Anatomy of Urban Mobility.",ICWSM,"Ke Zhang 0013,Yu-Ru Lin,Konstantinos Pelechrinis"
2016,"Detection of Promoted Social Media Campaigns.",ICWSM,"Emilio Ferrara,Onur Varol,Filippo Menczer,Alessandro Flammini"
2015,"Breaking the News: First Impressions Matter on Online News.",ICWSM,"Júlio Cesar dos Reis,Fabrício Benevenuto de Souza,Pedro Olmo Stancioli Vaz de Melo,Raquel Oliveira Prates,Haewoon Kwak,Jisun An"
2013,"The Secret Life of Online Moms: Anonymity and Disinhibition on YouBeMom.com.",ICWSM,"Sarita Yardi Schoenebeck"
2019,"Thou Shalt Not Hate: Countering Online Hate Speech.",ICWSM,"Binny Mathew,Punyajoy Saha,Hardik Tharad,Subham Rajgaria,Prajwal Singhania,Suman Kalyan Maity,Pawan Goyal,Animesh Mukherjee 0001"
2017,"EmojiNet: An Open Service and API for Emoji Sense Discovery.",ICWSM,"Sanjaya Wijeratne,Lakshika Balasuriya,Amit P. Sheth,Derek Doran"
2017,"Recognizing Pathogenic Empathy in Social Media.",ICWSM,"Muhammad Abdul-Mageed,Anneke Buffone,Hao Peng,Johannes C. Eichstaedt,Lyle H. Ungar"
2012,"Homophily and Latent Attribute Inference: Inferring Latent Attributes of Twitter Users from Neighbors.",ICWSM,"Faiyaz Al Zamal,Wendy Liu,Derek Ruths"
2017,"A Long-Term Analysis of Polarization on Twitter.",ICWSM,"Venkata Rama Kiran Garimella,Ingmar Weber"
2016,"Social Media Participation in an Activist Movement for Racial Equality.",ICWSM,"Munmun De Choudhury,Shagun Jhaver,Benjamin Sugar,Ingmar Weber"
2016,"Towards an Open-Domain Framework for Distilling the Outcomes of Personal Experiences from Social Media Timelines.",ICWSM,"Alexandra Olteanu,Onur Varol,Emre Kiciman"
2020,"The Long-Running Debate about Brexit on Social Media.",ICWSM,"Emre Calisir,Marco Brambilla 0001"
2016,"Using Organizational Social Networks to Predict Employee Engagement.",ICWSM,"Shion Guha,Michael J. Muller,N. Sadat Shami,Mikhil Masli,Werner Geyer"
2011,"Prominence Ranking in Graphs with Community Structure.",ICWSM,"Sibel Adali,Xiaohui Lu,Malik Magdon-Ismail,Jonathan T. Purnell"
2017,"Controlling for Unobserved Confounds in Classification Using Correlational Constraints.",ICWSM,"Virgile Landeiro,Aron Culotta"
2017,"Robust Classification of Crisis-Related Data on Social Networks Using Convolutional Neural Networks.",ICWSM,"Dat Tien Nguyen,Kamla Al-Mannai,Shafiq R. Joty,Hassan Sajjad,Muhammad Imran 0002,Prasenjit Mitra"
2010,"User Acceptance of Micro-Blogging in the Enterprise.",ICWSM,"Jun Zhang 0008,Yan Qu,Derek L. Hansen"
2015,"An Analysis of Exercising Behavior in Online Populations.",ICWSM,"David Jurgens,James McCorriston,Derek Ruths"
2016,"Who Did What: Editor Role Identification in Wikipedia.",ICWSM,"Diyi Yang,Aaron Halfaker,Robert E. Kraut,Eduard H. Hovy"
2019,"Who Should Be the Captain This Week?Leveraging Inferred Diversity-Enhanced Crowd Wisdom for a Fantasy Premier League Captain Prediction.",ICWSM,"Shreyansh P. Bhatt,Keke Chen,Valerie L. Shalin,Amit P. Sheth,Brandon S. Minnery"
2011,"Timing Tweets to Increase Effectiveness of Information Campaigns.",ICWSM,"Onkar Dabeer,Prachi Mehendale,Aditya Karnik,Atul Saroop"
2008,"Clustering Tags in Enterprise and Web Folksonomies.",ICWSM,"Edwin Simpson"
2017,"Junet: A Julia Package For Network Research.",ICWSM,"Igor Zakhlebin"
2013,"Opinion Fraud Detection in Online Reviews by Network Effects.",ICWSM,"Leman Akoglu,Rishi Chandy,Christos Faloutsos"
