2018,"Query Suggestion with Feedback Memory Network.",WWW,"Bin Wu,Chenyan Xiong,Maosong Sun,Zhiyuan Liu 0001"
2019,"Reply-Aided Detection of Misinformation via Bayesian Deep Learning.",WWW,"Qiang Zhang 0026,Aldo Lipani,Shangsong Liang,Emine Yilmaz"
2020,"An Intent-Based Automation Framework for Securing Dynamic Consumer IoT Infrastructures.",WWW,"Vasudevan Nagendra,Arani Bhattacharya,Vinod Yegneswaran,Amir Rahmati,Samir Ranjan Das"
2012,"The SemSets model for ad-hoc semantic list search.",WWW,"Marek Ciglan,Kjetil Nørvåg,Ladislav Hluchý"
2017,"Reducing Latency by Eliminating Synchrony.",WWW,"Min Hong Yun,Songtao He,Lin Zhong 0001"
2020,"Understanding User Behavior For Document Recommendation.",WWW,"Xuhai Xu,Ahmed Hassan Awadallah,Susan T. Dumais,Farheen Omar,Bogdan Popp,Robert Rounthwaite,Farnaz Jahanbakhsh"
2015,"Early Detection of Spam Mobile Apps.",WWW,"Suranga Seneviratne,Aruna Seneviratne,Mohamed Ali Kâafar,Anirban Mahanti,Prasant Mohapatra"
2019,"Neural Chinese Named Entity Recognition via CNN-LSTM-CRF and Joint Training with Word Segmentation.",WWW,"Fangzhao Wu,Junxin Liu,Chuhan Wu,Yongfeng Huang 0001,Xing Xie 0001"
2016,"Predicting Pre-click Quality for Native Advertisements.",WWW,"Ke Zhou 0003,Miriam Redi,Andrew Haines,Mounia Lalmas"
2011,"Milgram-routing in social networks.",WWW,"Silvio Lattanzi,Alessandro Panconesi,D. Sivakumar 0001"
2018,"An Automated Approach to Auditing Disclosure of Third-Party Data Collection in Website Privacy Policies.",WWW,"Timothy Libert"
2005,"ATMEN: a triggered network measurement infrastructure.",WWW,"Balachander Krishnamurthy,Harsha V. Madhyastha,Oliver Spatscheck"
2010,"How useful are your comments?: analyzing and predicting youtube comments and comment ratings.",WWW,"Stefan Siersdorfer,Sergiu Chelaru,Wolfgang Nejdl,José San Pedro"
2006,"Wake-on-WLAN.",WWW,"Nilesh Mishra,Kameswari Chebrolu,Bhaskaran Raman,Abhinav Pathak"
2017,"AttriInfer: Inferring User Attributes in Online Social Networks Using Markov Random Fields.",WWW,"Jinyuan Jia,Binghui Wang,Le Zhang 0006,Neil Zhenqiang Gong"
2001,"Function-based object model towards website adaptation.",WWW,"Jinlin Chen,Baoyao Zhou,Jin Shi,HongJiang Zhang,Qiu Fengwu"
2013,"Iolaus: securing online content rating systems.",WWW,"Arash Molavi Kakhki,Chloe Kliman-Silver,Alan Mislove"
2009,"A generalised cross-modal clustering method applied to multimedia news semantic indexing and retrieval.",WWW,"Alberto Messina,Maurizio Montagnuolo"
2011,"Games, algorithms, and the Internet.",WWW,"Christos H. Papadimitriou"
2010,"The anatomy of a large-scale social search engine.",WWW,"Damon Horowitz,Sepandar D. Kamvar"
2018,"VizByWiki: Mining Data Visualizations from the Web to Enrich News Articles.",WWW,"Allen Yilun Lin,Joshua Ford,Eytan Adar,Brent J. Hecht"
2012,"Active objects: actions for entity-centric search.",WWW,"Thomas Lin,Patrick Pantel,Michael Gamon,Anitha Kannan,Ariel Fuxman"
2009,"Advertising keyword generation using active learning.",WWW,"Hao Wu,Guang Qiu,Xiaofei He 0001,Yuan Shi,Mingcheng Qu,Jing Shen,Jiajun Bu,Chun Chen 0001"
2016,"Modeling a Retweet Network via an Adaptive Bayesian Approach.",WWW,"Bin Bi,Junghoo Cho"
2010,"Structured audio podcasts via web text-to-speech system.",WWW,"Giulio Mori,Maria Claudia Buzzi,Marina Buzzi,Barbara Leporini"
2008,"Unsupervised query segmentation using generative language models and wikipedia.",WWW,"Bin Tan,Fuchun Peng"
2007,"Optimized query planning of continuous aggregation queries in dynamic data dissemination networks.",WWW,"Rajeev Gupta,Krithi Ramamritham"
2003,"Mining the peanut gallery: opinion extraction and semantic classification of product reviews.",WWW,"Kushal Dave,Steve Lawrence,David M. Pennock"
2010,"Transfer learning for behavioral targeting.",WWW,"Tianqi Chen,Jun Yan 0001,Gui-Rong Xue,Zheng Chen 0001"
2006,"One document to bind them: combining XML, web services, and the semantic web.",WWW,"Harry Halpin,Henry S. Thompson"
2010,"Exploiting social context for review quality prediction.",WWW,"Yue Lu,Panayiotis Tsaparas,Alexandros Ntoulas,Livia Polanyi"
2020,"A Generalized and Fast-converging Non-negative Latent Factor Model for Predicting User Preferences in Recommender Systems.",WWW,"Ye Yuan 0014,Xin Luo 0001,Mingsheng Shang,Di Wu"
2001,"A constraint extension to scalable vector graphics.",WWW,"Greg J. Badros,Jojada J. Tirtowidjojo,Kim Marriott,Bernd Meyer 0001,Will Portnoy,Alan Borning"
2020,"Mobile App Squatting.",WWW,"Yangyu Hu,Haoyu Wang 0001,Ren He,Li Li 0029,Gareth Tyson,Ignacio Castro,Yao Guo 0001,Lei Wu 0012,Guoai Xu"
2019,"Emoji-Powered Representation Learning for Cross-Lingual Sentiment Classification.",WWW,"Zhenpeng Chen,Sheng Shen,Ziniu Hu,Xuan Lu,Qiaozhu Mei,Xuanzhe Liu"
2018,"Joint User- and Event- Driven Stable Social Event Organization.",WWW,"Xin Wang 0019,Wenwu Zhu 0001,Chun Chen 0001,Martin Ester"
2015,"Opinion Spam Detection in Web Forum: A Real Case Study.",WWW,"Yu-Ren Chen,Hsin-Hsi Chen"
2010,"Enabling WebGL.",WWW,"Catherine Leung,Andor Salga"
2018,"Multi-instance Domain Adaptation for Vaccine Adverse Event Detection.",WWW,"Junxiang Wang,Liang Zhao 0002"
2016,"Understanding the Detection of View Fraud in Video Content Portals.",WWW,"Miriam Marciel,Rubén Cuevas,Albert Banchs,Roberto Gonzalez,Stefano Traverso,Mohamed Ahmed,Arturo Azcorra"
2015,"Measurement and Analysis of Mobile Web Cache Performance.",WWW,"Yun Ma 0002,Xuanzhe Liu,Shuhui Zhang,Ruirui Xiang,Yunxin Liu,Tao Xie 0001"
2017,"Security Implications of Redirection Trail in Popular Websites Worldwide.",WWW,"Li Chang,Hsu-Chun Hsiao,Wei Jeng,Tiffany Hyun-Jin Kim,Wei-Hsi Lin"
2019,"QAnswer: A Question Answering prototype bridging the gap between a considerable part of the LOD cloud and end-users.",WWW,"Dennis Diefenbach,Pedro Henrique Migliatti,Omar Qawasmeh,Vincent Lully,Kamal Singh,Pierre Maret"
2008,"Floatcascade learning for fast imbalanced web mining.",WWW,"Xiaoxun Zhang,Xueying Wang,Honglei Guo,Zhili Guo,Xian Wu,Zhong Su"
2002,"Topic-sensitive PageRank.",WWW,"Taher H. Haveliwala"
2006,"Graphical representation of RDF queries.",WWW,"Andreas Harth,Sebastian Ryszard Kruk,Stefan Decker"
2012,"Implementing optimal outcomes in social computing: a game-theoretic approach.",WWW,"Arpita Ghosh,Patrick Hummel"
2012,"SessionJuggler: secure web login from an untrusted terminal using session hijacking.",WWW,"Elie Bursztein,Chinmay Soman,Dan Boneh,John C. Mitchell"
2015,"Statistically Significant Detection of Linguistic Change.",WWW,"Vivek Kulkarni,Rami Al-Rfou,Bryan Perozzi,Steven Skiena"
2017,"On Analyzing User Topic-Specific Platform Preferences Across Multiple Social Media Sites.",WWW,"Roy Ka-Wei Lee,Tuan-Anh Hoang,Ee-Peng Lim"
2008,"Asymmetrical query recommendation method based on bipartite network resource allocation.",WWW,"Zhiyuan Liu 0001,Maosong Sun"
2020,"Deconstruct Densest Subgraphs.",WWW,"Lijun Chang,Miao Qiao"
2011,"A distributed framework for reliable and efficient service choreographies.",WWW,"Young Yoon,Chunyang Ye,Hans-Arno Jacobsen"
2008,"Keyword extraction for contextual advertisement.",WWW,"Xiaoyuan Wu,Alvaro Bolivar"
2007,"Finding community structure in mega-scale social networks: [extended abstract].",WWW,"Ken Wakita,Toshiyuki Tsurumi"
2008,"Sessionlock: securing web sessions against eavesdropping.",WWW,"Ben Adida"
2007,"Using Google distance to weight approximate ontology matches.",WWW,"Risto Gligorov,Warner ten Kate,Zharko Aleksovski,Frank van Harmelen"
2020,"REST: Robust and Efficient Neural Networks for Sleep Monitoring in the Wild.",WWW,"Rahul Duggal,Scott Freitas,Cao Xiao,Duen Horng Chau,Jimeng Sun"
2001,"Learning search engine specific query transformations for question answering.",WWW,"Eugene Agichtein,Steve Lawrence,Luis Gravano"
2004,"A combined approach to checking web ontologies.",WWW,"Jin Song Dong,Chew Hung Lee,Hian Beng Lee,Yuan-Fang Li,Hai H. Wang"
2020,"Natural Language Annotations for Search Engine Optimization.",WWW,"Porter Jenkins,Jennifer Zhao,Heath Vinicombe,Anant Subramanian,Arun Prasad,Atillia Dobi,Eileen Li,Yunsong Guo"
2019,"LearnerExp: Exploring and Explaining the Time Management of Online Learning Activity.",WWW,"Huan He,Qinghua Zheng,Bo Dong"
2014,"How to influence people with partial incentives.",WWW,"Erik D. Demaine,MohammadTaghi Hajiaghayi,Hamid Mahini,David L. Malec,S. Raghavan 0001,Anshul Sawant,Morteza Zadimoghaddam"
2001,"Protecting web servers from distributed denial of service attacks.",WWW,"Frank Kargl,Jörn Maier,Michael Weber 0001"
2007,"Parallel crawling for online social networks.",WWW,"Duen Horng Chau,Shashank Pandit,Samuel Wang,Christos Faloutsos"
2019,"Language in Our Time: An Empirical Analysis of Hashtags.",WWW,"Yang Zhang 0016"
2019,"Transfer Meets Hybrid: A Synthetic Approach for Cross-Domain Collaborative Filtering with Text.",WWW,"Guangneng Hu,Yu Zhang 0006,Qiang Yang 0001"
2005,"An enhanced model for searching in semantic portals.",WWW,"Lei Zhang 0007,Yong Yu 0001,Jian Zhou,Chenxi Lin,Yin Yang"
2019,"Dynamic Deep Multi-modal Fusion for Image Privacy Prediction.",WWW,"Ashwini Tonge,Cornelia Caragea"
2007,"Brand awareness and the evaluation of search results.",WWW,"Bernard J. Jansen,Mimi Zhang,Ying Zhang"
2006,"Using semantic rules to determine access control for web services.",WWW,"Brian Shields,Owen Molloy,Gerard Lyons,Jim Duggan"
2010,"Access: news and blog analysis for the social sciences.",WWW,"Mikhail Bautin,Charles B. Ward,Akshay Patil,Steven Skiena"
2009,"Triplify: light-weight linked data publication from relational databases.",WWW,"Sören Auer,Sebastian Dietzold,Jens Lehmann 0001,Sebastian Hellmann,David Aumueller"
2009,"sMash: semantic-based mashup navigation for data API network.",WWW,"Bin Lu,Zhaohui Wu 0001,Yuan Ni,Guo Tong Xie,Chunying Zhou,Huajun Chen"
2005,"Web service interfaces.",WWW,"Dirk Beyer 0001,Arindam Chakrabarti,Thomas A. Henzinger"
2018,"Uncovering HTTP Header Inconsistencies and the Impact on Desktop/Mobile Websites.",WWW,"Abner Mendoza,Phakpoom Chinprutthiwong,Guofei Gu"
2002,"The Yin/Yang web: XML syntax and RDF semantics.",WWW,"Peter F. Patel-Schneider,Jérôme Siméon"
2019,"Your Style Your Identity: Leveraging Writing and Photography Styles for Drug Trafficker Identification in Darknet Markets over Attributed Heterogeneous Information Network.",WWW,"Yiming Zhang 0002,Yujie Fan,Wei Song,Shifu Hou,Yanfang Ye,Xin Li 0005,Liang Zhao 0002,Chuan Shi,Jiabin Wang,Qi Xiong"
2018,"Identifying Modes of User Engagement with Online News and Their Relationship to Information Gain in Text.",WWW,"Nir Grinberg"
2010,"Are search engine users equally reliable?",WWW,"Qianli Xing,Yiqun Liu 0001,Rongwei Cen,Min Zhang 0006,Shaoping Ma,Liyun Ru"
2005,"The classroom sentinel: supporting data-driven decision-making in the classroom.",WWW,"Mark K. Singley,Richard B. Lam"
2010,"Not so creepy crawler: easy crawler generation with standard xml queries.",WWW,"Franziska von dem Bussche,Klara A. Weiand,Benedikt Linse,Tim Furche,François Bry"
2010,"Intelligent ad resizing.",WWW,"Anthony P. Badali,Parham Aarabi,Ron D. Appel"
2006,"Capturing RIA concepts in a web modeling language.",WWW,"Alessandro Bozzon,Sara Comai,Piero Fraternali,Giovanni Toffetti Carughi"
2001,"Visitor awareness in the web.",WWW,"Albrecht Schmidt 0001,Hans-Werner Gellersen"
2016,"Remedying Web Hijacking: Notification Effectiveness and Webmaster Comprehension.",WWW,"Frank Li 0001,Grant Ho,Eric Kuan,Yuan Niu,Lucas Ballard,Kurt Thomas,Elie Bursztein,Vern Paxson"
2020,"Interpretable Complex Question Answering.",WWW,"Soumen Chakrabarti"
2019,"Current Flow Group Closeness Centrality for Complex Networks?",WWW,"Huan Li 0002,Richard Peng,Liren Shan,Yuhao Yi,Zhongzhi Zhang"
2009,"Deriving music theme annotations from user tags.",WWW,"Kerstin Bischoff,Claudiu S. Firan,Raluca Paiu"
2007,"Generation, documentation and presentation of mathematical equations and symbolic scientific expressions using pure HTML and CSS.",WWW,"Kehinde Alabi"
2017,"Ten Blue Links on Mars.",WWW,"Charles L. A. Clarke,Gordon V. Cormack,Jimmy J. Lin,Adam Roegiest"
2008,"KC3 browser: semantic mash-up and link-free browsing.",WWW,"Michiaki Iwazume,Ken Kaneiwa,Koji Zettsu,Takafumi Nakanishi,Yutaka Kidawara,Yasushi Kiyoki"
2006,"Proposal of integrated search engine of web and TV contents.",WWW,"Hisashi Miyamori,Mitsuru Minakuchi,Zoran Stejic,Qiang Ma 0001,Tadashi Araki,Katsumi Tanaka"
2008,"Speeding up web service composition with volatile information.",WWW,"John Harney,Prashant Doshi"
2007,"GeoTV: navigating geocoded rss to create an iptv experience.",WWW,"Yih-Farn Chen,Giuseppe Di Fabbrizio,David C. Gibbon,Rittwik Jana,Serban Jora,Bernard Renger,Bin Wei"
2009,"Click chain model in web search.",WWW,"Fan Guo,Chao Liu 0001,Anitha Kannan,Tom Minka,Michael J. Taylor,Yi Min Wang,Christos Faloutsos"
2020,"Real-Time Clustering for Large Sparse Online Visitor Data.",WWW,"Gromit Yeuk-Yin Chan,Fan Du,Ryan A. Rossi,Anup B. Rao,Eunyee Koh,Cláudio T. Silva,Juliana Freire"
2007,"A link-based ranking scheme for focused search.",WWW,"Philip O'Brien,Tony Abou-Assaleh,Tapajyoti Das,Weizheng Gao,Yingbo Miao,Zhen Zhen"
2019,"Gaps in Information Access in Social Networks?",WWW,"Benjamin Fish,Ashkan Bashardoust,danah boyd,Sorelle A. Friedler,Carlos Scheidegger,Suresh Venkatasubramanian"
2018,"Multi-Task Pharmacovigilance Mining from Social Media Posts.",WWW,"Shaika Chowdhury,Chenwei Zhang,Philip S. Yu"
2020,"Hierarchical Adaptive Contextual Bandits for Resource Constraint based Recommendation.",WWW,"Mengyue Yang,Qingyang Li,Zhiwei Qin,Jieping Ye"
2009,"Web content accessibility guidelines: from 1.0 to 2.0.",WWW,"Miquel Termens,Mireia Ribera,Mercè Porras,Marc Boldú,Andreu Sulé,Pilar Paris"
2003,"Web application security assessment by fault injection and behavior monitoring.",WWW,"Yao-Wen Huang,Shih-Kun Huang,Tsung-Po Lin,Chung-Hung Tsai"
2006,"Meaning on the web: evolution vs intelligent design?",WWW,"Ron Brachman,Dan Connolly,Rohit Khare,Frank Smadja,Frank van Harmelen"
2006,"Efficient query subscription processing for prospective search engines.",WWW,"Utku Irmak,Svilen Mihaylov,Torsten Suel,Samrat Ganguly,Rauf Izmailov"
2011,"A unified framework for recommending diverse and relevant queries.",WWW,"Xiaofei Zhu,Jiafeng Guo,Xueqi Cheng,Pan Du,Huawei Shen"
2003,"Similarity measure and instance selection for collaborative filtering.",WWW,"Chun Zeng,Chun-Xiao Xing,Li-Zhu Zhou"
2008,"Computing minimum cost diagnoses to repair populated DL-based ontologies.",WWW,"Jianfeng Du,Yi-Dong Shen"
2003,"A system for principled matchmaking in an electronic marketplace.",WWW,"Tommaso Di Noia,Eugenio Di Sciascio,Francesco M. Donini,Marina Mongiello"
2010,"Antourage: mining distance-constrained trips from flickr.",WWW,"Saral Jain,Stephan Seufert,Srikanta J. Bedathur"
2012,"New objective functions for social collaborative filtering.",WWW,"Joseph Noel,Scott Sanner,Khoi-Nguyen Tran,Peter Christen,Lexing Xie,Edwin V. Bonilla,Ehsan Abbasnejad,Nicolás Della Penna"
2015,"Path Sampling: A Fast and Provable Method for Estimating 4-Vertex Subgraph Counts.",WWW,"Madhav Jha,C. Seshadhri,Ali Pinar"
2002,"Webformulate: a web-based visual continual query system.",WWW,"Jennifer L. Leopold,Meg Heimovics,Tyler Palmer"
2019,"Learn2Clean: Optimizing the Sequence of Tasks for Web Data Preparation.",WWW,"Laure Berti-Équille"
2019,"Learning Clusters through Information Diffusion.",WWW,"Liudmila Ostroumova Prokhorenkova,Alexey Tikhonov,Nelly Litvak"
2016,"Towards Mobile Query Auto-Completion: An Efficient Mobile Application-Aware Approach.",WWW,"Aston Zhang,Amit Goyal,Ricardo Baeza-Yates,Yi Chang 0001,Jiawei Han 0001,Carl A. Gunter,Hongbo Deng"
2001,"Geospatial mapping and navigation of the web.",WWW,"Kevin S. McCurley"
2010,"Analyzing content-level properties of the web adversphere.",WWW,"Yong Wang,Daniel Burgener,Aleksandar Kuzmanovic,Gabriel Maciá-Fernández"
2020,"Learning to Respond with Stickers: A Framework of Unifying Multi-Modality in Multi-Turn Dialog.",WWW,"Shen Gao,Xiuying Chen,Chang Liu,Li Liu,Dongyan Zhao 0001,Rui Yan 0001"
2019,"Domain-Constrained Advertising Keyword Generation.",WWW,"Hao Zhou,Minlie Huang,Yishun Mao,Changlei Zhu,Peng Shu,Xiaoyan Zhu 0001"
2020,"NCVis: Noise Contrastive Approach for Scalable Visualization.",WWW,"Aleksandr Artemenkov,Maxim Panov"
2009,"Automatically filling form-based web interfaces with free text inputs.",WWW,"Guilherme A. Toda,Eli Cortez,Filipe de Sá Mesquita,Altigran Soares da Silva,Edleno Silva de Moura,Marden S. Neubert"
2014,"Revenue monotone mechanisms for online advertising.",WWW,"Gagan Goel,Mohammad Reza Khani"
2003,"A software framework for matchmaking based on semantic web technology.",WWW,"Lei Li,Ian Horrocks"
2019,"Spiders like Onions: on the Network of Tor Hidden Services.",WWW,"Massimo Bernaschi,Alessandro Celestini,Stefano Guarino,Flavio Lombardi,Enrico Mastrostefano"
2010,"Finding algorithms in scientific articles.",WWW,"Sumit Bhatia,Prasenjit Mitra,C. Lee Giles"
2020,"An Empirical Study of the Use of Integrity Verification Mechanisms for Web Subresources.",WWW,"Bertil Chapuis,Olamide Omolola,Mauro Cherubini,Mathias Humbert,Kévin Huguenin"
2015,"A First Look at Tribal Web Traffic.",WWW,"Morgan Vigil,Matthew Rantanen,Elizabeth M. Belding"
2019,"RecBoard: A Web-based Platform for Recommendation System Research and Development.",WWW,"Mohit Chawla,Kriti Singh,Longqi Yang,Deborah Estrin"
2018,"Preferential Attachment as a Unique Equilibrium.",WWW,"Chen Avin,Avi Cohen,Pierre Fraigniaud,Zvi Lotker,David Peleg"
2013,"On cognition, emotion, and interaction aspects of search tasks with different search intentions.",WWW,"Yashar Moshfeghi,Joemon M. Jose"
2017,"The k-peak Decomposition: Mapping the Global Structure of Graphs.",WWW,"Priya Govindan,Chenghong Wang,Chumeng Xu,Hongyu Duan,Sucheta Soundarajan"
2020,"OpenCrowd: A Human-AI Collaborative Approach for Finding Social Influencers via Open-Ended Answers Aggregation.",WWW,"Ines Arous,Jie Yang,Mourad Khayati,Philippe Cudré-Mauroux"
2010,"Linking content in unstructured sources.",WWW,"Marie-Francine Moens"
2018,"Browserless Web Data Extraction: Challenges and Opportunities.",WWW,"Ruslan R. Fayzrakhmanov,Emanuel Sallinger,Ben Spencer,Tim Furche,Georg Gottlob"
2007,"Visualizing structural patterns in web collections.",WWW,"Mir Sadek Ali,Mariano P. Consens,Flavio Rizzolo"
2007,"On automated composition for web services.",WWW,"Zhongnan Shen,Jianwen Su"
2008,"Characterizing typical and atypical user sessions in clickstreams.",WWW,"Narayanan Sadagopan,Jie Li"
2018,"Attack under Disguise: An Intelligent Data Poisoning Attack Mechanism in Crowdsourcing.",WWW,"Chenglin Miao,Qi Li 0012,Lu Su,Mengdi Huai,Wenjun Jiang,Jing Gao 0004"
2010,"Introduction to social recommendation.",WWW,"Irwin King,Michael R. Lyu,Hao Ma 0001"
2001,"On integrating catalogs.",WWW,"Rakesh Agrawal 0001,Ramakrishnan Srikant"
2004,"Index structures and algorithms for querying distributed RDF repositories.",WWW,"Heiner Stuckenschmidt,Richard Vdovjak,Geert-Jan Houben,Jeen Broekstra"
2018,"Unsupervised Anomaly Detection via Variational Auto-Encoder for Seasonal KPIs in Web Applications.",WWW,"Haowen Xu,Wenxiao Chen,Nengwen Zhao,Zeyan Li,Jiahao Bu,Zhihan Li,Ying Liu 0024,Youjian Zhao,Dan Pei,Yang Feng,Jie Chen,Zhaogang Wang,Honglin Qiao"
2018,"SIDE: Representation Learning in Signed Directed Networks.",WWW,"Junghwan Kim,Haekyu Park,Ji-Eun Lee,U Kang"
2015,"Children Seen But Not Heard: When Parents Compromise Children's Online Privacy.",WWW,"Tehila Minkus,Kelvin Liu,Keith W. Ross"
2020,"De-Kodi: Understanding the Kodi Ecosystem.",WWW,"Marc Anthony Warrior,Yunming Xiao,Matteo Varvello,Aleksandar Kuzmanovic"
2020,"When Recommender Systems Meet Fleet Management: Practical Study in Online Driver Repositioning System.",WWW,"Zhe Xu,Chang Men,Peng Li,Bicheng Jin,Ge Li,Yue Yang,Chunyang Liu,Ben Wang,Xiaohu Qie"
2017,"The Onions Have Eyes: A Comprehensive Structure and Privacy Analysis of Tor Hidden Services.",WWW,"Iskander Sánchez-Rola,Davide Balzarotti,Igor Santos"
2010,"Query parsing in mobile voice search.",WWW,"Junlan Feng"
2005,"Incremental maintenance for materialized XPath/XSLT views.",WWW,"Makoto Onizuka,Fong Yee Chan,Ryusuke Michigami,Takashi Honishi"
2004,"Parsing owl dl: trees or triples?",WWW,"Sean Bechhofer,Jeremy J. Carroll"
2017,"Detecting Collusive Spamming Activities in Community Question Answering.",WWW,"Yuli Liu,Yiqun Liu 0001,Ke Zhou 0003,Min Zhang 0006,Shaoping Ma"
2018,"PhotoReply: Automatically Suggesting Conversational Responses to Photos.",WWW,"Ning Ye,Ariel Fuxman,Vivek Ramavajjala,Sergey Nazarov,J. Patrick McGregor,Sujith Ravi"
2020,"Large-scale Causal Approaches to Debiasing Post-click Conversion Rate Estimation with Multi-task Learning.",WWW,"Wenhao Zhang,Wentian Bao,Xiao-Yang Liu,Keping Yang,Quan Lin,Hong Wen,Ramin Ramezani"
2006,"Oyster: sharing and re-using ontologies in a peer-to-peer community.",WWW,"Raúl Palma,Peter Haase 0001,Asunción Gómez-Pérez"
2005,"On optimal service selection.",WWW,"Piero A. Bonatti,Paola Festa"
2010,"Enabling entity-based aggregators for web 2.0 data.",WWW,"Ekaterini Ioannou,Claudia Niederée,Yannis Velegrakis"
2016,"Tell Me About Yourself: The Malicious CAPTCHA Attack.",WWW,"Nethanel Gelernter,Amir Herzberg"
2011,"Automatic construction of a context-aware sentiment lexicon: an optimization approach.",WWW,"Yue Lu,Malú Castellanos,Umeshwar Dayal,ChengXiang Zhai"
2020,"Keeping out the Masses: Understanding the Popularity and Implications of Internet Paywalls.",WWW,"Panagiotis Papadopoulos,Peter Snyder,Dimitrios Athanasakis,Benjamin Livshits"
2011,"Finding hierarchy in directed online social networks.",WWW,"Mangesh Gupte,Pravin Shankar,Jing Li,S. Muthukrishnan,Liviu Iftode"
2008,"Investigating web services on the world wide web.",WWW,"Eyhab Al-Masri,Qusay H. Mahmoud"
2008,"Personalized search and exploration with mytag.",WWW,"Max Braun,Klaas Dellschaft,Thomas Franz,Dominik Hering,Peter Jungen,Hagen Metzler,Eugen Müller,Alexander Rostilov,Carsten Saathoff"
2010,"An efficient random access inverted index for information retrieval.",WWW,"Xiaozhu Liu,Zhiyong Peng"
2015,"The E-Commerce Market for "Lemons": Identification and Analysis of Websites Selling Counterfeit Goods.",WWW,"John Wadleigh,Jake Drew,Tyler Moore 0001"
2014,"The dynamics of repeat consumption.",WWW,"Ashton Anderson,Ravi Kumar 0001,Andrew Tomkins,Sergei Vassilvitskii"
2008,"IRLbot: scaling to 6 billion pages and beyond.",WWW,"Hsin-Tsang Lee,Derek Leonard,Xiaoming Wang 0002,Dmitri Loguinov"
2008,"Topic modeling with network regularization.",WWW,"Qiaozhu Mei,Deng Cai 0001,Duo Zhang 0001,ChengXiang Zhai"
2013,"NIFTY: a system for large scale information flow tracking and clustering.",WWW,"Caroline Suen,Sandy Huang,Chantat Eksombatchai,Rok Sosic,Jure Leskovec"
2019,"The Chain of Implicit Trust: An Analysis of the Web Third-party Resources Loading.",WWW,"Muhammad Ikram,Rahat Masood,Gareth Tyson,Mohamed Ali Kâafar,Noha Loizon,Roya Ensafi"
2020,"Beyond Rank-1: Discovering Rich Community Structure in Multi-Aspect Graphs.",WWW,"Ekta Gujral,Ravdeep Pasricha,Evangelos E. Papalexakis"
2007,"Image collector III: a web image-gathering system with bag-of-keypoints.",WWW,"Keiji Yanai"
2020,"A First Look at Commercial 5G Performance on Smartphones.",WWW,"Arvind Narayanan,Eman Ramadan,Jason Carpenter,Qingxu Liu,Yu Liu,Feng Qian,Zhi-Li Zhang"
2006,"The ODESeW 2.0 semantic web application framework.",WWW,"Óscar Corcho,Angel López-Cima,Asunción Gómez-Pérez"
2020,"Dual Learning for Explainable Recommendation: Towards Unifying User Preference Prediction and Review Generation.",WWW,"Peijie Sun,Le Wu,Kun Zhang,Yanjie Fu,Richang Hong,Meng Wang 0001"
2003,"Comparing link marker visualization techniques: changes in reading behavior.",WWW,"Hartmut Obendorf,Harald Weinreich"
2018,"I'm Listening to your Location! Inferring User Location with Acoustic Side Channels.",WWW,"Young Bae Jeon,Minchul Kim,Hyunsoo Kim,Hyoungshick Kim,Jun Ho Huh,Ji Won Yoon"
2019,"Policy Gradients for Contextual Recommendations.",WWW,"Feiyang Pan,Qingpeng Cai,Pingzhong Tang,Fuzhen Zhuang,Qing He 0003"
2006,"Reappraising cognitive styles in adaptive web applications.",WWW,"Elizabeth J. Brown,Tim J. Brailsford,Tony Fisher,Adam Moore,Helen Ashman"
2017,"Temporal Effects on Hashtag Reuse in Twitter: A Cognitive-Inspired Hashtag Recommendation Approach.",WWW,"Dominik Kowald,Subhash Chandra Pujari,Elisabeth Lex"
2019,"Tablepedia: Automating PDF Table Reading in an Experimental Evidence Exploration and Analytic System.",WWW,"Wenhao Yu,Zongze Li,Qingkai Zeng,Meng Jiang 0001"
2016,"No Honor Among Thieves: A Large-Scale Analysis of Malicious Web Shells.",WWW,"Oleksii Starov,Johannes Dahse,Syed Sharique Ahmad,Thorsten Holz,Nick Nikiforakis"
2016,"Hidden Topic Sentiment Model.",WWW,"Md. Mustafizur Rahman,Hongning Wang"
2002,"Using web structure for classifying and describing web pages.",WWW,"Eric J. Glover,Kostas Tsioutsiouliklis,Steve Lawrence,David M. Pennock,Gary William Flake"
2020,"Unsupervised Domain Adaptive Graph Convolutional Networks.",WWW,"Man Wu,Shirui Pan,Chuan Zhou 0001,Xiaojun Chang,Xingquan Zhu"
2008,"Rich media and web 2.0.",WWW,"Edward Y. Chang,Ken Ong,Susanne Boll,Wei-Ying Ma"
2019,"Studying Preferences and Concerns about Information Disclosure in Email Notifications.",WWW,"Yongsung Kim,Adam Fourney,Ece Kamar"
2019,"ShadowBlock: A Lightweight and Stealthy Adblocking Browser.",WWW,"Shitong Zhu,Umar Iqbal,Zhongjie Wang 0002,Zhiyun Qian,Zubair Shafiq,Weiteng Chen"
2001,"1000 years of the olympic games: treasures of ancient Greece. digital reconstruction at the home of the gods.",WWW,"Sarah Kenderdine"
2007,"Exploring in the weblog space by detecting informative and affective articles.",WWW,"Xiaochuan Ni 0001,Gui-Rong Xue,Xiao Ling,Yong Yu 0001,Qiang Yang 0001"
2010,"Detecting communities from tripartite networks.",WWW,"Tsuyoshi Murata"
2017,"Automated Template Generation for Question Answering over Knowledge Graphs.",WWW,"Abdalghani Abujabal,Mohamed Yahya,Mirek Riedewald,Gerhard Weikum"
