2008,"Secure or insure?: a game-theoretic analysis of information security games.",WWW,"Jens Grossklags,Nicolas Christin,John Chuang"
2019,"ActiveLink: Deep Active Learning for Link Prediction in Knowledge Graphs.",WWW,"Natalia Ostapuk,Jie Yang,Philippe Cudré-Mauroux"
2019,"Signed Distance-based Deep Memory Recommender.",WWW,"Thanh Tran 0005,Xinyue Liu,Kyumin Lee,Xiangnan Kong"
2010,"Optimizing user interaction for web-based mobile tasks.",WWW,"Dong Zhou,Ajay Chander,Hiroshi Inamura"
2017,"Situational Context for Ranking in Personal Search.",WWW,"Hamed Zamani,Michael Bendersky,Xuanhui Wang,Mingyang Zhang 0001"
2009,"Performing grouping and aggregate functions in XML queries.",WWW,"Huayu Wu 0001,Tok Wang Ling,Liang Xu,Zhifeng Bao"
2007,"BlogScope: spatio-temporal analysis of the blogosphere.",WWW,"Nilesh Bansal,Nick Koudas"
2020,"End-to-End Deep Attentive Personalized Item Retrieval for Online Content-sharing Platforms.",WWW,"Jyun-Yu Jiang,Tao Wu,Georgios Roumpos,Heng-Tze Cheng,Xinyang Yi,Ed Chi,Harish Ganapathy,Nitin Jindal,Pei Cao,Wei Wang 0010"
2013,"Two years of short URLs internet measurement: security threats and countermeasures.",WWW,"Federico Maggi,Alessandro Frossi,Stefano Zanero,Gianluca Stringhini,Brett Stone-Gross,Christopher Kruegel,Giovanni Vigna"
2009,"Instance-based probabilistic reasoning in the semantic web.",WWW,"Pedro Oliveira,Paulo Gomes"
2006,"The SOWES approach to P2P web search using semantic overlays.",WWW,"Christos Doulkeridis,Kjetil Nørvåg,Michalis Vazirgiannis"
2019,"Collaborative Similarity Embedding for Recommender Systems.",WWW,"Chih-Ming Chen 0003,Chuan-Ju Wang,Ming-Feng Tsai,Yi-Hsuan Yang"
2018,"Prediction of Sparse User-Item Consumption Rates with Zero-Inflated Poisson Regression.",WWW,"Moshe Lichman,Padhraic Smyth"
2009,"Community gravity: measuring bidirectional effects by trust and rating on online social networks.",WWW,"Yutaka Matsuo,Hikaru Yamamoto"
2019,"Maximizing Marginal Utility per Dollar for Economic Recommendation.",WWW,"Yingqiang Ge,Shuyuan Xu,Shuchang Liu,Shijie Geng,Zuohui Fu,Yongfeng Zhang"
2012,"Max algorithms in crowdsourcing environments.",WWW,"Petros Venetis,Hector Garcia-Molina,Kerui Huang,Neoklis Polyzotis"
2016,"Tracking the Trackers.",WWW,"Zhonghao Yu,Sam Macbeth,Konark Modi,Josep M. Pujol"
2016,"Query-Less: Predicting Task Repetition for NextGen Proactive Search and Recommendation Engines.",WWW,"Yang Song 0008,Qi Guo"
2001,"Enabling full service surrogates using the portable channel representation.",WWW,"Micah Beck,Terry Moore,Leif Abrahamsson,Christophe Achouiantz,Patrick Johansson"
2010,"Find me if you can: improving geographical prediction with social and spatial proximity.",WWW,"Lars Backstrom,Eric Sun,Cameron Marlow"
2015,"Active Learning for Multi-relational Data Construction.",WWW,"Hiroshi Kajino,Akihiro Kishimoto,Adi Botea,Elizabeth M. Daly,Spyros Kotoulas"
2013,"Accountable key infrastructure (AKI): a proposal for a public-key validation infrastructure.",WWW,"Tiffany Hyun-Jin Kim,Lin-Shung Huang,Adrian Perrig,Collin Jackson,Virgil D. Gligor"
2010,"Sketcha: a captcha based on line drawings of 3D models.",WWW,"Steven A. Ross,J. Alex Halderman,Adam Finkelstein"
2001,"On granting limited access to private information.",WWW,"Frans A. Lategan,Martin S. Olivier"
2008,"Algorithm for stochastic multiple-choice knapsack problem and application to keywords bidding.",WWW,"Yunhong Zhou,Victor Naroditskiy"
2020,"Finding large balanced subgraphs in signed networks.",WWW,"Bruno Ordozgoiti,Antonis Matakos,Aristides Gionis"
2003,"Application specific data replication for edge services.",WWW,"Lei Gao,Michael Dahlin,Amol Nayate,Jiandan Zheng,Arun Iyengar"
2011,"Modeling the temporal dynamics of social rating networks using bidirectional effects of social relations and rating patterns.",WWW,"Mohsen Jamali,Gholamreza Haffari,Martin Ester"
2018,"Sharing Deep Neural Network Models with Interpretation.",WWW,"Huijun Wu 0001,Chen Wang 0008,Jie Yin,Kai Lu,Liming Zhu"
2017,"Type-based Semantic Optimization for Scalable RDF Graph Pattern Matching.",WWW,"HyeongSik Kim,Padmashree Ravindra,Kemafor Anyanwu"
2020,"Beyond Triplets: Hyper-Relational Knowledge Graph Embedding for Link Prediction.",WWW,"Paolo Rosso,Dingqi Yang,Philippe Cudré-Mauroux"
2016,"The Communication Network Within the Crowd.",WWW,"Ming Yin,Mary L. Gray,Siddharth Suri,Jennifer Wortman Vaughan"
2006,"The case for multi-user design for computer aided learning in developing regions.",WWW,"Joyojeet Pal,Udai Singh Pawar,Eric A. Brewer,Kentaro Toyama"
2011,"Pay as you browse: microcomputations as micropayments in web-based services.",WWW,"Ghassan Karame,Aurélien Francillon,Srdjan Capkun"
2009,"HTML templates that fly: a template engine approach to automated offloading from server to client.",WWW,"Michiaki Tatsubori,Toyotaro Suzumura"
2019,"Large Scale Semantic Indexing with Deep Level-wise Extreme Multi-label Learning.",WWW,"Dingcheng Li,Jingyuan Zhang,Ping Li 0001"
2013,"Group chats on Twitter.",WWW,"James Cook,Krishnaram Kenthapadi,Nina Mishra"
2008,"Context-sensitive QoS model: a rule-based approach to web service composition.",WWW,"Tao Zhou,Xiaolin Zheng,William Wei Song,Xiaofeng Du,Deren Chen"
2020,"P-Simrank: Extending Simrank to Scale-Free Bipartite Networks.",WWW,"Prasenjit Dey,Kunal Goel,Rahul Agrawal"
2008,"Web user de-identification in personalization.",WWW,"Jiaqian Zheng,Jing Yao,Junyu Niu"
2006,"pTHINC: a thin-client architecture for mobile wireless web.",WWW,"Joeng Kim,Ricardo A. Baratto,Jason Nieh"
2019,"To Return or to Explore: Modelling Human Mobility and Dynamics in Cyberspace.",WWW,"Tianran Hu,Yinglong Xia,Jiebo Luo"
2005,"Sub-document queries over XML with XSQirrel.",WWW,"Arnaud Sahuguet,Bogdan Alexe"
2002,"Vocabulary development for markup languages: a case study with maritime information.",WWW,"Raphael M. Malyankar"
2008,"Web page sectioning using regex-based template.",WWW,"Rupesh R. Mehta,Amit Madaan"
2010,"Statistical models of music-listening sessions in social media.",WWW,"Elena Zheleva,John Guiver,Eduarda Mendes Rodrigues,Natasa Milic-Frayling"
2009,"Using static analysis for Ajax intrusion detection.",WWW,"Arjun Guha,Shriram Krishnamurthi,Trevor Jim"
2018,"TIMES: Temporal Information Maximally Extracted from Structures.",WWW,"Abram N. Magner,Jithin K. Sreedharan,Ananth Y. Grama,Wojciech Szpankowski"
2009,"Ranking user-created contents by search user's inclination in online communities.",WWW,"Hyoseop Shin,Jeehoon Lee"
2004,"The webgraph framework I: compression techniques.",WWW,"Paolo Boldi,Sebastiano Vigna"
2017,"Forecasting Seasonal Influenza Fusing Digital Indicators and a Mechanistic Disease Model.",WWW,"Qian Zhang 0016,Nicola Perra,Daniela Perrotta,Michele Tizzoni,Daniela Paolotti,Alessandro Vespignani"
2014,"A Monte Carlo algorithm for cold start recommendation.",WWW,"Yu Rong,Xiao Wen,Hong Cheng"
2013,"Question answering on interlinked data.",WWW,"Saeedeh Shekarpour,Axel-Cyrille Ngonga Ngomo,Sören Auer"
2020,"Searching for Embeddings in a Haystack: Link Prediction on Knowledge Graphs with Subgraph Pruning.",WWW,"Unmesh Joshi,Jacopo Urbani"
2018,"How to Impute Missing Ratings?: Claims, Solution, and Its Application to Collaborative Filtering.",WWW,"Youngnam Lee,Sang-Wook Kim,Sunju Park,Xing Xie"
2015,"ROCKER: A Refinement Operator for Key Discovery.",WWW,"Tommaso Soru,Edgard Marx,Axel-Cyrille Ngonga Ngomo"
2019,"Improving Treatment Effect Estimators Through Experiment Splitting.",WWW,"Dominic Coey,Tom Cunningham"
2011,"Learning to model relatedness for news recommendation.",WWW,"Yuanhua Lv,Taesup Moon,Pranam Kolari,Zhaohui Zheng,Xuanhui Wang,Yi Chang 0001"
2017,"Submodular Optimization Over Sliding Windows.",WWW,"Alessandro Epasto,Silvio Lattanzi,Sergei Vassilvitskii,Morteza Zadimoghaddam"
2017,"Expecting to be HIP: Hawkes Intensity Processes for Social Media Popularity.",WWW,"Marian-Andrei Rizoiu,Lexing Xie,Scott Sanner,Manuel Cebrián,Honglin Yu,Pascal Van Hentenryck"
2019,"Recommender Systems with Heterogeneous Side Information.",WWW,"Tianqiao Liu,Zhiwei Wang 0001,Jiliang Tang,Songfan Yang,Gale Yan Huang,Zitao Liu"
2008,"Larger is better: seed selection in link-based anti-spamming algorithms.",WWW,"Qiancheng Jiang,Lei Zhang 0013,Yizhen Zhu,Yan Zhang 0004"
2016,"Do Cascades Recur?",WWW,"Justin Cheng,Lada A. Adamic,Jon M. Kleinberg,Jure Leskovec"
2009,"Web-scale classification with naive bayes.",WWW,"Congle Zhang,Gui-Rong Xue,Yong Yu 0001,Hongyuan Zha"
2013,"Optimal hashing schemes for entity matching.",WWW,"Nilesh N. Dalvi,Vibhor Rastogi,Anirban Dasgupta 0001,Anish Das Sarma,Tamás Sarlós"
2008,"Reasoning about similarity queries in text retrieval tasks.",WWW,"Xiaohui Yu 0001,Yang Liu 0008"
2018,"Robust Factorization Machines for User Response Prediction.",WWW,"Surabhi Punjabi,Priyanka Bhatt"
2016,"Foundations of JSON Schema.",WWW,"Felipe Pezoa,Juan L. Reutter,Fernando Suárez,Martín Ugarte,Domagoj Vrgoc"
2012,"Branded with a scarlet "C": cheaters in a gaming social network.",WWW,"Jeremy Blackburn,Ramanuja Simha,Nicolas Kourtellis,Xiang Zuo,Matei Ripeanu,John Skvoretz,Adriana Iamnitchi"
2020,"Dynamic Composition for Conversational Domain Exploration.",WWW,"Idan Szpektor,Deborah Cohen,Gal Elidan,Michael Fink,Avinatan Hassidim,Orgad Keller,Sayali Kulkarni,Eran Ofek,Sagie Pudinsky,Asaf Revach,Shimi Salant,Yossi Matias"
2006,"From adaptation engineering to aspect-oriented context-dependency.",WWW,"Sven Casteleyn,Zoltán Fiala,Geert-Jan Houben,Kees van der Sluijs"
2015,"Efficient Densest Subgraph Computation in Evolving Graphs.",WWW,"Alessandro Epasto,Silvio Lattanzi,Mauro Sozio"
2007,"Web mashup scripting language.",WWW,"Marwan Sabbouh,Jeff Higginson,Salim Semy,Danny Gagne"
2019,"A Novel Unsupervised Approach for Precise Temporal Slot Filling from Incomplete and Noisy Temporal Contexts.",WWW,"Xueying Wang,Haiqiao Zhang,Qi Li,Yiyu Shi,Meng Jiang 0001"
2020,"Envy, Regret, and Social Welfare Loss.",WWW,"Riccardo Colini-Baldeschi,Stefano Leonardi,Okke Schrijvers,Eric Sodomka"
2018,"A Coherent Unsupervised Model for Toponym Resolution.",WWW,"Ehsan Kamalloo,Davood Rafiei"
2014,"The company you keep: mobile malware infection rates and inexpensive risk indicators.",WWW,"Hien Thi Thu Truong,Eemil Lagerspetz,Petteri Nurmi,Adam J. Oliner,Sasu Tarkoma,N. Asokan,Sourav Bhattacharya"
2014,"To gather together for a better world: understanding and leveraging communities in micro-lending recommendation.",WWW,"Jaegul Choo,Daniel Lee,Bistra Dilkina,Hongyuan Zha,Haesun Park"
2018,"Leveraging Crowdsourcing Data for Deep Active Learning An Application: Learning Intents in Alexa.",WWW,"Jie Yang,Thomas Drake,Andreas C. Damianou,Yoelle Maarek"
2008,"Dtwiki: a disconnection and intermittency tolerant wiki.",WWW,"Bowei Du,Eric A. Brewer"
2014,"Personalized collaborative clustering.",WWW,"Yisong Yue,Chong Wang,Khalid El-Arini,Carlos Guestrin"
2017,"Template Induction over Unstructured Email Corpora.",WWW,"Julia Proskurnia,Marc-Allen Cartright,Lluis Garcia Pueyo,Ivo Krka,James B. Wendt,Tobias Kaufmann,Balint Miklos"
2006,"Microformats: a pragmatic path to the semantic web.",WWW,"Rohit Khare,Tantek Çelik"
2019,"Bridging Screen Readers and Voice Assistants for Enhanced Eyes-Free Web Search.",WWW,"Alexandra Vtyurina,Adam Fourney,Meredith Ringel Morris,Leah Findlater,Ryen W. White"
2014,"Quite a mess in my cookie jar!: leveraging machine learning to protect web authentication.",WWW,"Stefano Calzavara,Gabriele Tolomei,Michele Bugliesi,Salvatore Orlando 0001"
2006,"Focused crawling: experiences in a real world project.",WWW,"Antonio Badia,Tulay Muezzinoglu,Olfa Nasraoui"
2005,"Object-level ranking: bringing order to Web objects.",WWW,"Zaiqing Nie,Yuanzhi Zhang,Ji-Rong Wen,Wei-Ying Ma"
2003,"Super-peer-based routing and clustering strategies for RDF-based peer-to-peer networks.",WWW,"Wolfgang Nejdl,Martin Wolpers,Wolf Siberski,Christoph Schmitz 0001,Mario T. Schlosser,Ingo Brunkhorst,Alexander Löser"
2014,"Demographics, weather and online reviews: a study of restaurant recommendations.",WWW,"Saeideh Bakhshi,Partha Kanuparthy,Eric Gilbert"
2006,"Generating summaries for large collections of geo-referenced photographs.",WWW,"Alexander Jaffe,Mor Naaman,Tamir Tassa,Marc Davis"
2001,"Breadth-first crawling yields high-quality pages.",WWW,"Marc Najork,Janet L. Wiener"
2019,"SmartDBO: Smart Docker Benchmarking Orchestrator for Web-application.",WWW,"Devki Nandan Jha,Michael Nee,Zhenyu Wen,Albert Y. Zomaya,Rajiv Ranjan"
2020,"Clinical Report Auto-completion.",WWW,"Siddharth Biswal,Cao Xiao,Lucas Glass,M. Brandon Westover,Jimeng Sun"
2007,"A large-scale study of robots.txt.",WWW,"Yang Sun,Ziming Zhuang,C. Lee Giles"
2020,"Characterizing Search-Engine Traffic to Internet Research Agency Web Properties.",WWW,"Alexander Spangher,Gireeja Ranade,Besmira Nushi,Adam Fourney,Eric Horvitz"
2009,"General auction mechanism for search advertising.",WWW,"Gagan Aggarwal,S. Muthukrishnan,Dávid Pál,Martin Pál"
2018,"Detecting Ponzi Schemes on Ethereum: Towards Healthier Blockchain Technology.",WWW,"Weili Chen,Zibin Zheng,Jiahui Cui,Edith C. H. Ngai,Peilin Zheng,Yuren Zhou"
2019,"How Serendipity Improves User Satisfaction with Recommendations? A Large-Scale User Evaluation.",WWW,"Li Chen 0009,Yonghua Yang,Ningxia Wang,Keping Yang,Quan Yuan"
2013,"Lightweight server support for browser-based CSRF protection.",WWW,"Alexei Czeskis,Alexander Moshchuk,Tadayoshi Kohno,Helen J. Wang"
2017,"Web Application Migration with Closure Reconstruction.",WWW,"Jin-woo Kwon,Soo-Mook Moon"
2020,"Voice-based Reformulation of Community Answers.",WWW,"Simone Filice,Nachshon Cohen,David Carmel"
2019,"Anything to Hide? Studying Minified and Obfuscated Code in the Web.",WWW,"Philippe Skolka,Cristian-Alexandru Staicu,Michael Pradel"
2008,"Static query result caching revisited.",WWW,"Rifat Ozcan,Ismail Sengör Altingövde,Özgür Ulusoy"
2009,"Spatio-temporal models for estimating click-through rate.",WWW,"Deepak Agarwal,Bee-Chung Chen,Pradheep Elango"
2018,"Neural Attentional Rating Regression with Review-level Explanations.",WWW,"Chong Chen,Min Zhang 0006,Yiqun Liu 0001,Shaoping Ma"
2004,"Securing web application code by static analysis and runtime protection.",WWW,"Yao-Wen Huang,Fang Yu,Christian Hang,Chung-Hung Tsai,Der-Tsai Lee,Sy-Yen Kuo"
2006,"FLUX: fuzzy content and structure matching of XML range queries.",WWW,"Hua-Gang Li,S. Alireza Aghili,Divyakant Agrawal,Amr El Abbadi"
2020,"Open Knowledge Enrichment for Long-tail Entities.",WWW,"Ermei Cao,Difeng Wang,JiaCheng Huang,Wei Hu"
2006,"Visualizing tags over time.",WWW,"Micah Dubinko,Ravi Kumar 0001,Joseph Magnani,Jasmine Novak,Prabhakar Raghavan,Andrew Tomkins"
2010,"Exploring web scale language models for search query processing.",WWW,"Jian Huang 0002,Jianfeng Gao,Jiangbo Miao,Xiaolong Li,Kuansan Wang,Fritz Behr,C. Lee Giles"
2020,"Graph Representation Learning via Graphical Mutual Information Maximization.",WWW,"Zhen Peng,Wenbing Huang,Minnan Luo,Qinghua Zheng,Yu Rong,Tingyang Xu,Junzhou Huang"
2019,"Redesigning Bitcoin's fee market.",WWW,"Ron Lavi,Or Sattath,Aviv Zohar"
2015,"Secrets, Lies, and Account Recovery: Lessons from the Use of Personal Knowledge Questions at Google.",WWW,"Joseph Bonneau,Elie Bursztein,Ilan Caron,Rob Jackson,Mike Williamson"
2019,"Forecasting U.S. Domestic Migration Using Internet Search Queries.",WWW,"Allen Yilun Lin,Justin Cranshaw,Scott Counts"
2012,"Using content and interactions for discovering communities in social networks.",WWW,"Mrinmaya Sachan,Danish Contractor,Tanveer A. Faruquie,L. Venkata Subramaniam"
2013,"I know the shortened URLs you clicked on Twitter: inference attack using public click analytics and Twitter metadata.",WWW,"Jonghyuk Song,Sangho Lee 0001,Jong Kim 0001"
2008,"Statistical analysis of the social network and discussion threads in slashdot.",WWW,"Vicenç Gómez,Andreas Kaltenbrunner,Vicente López 0002"
2005,"Ranking a stream of news.",WWW,"Gianna M. Del Corso,Antonio Gulli,Francesco Romani"
2009,"Web service derivatives.",WWW,"Thomas Meinl,Benjamin Blau"
2009,"Automated construction of web accessibility models from transaction click-streams.",WWW,"Jalal Mahmud,Yevgen Borodin,I. V. Ramakrishnan,C. R. Ramakrishnan"
2008,"Recrawl scheduling based on information longevity.",WWW,"Christopher Olston,Sandeep Pandey"
2002,"Dynamic coordination of information management services for processing dynamic web content.",WWW,"In-Young Ko,Ke-Thia Yao,Robert Neches"
2019,"Improved Cross-Lingual Question Retrieval for Community Question Answering.",WWW,"Andreas Rücklé,Krishnkant Swarnkar,Iryna Gurevych"
2010,"RESTler: crawling RESTful services.",WWW,"Rosa Alarcón,Erik Wilde"
2013,"On the evolution of the internet economic ecosystem.",WWW,"Richard T. B. Ma,John C. S. Lui,Vishal Misra"
2010,"Co-optimization of multiple relevance metrics in web search.",WWW,"Dong Wang 0022,Chenguang Zhu,Weizhu Chen,Gang Wang 0010,Zheng Chen 0001"
2015,"Uncovering the Small Community Structure in Large Networks: A Local Spectral Approach.",WWW,"Yixuan Li,Kun He 0001,David Bindel,John E. Hopcroft"
2017,"Fairness in Package-to-Group Recommendations.",WWW,"Dimitris Serbos,Shuyao Qi,Nikos Mamoulis,Evaggelia Pitoura,Panayiotis Tsaparas"
2010,"A large-scale active learning system for topical categorization on the web.",WWW,"Suju Rajan,Dragomir Yankov,Scott Gaffney,Adwait Ratnaparkhi"
2010,"Web-scale k-means clustering.",WWW,"D. Sculley"
2002,"Cooperative leases: scalable consistency maintenance in content distribution networks.",WWW,"Anoop George Ninan,Purushottam Kulkarni,Prashant J. Shenoy,Krithi Ramamritham,Renu Tewari"
2017,"A General Model for Out-of-town Region Recommendation.",WWW,"Tuan-Anh Nguyen Pham,Xutao Li,Gao Cong"
2019,"On Attribution of Recurrent Neural Network Predictions via Additive Decomposition.",WWW,"Mengnan Du,Ninghao Liu,Fan Yang 0023,Shuiwang Ji,Xia Hu"
2013,"Steering user behavior with badges.",WWW,"Ashton Anderson,Daniel P. Huttenlocher,Jon M. Kleinberg,Jure Leskovec"
2002,"Parallel crawlers.",WWW,"Junghoo Cho,Hector Garcia-Molina"
2010,"Autonomous resource provisioning for multi-service web applications.",WWW,"Dejun Jiang,Guillaume Pierre,Chi-Hung Chi"
2018,"(Don't) Mention the War: A Comparison of Wikipedia and Britannica Articles on National Histories.",WWW,"Anna Samoilenko,Florian Lemmerich,Maria Zens,Mohsen Jadidi,Mathieu Génois,Markus Strohmaier"
2006,"A user profile-based approach for personal information access: shaping your information portfolio.",WWW,"Lo Ka Kan,Xiang Peng,Irwin King"
2005,"Compiling XSLT 2.0 into XQuery 1.0.",WWW,"Achille Fokoue,Kristoffer Høgsbro Rose,Jérôme Siméon,Lionel Villard"
2016,"A Field Guide to Personalized Reserve Prices.",WWW,"Renato Paes Leme,Martin Pál,Sergei Vassilvitskii"
2007,"XML-based XML schema access.",WWW,"Erik Wilde,Felix Michel"
2003,"Monitoring the dynamic web to respond to continuous queries.",WWW,"Sandeep Pandey,Krithi Ramamritham,Soumen Chakrabarti"
2019,"Listening between the Lines: Learning Personal Attributes from Conversations.",WWW,"Anna Tigunova,Andrew Yates,Paramita Mirza,Gerhard Weikum"
2019,"Improving Neural Response Diversity with Frequency-Aware Cross-Entropy Loss.",WWW,"Shaojie Jiang,Pengjie Ren,Christof Monz,Maarten de Rijke"
2020,"Personalized Employee Training Course Recommendation with Career Development Awareness.",WWW,"Chao Wang 0086,Hengshu Zhu,Chen Zhu,Xi Zhang,Enhong Chen,Hui Xiong 0001"
2007,"GigaHash: scalable minimal perfect hashing for billions of urls.",WWW,"Kumar Chellapilla,Anton Mityagin,Denis Xavier Charles"
2019,"Automatic Boolean Query Refinement for Systematic Review Literature Search.",WWW,"Harrisen Scells,Guido Zuccon,Bevan Koopman"
2020,"An Empirical Study of Android Security Bulletins in Different Vendors.",WWW,"Sadegh Farhang,Mehmet Bahadir Kirdan,Aron Laszka,Jens Grossklags"
2007,"Exhibit: lightweight structured data publishing.",WWW,"David F. Huynh,David R. Karger,Robert C. Miller"
2007,"A large-scale evaluation and analysis of personalized search strategies.",WWW,"Zhicheng Dou,Ruihua Song,Ji-Rong Wen"
2012,"Joint relevance and freshness learning from clickthroughs for news search.",WWW,"Hongning Wang,Anlei Dong,Lihong Li 0001,Yi Chang 0001,Evgeniy Gabrilovich"
2001,"Item-based collaborative filtering recommendation algorithms.",WWW,"Badrul Munir Sarwar,George Karypis,Joseph A. Konstan,John Riedl"
2010,"Using a model of social dynamics to predict popularity of news.",WWW,"Kristina Lerman,Tad Hogg"
2018,"Fast Exact CoSimRank Search on Evolving and Static Graphs.",WWW,"Weiren Yu,Fan Wang"
2007,"Information flow modeling based on diffusion rate for prediction and ranking.",WWW,"Xiaodan Song,Yun Chi,Koji Hino,Belle L. Tseng"
2012,"Learning causality for news events prediction.",WWW,"Kira Radinsky,Sagie Davidovich,Shaul Markovitch"
2012,"Heterogeneous web data search using relevance-based on the fly data integration.",WWW,"Daniel M. Herzig,Thanh Tran 0001"
2019,"Improving Medical Code Prediction from Clinical Text via Incorporating Online Knowledge Sources.",WWW,"Tian Bai,Slobodan Vucetic"
2007,"Acquiring ontological knowledge from query logs.",WWW,"Satoshi Sekine,Hisami Suzuki"
2020,"A Multi-task Learning Framework for Road Attribute Updating via Joint Analysis of Map Data and GPS Traces.",WWW,"Yifang Yin,Jagannadan Varadarajan,Guanfeng Wang,Xueou Wang,Dhruva Sahrawat,Roger Zimmermann,See-Kiong Ng"
2012,"CloudGenius: decision support for web server cloud migration.",WWW,"Michael Menzel 0002,Rajiv Ranjan"
2013,"DIGTOBI: a recommendation system for Digg articles using probabilistic modeling.",WWW,"Younghoon Kim,Yoonjae Park,Kyuseok Shim"
2003,"DNS-enhanced web for faster content delivery.",WWW,"Balachander Krishnamurthy,Richard Liston,Michael Rabinovich"
2004,"Newsjunkie: providing personalized newsfeeds via analysis of information novelty.",WWW,"Evgeniy Gabrilovich,Susan T. Dumais,Eric Horvitz"
2015,"Enquiring Minds: Early Detection of Rumors in Social Media from Enquiry Posts.",WWW,"Zhe Zhao,Paul Resnick,Qiaozhu Mei"
2012,"Mining photo-sharing websites to study ecological phenomena.",WWW,"Haipeng Zhang,Mohammed Korayem,David J. Crandall,Gretchen LeBuhn"
2007,"Robust web page segmentation for mobile terminal using content-distances and page layout information.",WWW,"Gen Hattori,Keiichiro Hoashi,Kazunori Matsumoto,Fumiaki Sugaya"
2006,"Context-orientated news riltering for web 2.0 and beyond.",WWW,"David Webster,Weihong Huang,Darren Mundy,Paul Warren"
2019,"Bootstrapping Domain-Specific Content Discovery on the Web.",WWW,"Kien Pham,Aécio S. R. Santos,Juliana Freire"
2014,"Deduplicating a places database.",WWW,"Nilesh N. Dalvi,Marian Olteanu,Manish Raghavan,Philip Bohannon"
2016,"As Time Goes By: Comprehensive Tagging of Textual Phrases with Temporal Scopes.",WWW,"Erdal Kuzey,Vinay Setty,Jannik Strötgen,Gerhard Weikum"
2019,"Online Learning for Measuring Incentive Compatibility in Ad Auctions?",WWW,"Zhe Feng 0004,Okke Schrijvers,Eric Sodomka"
2010,"Distributing private data in challenged network environments.",WWW,"Azarias Reda,Brian D. Noble,Yidnekachew Haile"
2006,"A case for software assurance.",WWW,"Mary Ann Davidson"
2020,"Guiding Corpus-based Set Expansion by Auxiliary Sets Generation and Co-Expansion.",WWW,"Jiaxin Huang,Yiqing Xie,Yu Meng 0001,Jiaming Shen,Yunyi Zhang,Jiawei Han 0001"
2020,"IART: Intent-aware Response Ranking with Transformers in Information-seeking Conversation Systems.",WWW,"Liu Yang 0005,Minghui Qiu,Chen Qu,Cen Chen,Jiafeng Guo,Yongfeng Zhang,W. Bruce Croft,Haiqing Chen"
2010,"Enterprise and desktop search.",WWW,"Pavel A. Dmitriev,Pavel Serdyukov,Sergey Chernov 0001"
2006,"Template guided association rule mining from XML documents.",WWW,"Rahman Ali Mohammadzadeh,Sadegh Soltan,Masoud Rahgozar"
2020,"Traveling the token world: A graph analysis of Ethereum ERC20 token ecosystem.",WWW,"Weili Chen,Tuo Zhang,Zhiguang Chen,Zibin Zheng,Yutong Lu"
2017,"Deals or No Deals: Contract Design for Online Advertising.",WWW,"Vahab S. Mirrokni,Hamid Nazerzadeh"
2001,"Mining web logs to improve website organization.",WWW,"Ramakrishnan Srikant,Yinghui Yang 0001"
2020,"The Representativeness of Automated Web Crawls as a Surrogate for Human Browsing.",WWW,"David Zeber,Sarah Bird,Camila Oliveira,Walter Rudametkin,Ilana Segall,Fredrik Wollsén,Martin Lopatka"
2001,"PicASHOW: pictorial authority search by hyperlinks on the Web.",WWW,"Ronny Lempel,Aya Soffer"
2019,"Automatic Generation of Pattern-controlled Product Description in E-commerce.",WWW,"Tao Zhang,Jin Zhang,Chengfu Huo,Weijun Ren"
2008,"Learning transportation mode from raw gps data for geographic applications on the web.",WWW,"Yu Zheng 0004,Like Liu,Longhao Wang,Xing Xie 0001"
2002,"Law-governed peer-to-peer auctions.",WWW,"Marcus Fontoura,Mihail F. Ionescu,Naftaly H. Minsky"
2007,"Exposing private information by timing web applications.",WWW,"Andrew Bortz,Dan Boneh"
2009,"Compressed web indexes.",WWW,"Flavio Chierichetti,Ravi Kumar 0001,Prabhakar Raghavan"
2001,"Integrating the document object model with hyperlinks for enhanced topic distillation and information extraction.",WWW,"Soumen Chakrabarti"
2020,"Matching Cross Network for Learning to Rank in Personal Search.",WWW,"Zhen Qin 0002,Zhongliang Li,Michael Bendersky,Donald Metzler"
2016,"Representing Documents via Latent Keyphrase Inference.",WWW,"Jialu Liu,Xiang Ren 0001,Jingbo Shang,Taylor Cassidy,Clare R. Voss,Jiawei Han 0001"
2006,"The new economy: an engineer's perspective.",WWW,"David Brown"
2001,"XML Query Forms (XQForms): Declarative Specification of XML Query Interfaces",WWW,"Michalis Petropoulos,Vasilis Vassalos,Yannis Papakonstantinou"
2008,"Planetary-scale views on a large instant-messaging network.",WWW,"Jure Leskovec,Eric Horvitz"
2018,"Parabel: Partitioned Label Trees for Extreme Classification with Application to Dynamic Search Advertising.",WWW,"Yashoteja Prabhu,Anil Kag,Shrutendra Harsola,Rahul Agrawal,Manik Varma"
